id,conversation_id,created_at,date,time,timezone,user_id,username,name,place,tweet,language,mentions,urls,photos,replies_count,retweets_count,likes_count,hashtags,cashtags,link,retweet,quote_url,video,thumbnail,near,geo,source,user_rt_id,user_rt,retweet_id,reply_to,retweet_date,translate,trans_src,trans_dest
1509266749140738049,1509266749140738049,2022-03-30 16:30:08 Eastern Daylight Time,2022-03-30,16:30:08,-0400,22186148,agtoddrokita,Todd Rokita,,"Tomorrow my team is bringing our office to you! Stop by the Goshen Public Library from 10:30am-12:30pm for help with robocalls, unclaimed property searches, and consumer complaints.",en,[],[],[],3,0,3,[],[],https://twitter.com/AGToddRokita/status/1509266749140738049,False,,0,,,,,,,,[],,,,
1509222921830641664,1509222921830641664,2022-03-30 13:35:59 Eastern Daylight Time,2022-03-30,13:35:59,-0400,22186148,agtoddrokita,Todd Rokita,,"Last weekend alone, more than 2,500 illegal immigrants crossed our southern border into the US – and Biden’s policies are only making this crisis worse. This is not just a border state issue. It's an all-state issue.  https://t.co/NAueGJ0L1z",en,[],['https://www.foxnews.com/opinion/biden-border-rule-illegal-immigration-brandon-judd'],[],10,3,9,[],[],https://twitter.com/AGToddRokita/status/1509222921830641664,False,,0,,,,,,,,[],,,,
1509194088331026438,1509194088331026438,2022-03-30 11:41:24 Eastern Daylight Time,2022-03-30,11:41:24,-0400,22186148,agtoddrokita,Todd Rokita,,We are not letting up in the fight against robocalls! We reached an historic agreement with Piratel after just a few months of negotiations. Read more about how we are protecting Hoosiers:  https://t.co/5erF9xnJ68,en,[],['https://tinyurl.com/5hamcb8p'],[],6,2,9,[],[],https://twitter.com/AGToddRokita/status/1509194088331026438,False,,0,,,,,,,,[],,,,
1508836686846955521,1508836686846955521,2022-03-29 12:01:13 Eastern Daylight Time,2022-03-29,12:01:13,-0400,22186148,agtoddrokita,Todd Rokita,,"The feds have no good reason to keep mandating masks at public transportation hubs and on commercial planes, buses, trains, ships and other vehicles. Read more about our ongoing fight for Hoosiers’ liberties:  https://t.co/fyebuEpwYB",en,[],['https://tinyurl.com/yc59h4w3'],[],22,4,29,[],[],https://twitter.com/AGToddRokita/status/1508836686846955521,False,,0,,,,,,,,[],,,,
1508801277156896775,1508801277156896775,2022-03-29 09:40:31 Eastern Daylight Time,2022-03-29,09:40:31,-0400,22186148,agtoddrokita,Todd Rokita,,My team was busy yesterday in Plymouth at the city council meeting. Civic events like this are a great way to be engaged in our communities.  https://t.co/GUGyiW6ssC,en,[],[],['https://pbs.twimg.com/media/FPBWvhAX0Ao__EL.jpg'],7,1,8,[],[],https://twitter.com/AGToddRokita/status/1508801277156896775,False,,1,https://pbs.twimg.com/media/FPBWvhAX0Ao__EL.jpg,,,,,,,[],,,,
1508551625258029060,1508551625258029060,2022-03-28 17:08:29 Eastern Daylight Time,2022-03-28,17:08:29,-0400,22186148,agtoddrokita,Todd Rokita,,Spring break should be a time of relaxation and recharging — not a source of worry and stress. Make sure you do your homework when booking your vacation and scheduling activities once you get to your destination. Read more on spring break safety here:  https://t.co/151c62F9AW,en,[],['https://tinyurl.com/2p9dw74p'],[],2,0,4,[],[],https://twitter.com/AGToddRokita/status/1508551625258029060,False,,0,,,,,,,,[],,,,
1508496361720885257,1508496361720885257,2022-03-28 13:28:53 Eastern Daylight Time,2022-03-28,13:28:53,-0400,22186148,agtoddrokita,Todd Rokita,,Robocalls are a constant hassle to Hoosiers. Sign up for the Indiana Do Not Call List here:  https://t.co/DwKLgriAm9,en,[],['https://tinyurl.com/4ry65h6b'],[],5,2,10,[],[],https://twitter.com/AGToddRokita/status/1508496361720885257,False,,0,,,,,,,,[],,,,
1508081638198108165,1508081638198108165,2022-03-27 10:00:56 Eastern Daylight Time,2022-03-27,10:00:56,-0400,22186148,agtoddrokita,Todd Rokita,,"Spring break is a time to have fun, but it’s also a time to be aware. If you notice something out the ordinary, say something. Human trafficking can occur in any community, just as anyone can be the victim of any kind of crime. Text 233733 to report a tip.",en,[],[],[],11,5,12,[],[],https://twitter.com/AGToddRokita/status/1508081638198108165,False,,0,,,,,,,,[],,,,
1507719083361513477,1507719083361513477,2022-03-26 10:00:16 Eastern Daylight Time,2022-03-26,10:00:16,-0400,22186148,agtoddrokita,Todd Rokita,,My office is fighting daily to defend Hoosiers’ liberties. Learn more about our work by signing up for the Rokita Review here:  https://t.co/FuscpOLNg8  https://t.co/hYMllpDQgu,en,[],['https://tinyurl.com/2p9a4uww'],[],21,2,19,[],[],https://twitter.com/AGToddRokita/status/1507719083361513477,False,,1,https://pbs.twimg.com/ext_tw_video_thumb/1507717915528896519/pu/img/LLEPASiAXYaZZ9nu.jpg,,,,,,,[],,,,
1507379342678147080,1507379342678147080,2022-03-25 11:30:15 Eastern Daylight Time,2022-03-25,11:30:15,-0400,22186148,agtoddrokita,Todd Rokita,,"This week is National Agriculture week, but here in Indiana, we celebrate our farmers every day. Hoosiers are proud of such distinctions as ranking 10th in national agricultural production.  https://t.co/h830SkxTjg",en,[],[],['https://pbs.twimg.com/media/FOtJhflWYAEa7o1.jpg'],5,2,16,[],[],https://twitter.com/AGToddRokita/status/1507379342678147080,False,,1,https://pbs.twimg.com/media/FOtJhflWYAEa7o1.jpg,,,,,,,[],,,,
1507055092515680258,1507055092515680258,2022-03-24 14:01:48 Eastern Daylight Time,2022-03-24,14:01:48,-0400,22186148,agtoddrokita,Todd Rokita,,"Human trafficking is increasing around the world, and it happens in our own back yard. As you head out for spring break, be on the lookout for signs. Read more here:  https://t.co/s9feNMfRoH",en,[],['https://humantraffickinghotline.org/state/indiana'],[],7,1,9,[],[],https://twitter.com/AGToddRokita/status/1507055092515680258,False,,0,,,,,,,,[],,,,
1506971593150369805,1506971593150369805,2022-03-24 08:30:00 Eastern Daylight Time,2022-03-24,08:30:00,-0400,22186148,agtoddrokita,Todd Rokita,,Today my office is spreading the word about unclaimed property in New Haven at the city hall from 1-3. My office has returned $12 million and counting so far to Hoosiers in 2022. Check and see if you have unclaimed property here:  https://t.co/vUaBqcPZ7b  https://t.co/34PpVcGhjO,en,[],['http://www.indianaunclaimed.gov'],[],1,2,10,[],[],https://twitter.com/AGToddRokita/status/1506971593150369805,False,,1,https://pbs.twimg.com/ext_tw_video_thumb/1506715781870100483/pu/img/XE95JLVf4BHdouDW.jpg,,,,,,,[],,,,
1506785134371999747,1506785134371999747,2022-03-23 20:09:05 Eastern Daylight Time,2022-03-23,20:09:05,-0400,22186148,agtoddrokita,Todd Rokita,,Many Hoosiers who were part of the Equifax settlement will soon be mailed prepaid Mastercard debit cards. These will be sent to individuals who did not cash their checks or access their digital payments.  https://t.co/1hFVa4wCsv,en,[],['https://www.indianaequifaxclaims.com/Home/FAQs'],[],2,4,12,[],[],https://twitter.com/AGToddRokita/status/1506785134371999747,False,,0,,,,,,,,[],,,,
1506714946456936459,1506714946456936459,2022-03-23 15:30:11 Eastern Daylight Time,2022-03-23,15:30:11,-0400,22186148,agtoddrokita,Todd Rokita,,"We fight for life at every opportunity. On behalf of Hoosiers, I am proud to support South Carolina’s right to enforce its Fetal Heartbeat and Protection from Abortion Act. Read our 21-state brief:  https://t.co/U6KybDkoPu",en,[],['https://tinyurl.com/bd35mh2b'],[],18,2,28,[],[],https://twitter.com/AGToddRokita/status/1506714946456936459,False,,0,,,,,,,,[],,,,
1506683173396221957,1506683173396221957,2022-03-23 13:23:56 Eastern Daylight Time,2022-03-23,13:23:56,-0400,22186148,agtoddrokita,Todd Rokita,,"Indiana’s drug problem is getting more severe with the absence of border security. In less than 48 hours, drugs make their way to Indiana after crossing the border. The arrival time will accelerate once I-69 construction in Texas is complete!   https://t.co/hjpN8YxxtG",en,[],['https://tinyurl.com/yc589s88'],[],18,5,12,[],[],https://twitter.com/AGToddRokita/status/1506683173396221957,False,,0,,,,,,,,[],,,,
1506626456515973126,1506626456515973126,2022-03-23 09:38:33 Eastern Daylight Time,2022-03-23,09:38:33,-0400,22186148,agtoddrokita,Todd Rokita,,"No state has the right to impose climate-change policy on Indiana and the rest of the nation, as Delaware is trying to do. That’s why we’re leading a 13-state coalition against this overreach. Read more:   https://t.co/OBvFnLPojo",en,[],['https://tinyurl.com/2b4cr3ce'],[],16,5,33,[],[],https://twitter.com/AGToddRokita/status/1506626456515973126,False,,0,,,,,,,,[],,,,
1506406167966208000,1506406167966208000,2022-03-22 19:03:12 Eastern Daylight Time,2022-03-22,19:03:12,-0400,22186148,agtoddrokita,Todd Rokita,,"Congrats to Patricia Strachan, deputy attorney general in our office, for being honored with the Indy Bar’s 2022 Mentorship Award tonight! I am proud of her servant leadership.  https://t.co/BtexuZvibb",en,[],[],['https://pbs.twimg.com/media/FOfUa_8VQAANrNT.jpg'],3,3,16,[],[],https://twitter.com/AGToddRokita/status/1506406167966208000,False,,1,https://pbs.twimg.com/media/FOfUa_8VQAANrNT.jpg,,,,,,,[],,,,
1506352331486605319,1506352331486605319,2022-03-22 15:29:17 Eastern Daylight Time,2022-03-22,15:29:17,-0400,22186148,agtoddrokita,Todd Rokita,,My team enjoyed attending the meeting of the LaGrange County Council on Aging yesterday. It’s truly a joy to stay connected with all our great Hoosier communities.  https://t.co/uuxtzlGBKk,en,[],[],"['https://pbs.twimg.com/media/FOejcjzXEAIElB0.jpg', 'https://pbs.twimg.com/media/FOejcjxXsAgAQO0.jpg']",4,1,8,[],[],https://twitter.com/AGToddRokita/status/1506352331486605319,False,,1,https://pbs.twimg.com/media/FOejcjzXEAIElB0.jpg,,,,,,,[],,,,
1506080160952553486,1506080158473728000,2022-03-21 21:27:46 Eastern Daylight Time,2022-03-21,21:27:46,-0400,22186148,agtoddrokita,Todd Rokita,,The Governor was correct to sign this manifestation of our God-given Second Amendment right into code and he should be recognized for that.,en,[],[],[],22,8,37,[],[],https://twitter.com/AGToddRokita/status/1506080160952553486,False,,0,,,,,,,,[],,,,
1506080158473728000,1506080158473728000,2022-03-21 21:27:46 Eastern Daylight Time,2022-03-21,21:27:46,-0400,22186148,agtoddrokita,Todd Rokita,,"We will defend any attacks on constitutional carry and remain committed not only to the right to defend ourselves and our families, but to the great women and men of law enforcement statewide.",en,[],[],[],19,7,51,[],[],https://twitter.com/AGToddRokita/status/1506080158473728000,False,https://twitter.com/indystar/status/1506051295966375944,0,,,,,,,,[],,,,
1506073632216387585,1506073632216387585,2022-03-21 21:01:50 Eastern Daylight Time,2022-03-21,21:01:50,-0400,22186148,agtoddrokita,Todd Rokita,,We stand by the law and will vigorously defend it in court if and hopefully when the General Assembly overrides the veto.,en,[],[],[],52,21,113,[],[],https://twitter.com/AGToddRokita/status/1506073632216387585,False,https://twitter.com/indystar/status/1506043746256924674,0,,,,,,,,[],,,,
1505997621957124109,1505997621957124109,2022-03-21 15:59:47 Eastern Daylight Time,2022-03-21,15:59:47,-0400,22186148,agtoddrokita,Todd Rokita,,"Last week I awarded my office’s first ever Public Service Award. Julia Payne, who is in the Solicitor General’s division, was nominated and won. She has gone above and beyond in her work and serves Hoosiers well. Congratulations, Julia!  https://t.co/w2LrVc5pBg",en,[],[],"['https://pbs.twimg.com/media/FOZgx7AWYAIboDj.jpg', 'https://pbs.twimg.com/media/FOZg1GzWUAoo5Ge.jpg']",9,2,17,[],[],https://twitter.com/AGToddRokita/status/1505997621957124109,False,,1,https://pbs.twimg.com/media/FOZgx7AWYAIboDj.jpg,,,,,,,[],,,,
1505901256665096197,1505901256665096197,2022-03-21 09:36:52 Eastern Daylight Time,2022-03-21,09:36:52,-0400,22186148,agtoddrokita,Todd Rokita,,"Buying a home is a lot of Hoosiers’ dream, but some companies may try to take advantage of you during the buying process. Read more here before considering a rent-to-own agreement.  https://t.co/xb06VAYrq9",en,[],['https://tinyurl.com/2w97rxrv'],[],2,2,5,[],[],https://twitter.com/AGToddRokita/status/1505901256665096197,False,,0,,,,,,,,[],,,,
1505205979700666368,1505205979700666368,2022-03-19 11:34:05 Eastern Daylight Time,2022-03-19,11:34:05,-0400,22186148,agtoddrokita,Todd Rokita,,"Indiana is fortunate to have had Steve Creason serving in the Office of Attorney General for 23 years. Steve has now begun a new public service role as Magistrate in the Marion County Circuit Court and though we are sorry to lose him, we wish him all the best!  https://t.co/cHWcNGuqyF",en,[],[],['https://pbs.twimg.com/media/FOOQ2xUVsAE6D9G.jpg'],8,1,15,[],[],https://twitter.com/AGToddRokita/status/1505205979700666368,False,,1,https://pbs.twimg.com/media/FOOQ2xUVsAE6D9G.jpg,,,,,,,[],,,,
1504913223505649665,1504913223505649665,2022-03-18 16:10:47 Eastern Daylight Time,2022-03-18,16:10:47,-0400,22186148,agtoddrokita,Todd Rokita,,"Good luck to Wabash College basketball in the NCAA Division III Final Four tonight in Fort Wayne! If you’re looking for tickets to the game, or other March Madness games, be on the lookout for scams. Learn more:  https://t.co/zFfErGhRWb  #WAF  https://t.co/Hyv5KPxW9G",en,[],['https://www.bbb.org/article/news-releases/13986-bbb-tip-buying-tickets'],['https://pbs.twimg.com/media/FOKGmYCXMAEFafV.jpg'],2,1,8,['waf'],[],https://twitter.com/AGToddRokita/status/1504913223505649665,False,,1,https://pbs.twimg.com/media/FOKGmYCXMAEFafV.jpg,,,,,,,[],,,,
1504813724317720604,1504813724317720604,2022-03-18 09:35:24 Eastern Daylight Time,2022-03-18,09:35:24,-0400,22186148,agtoddrokita,Todd Rokita,,Keep up to date with the latest updates from my office by subscribing to the Rokita Review where liberty is always in action. Subscribe for updates here:  https://t.co/FuscpOLNg8,en,[],['https://tinyurl.com/2p9a4uww'],[],7,1,6,[],[],https://twitter.com/AGToddRokita/status/1504813724317720604,False,,0,,,,,,,,[],,,,
1504562638885433350,1504562638885433350,2022-03-17 16:57:41 Eastern Daylight Time,2022-03-17,16:57:41,-0400,22186148,agtoddrokita,Todd Rokita,,Feeling lucky? Find out if you have any unclaimed property by checking out the Indiana Unclaimed Property website here:  https://t.co/vUaBqcyofD  https://t.co/RpbntmsT7v,en,[],['http://www.indianaunclaimed.gov'],[],3,1,5,[],[],https://twitter.com/AGToddRokita/status/1504562638885433350,False,,1,https://pbs.twimg.com/ext_tw_video_thumb/1504562550771437572/pu/img/fE2X_usmr5fj36VX.jpg,,,,,,,[],,,,
1504466784002453507,1504466784002453507,2022-03-17 10:36:47 Eastern Daylight Time,2022-03-17,10:36:47,-0400,22186148,agtoddrokita,Todd Rokita,,See what waits at the end of the rainbow and test your luck with a search for your unclaimed property. It’s easier than finding a four-leaf clover. Read more here:  https://t.co/jgHVEDVdDC,en,[],['https://tinyurl.com/y6nw2wbk'],[],1,1,2,[],[],https://twitter.com/AGToddRokita/status/1504466784002453507,False,,0,,,,,,,,[],,,,
1504180371906306052,1504180371906306052,2022-03-16 15:38:41 Eastern Daylight Time,2022-03-16,15:38:41,-0400,22186148,agtoddrokita,Todd Rokita,,"There are building materials for the border wall just sitting and rotting all on long along the border. You, the taxpayer, paid for those materials and Biden is purposely letting them go to waste. This carelessness is not helping Americans.  https://t.co/Kf97cLqAK0",en,[],[],[],446,19,63,[],[],https://twitter.com/AGToddRokita/status/1504180371906306052,False,,1,https://pbs.twimg.com/ext_tw_video_thumb/1504180301844697092/pu/img/kdlGzii0iLbNaQ1w.jpg,,,,,,,[],,,,
1504097481612832771,1504097481612832771,2022-03-16 10:09:19 Eastern Daylight Time,2022-03-16,10:09:19,-0400,22186148,agtoddrokita,Todd Rokita,,I am now on Truth Social where the first amendment and free speech is respected and protected. Follow me on the TRUTH app @AGToddRokita!,en,"[{'screen_name': 'agtoddrokita', 'name': 'todd rokita', 'id': '22186148'}]",[],[],109,4,33,[],[],https://twitter.com/AGToddRokita/status/1504097481612832771,False,,0,,,,,,,,[],,,,
1503885918217908224,1503885918217908224,2022-03-15 20:08:38 Eastern Daylight Time,2022-03-15,20:08:38,-0400,22186148,agtoddrokita,Todd Rokita,,"Border crossings are going up—February saw almost 10,000 more illegal immigrants than January. Biden’s open border means more human trafficking, drugs, and crime. We must protect our nation’s southern border and our national security.",en,[],[],[],23,14,22,[],[],https://twitter.com/AGToddRokita/status/1503885918217908224,False,https://twitter.com/AdamShawNY/status/1503733046243172354,0,,,,,,,,[],,,,
1503835514255908879,1503835514255908879,2022-03-15 16:48:21 Eastern Daylight Time,2022-03-15,16:48:21,-0400,22186148,agtoddrokita,Todd Rokita,,Excited to be on the show tonight! Tune in to hear my latest update.,en,[],[],[],5,2,9,[],[],https://twitter.com/AGToddRokita/status/1503835514255908879,False,https://twitter.com/jsolomonReports/status/1503830051560767491,0,,,,,,,,[],,,,
1503731027214274565,1503731027214274565,2022-03-15 09:53:09 Eastern Daylight Time,2022-03-15,09:53:09,-0400,22186148,agtoddrokita,Todd Rokita,,"My office is participating in Women’s History Month all throughout the state. They visited Viewpoint Books, the second oldest full-service bookstore in Indiana. It's located in Columbus and is woman-owned. If you’re ever in the area, you should check it out!  https://t.co/KMJl6P5mzx",en,[],[],['https://pbs.twimg.com/media/FN5TZJBXsAwjwxR.jpg'],15,1,9,[],[],https://twitter.com/AGToddRokita/status/1503731027214274565,False,,1,https://pbs.twimg.com/media/FN5TZJBXsAwjwxR.jpg,,,,,,,[],,,,
1503427035888328709,1503427032637652994,2022-03-14 13:45:12 Eastern Daylight Time,2022-03-14,13:45:12,-0400,22186148,agtoddrokita,Todd Rokita,,"With cybersecurity crimes up 54%, it’s imperative to understand evolving threats, manage risk and enforce a cybersecurity plan to protect public funds. My office helps with data privacy--file a complaint or access resources here:  https://t.co/Pb02lEolyv",en,[],['https://tinyurl.com/yckrf3fd'],[],2,0,1,[],[],https://twitter.com/AGToddRokita/status/1503427035888328709,False,,0,,,,,,,,[],,,,
1503427032637652994,1503427032637652994,2022-03-14 13:45:11 Eastern Daylight Time,2022-03-14,13:45:11,-0400,22186148,agtoddrokita,Todd Rokita,,Jillean Battle from my office gave a presentation to county treasurers this week for National Consumer Protection Week on data security. Data security is crucial for all levels of government.  https://t.co/NXjhI8Wiq5,en,[],[],['https://pbs.twimg.com/media/FN0-04nXsAYFtyL.jpg'],4,2,2,[],[],https://twitter.com/AGToddRokita/status/1503427032637652994,False,,1,https://pbs.twimg.com/media/FN0-04nXsAYFtyL.jpg,,,,,,,[],,,,
1503414954216591362,1503414954216591362,2022-03-14 12:57:11 Eastern Daylight Time,2022-03-14,12:57:11,-0400,22186148,agtoddrokita,Todd Rokita,,"I enjoyed my tour last week of @TelamonCorp in Carmel. They have partnered with Vincennes &amp; Purdue to give students an opportunity to participate in robotics. When forward-thinking companies invest in Indiana, all Hoosiers benefit! Check out the website:  https://t.co/0lCbX6SR1j  https://t.co/tC3R0Ro1Xb",en,"[{'screen_name': 'telamoncorp', 'name': 'telamon corporation', 'id': '179187602'}]",['https://www.telamon.com/about/'],['https://pbs.twimg.com/media/FN0z46LWYAAJ6sJ.jpg'],2,2,10,[],[],https://twitter.com/AGToddRokita/status/1503414954216591362,False,,1,https://pbs.twimg.com/media/FN0z46LWYAAJ6sJ.jpg,,,,,,,[],,,,
1502368971198246918,1502368971198246918,2022-03-11 14:40:50 Eastern Standard Time,2022-03-11,14:40:50,-0400,22186148,agtoddrokita,Todd Rokita,,National Consumer Protection Week is a good time to remember that most robocalls are scammers trying to steal your hard-earned money and personal information. Click here for important steps to protect yourself.  https://t.co/romWfuabbV,en,[],['https://tinyurl.com/mrjmebym'],[],3,1,4,[],[],https://twitter.com/AGToddRokita/status/1502368971198246918,False,,0,,,,,,,,[],,,,
1502335069897342981,1502335069897342981,2022-03-11 12:26:07 Eastern Standard Time,2022-03-11,12:26:07,-0400,22186148,agtoddrokita,Todd Rokita,,I loved talking with industry leaders and Hoosier truck drivers at the Work Truck Industry Trade Show at the Indiana Convention Center. What better place to hold the show than the Crossroads of America!  https://t.co/jab7fFA5id,en,[],[],"['https://pbs.twimg.com/media/FNldq5fXoAQ3kPy.jpg', 'https://pbs.twimg.com/media/FNlduhQXEAU1YID.jpg', 'https://pbs.twimg.com/media/FNldnq6XsAgHAYY.jpg', 'https://pbs.twimg.com/media/FNldv7yX0AMD3kL.jpg']",6,1,11,[],[],https://twitter.com/AGToddRokita/status/1502335069897342981,False,,1,https://pbs.twimg.com/media/FNldq5fXoAQ3kPy.jpg,,,,,,,[],,,,
1502034094271651843,1502034094271651843,2022-03-10 16:30:09 Eastern Standard Time,2022-03-10,16:30:09,-0400,22186148,agtoddrokita,Todd Rokita,,"Parents finally have the right to be heard. As we pointed out in the Parents’ Bill of Rights, it was not mandatory that school boards hear testimony. The legislators have now corrected this, but there’s much more work to be done.  https://t.co/z8LrU5XoMV",en,[],['https://tinyurl.com/24eh7jtk'],[],5,3,30,[],[],https://twitter.com/AGToddRokita/status/1502034094271651843,False,,0,,,,,,,,[],,,,
1502011886610653189,1502011886610653189,2022-03-10 15:01:54 Eastern Standard Time,2022-03-10,15:01:54,-0400,22186148,agtoddrokita,Todd Rokita,,Protecting Hoosiers is my top priority. Data privacy is an increasingly important issue and National Consumer Protection Week is a great time to make sure you’re doing all you can to keep yourself and your family safe. Click for more info:  https://t.co/Nw3pQVThlK,en,[],['https://tinyurl.com/yhp9s2bu'],[],13,3,11,[],[],https://twitter.com/AGToddRokita/status/1502011886610653189,False,,0,,,,,,,,[],,,,
