id,conversation_id,created_at,date,time,timezone,user_id,username,name,place,tweet,language,mentions,urls,photos,replies_count,retweets_count,likes_count,hashtags,cashtags,link,retweet,quote_url,video,thumbnail,near,geo,source,user_rt_id,user_rt,retweet_id,reply_to,retweet_date,translate,trans_src,trans_dest
1508503395673546757,1508503395673546757,2022-03-28 13:56:50 Eastern Daylight Time,2022-03-28,13:56:50,-0400,903636248308436992,kayiveyforgov,Kay Ivey,,No step too high for a high stepper! #alpolitics    https://t.co/JuS5AoVOXS,en,[],['https://yellowhammernews.com/no-step-too-high-for-a-high-stepper-ivey-featured-at-shooting-range-in-latest-campaign-tv-ad/'],[],10,5,38,['alpolitics'],[],https://twitter.com/kayiveyforgov/status/1508503395673546757,False,,0,,,,,,,,[],,,,
1508438246237380609,1508438246237380609,2022-03-28 09:37:57 Eastern Daylight Time,2022-03-28,09:37:57,-0400,903636248308436992,kayiveyforgov,Kay Ivey,,"In Alabama, we're going to keep putting lead on target.  https://t.co/OGy83GoIY1",en,[],[],[],49,73,400,[],[],https://twitter.com/kayiveyforgov/status/1508438246237380609,False,,1,https://pbs.twimg.com/ext_tw_video_thumb/1508437328439689219/pu/img/ooF77VO969JqtGIb.jpg,,,,,,,[],,,,
1507026962606342149,1507026962606342149,2022-03-24 12:10:01 Eastern Daylight Time,2022-03-24,12:10:01,-0400,903636248308436992,kayiveyforgov,Kay Ivey,,"I promised to make Alabama the MOST Pro-life state in the country, and that's exactly what I've done. If you want ME fighting for the unborn for four more years, support my re-election campaign today! Chip in &gt;&gt;   https://t.co/X2fC7IpA6H",en,[],['https://bit.ly/3IBkFUe'],[],9,3,16,[],[],https://twitter.com/kayiveyforgov/status/1507026962606342149,False,,0,,,,,,,,[],,,,
1506730292157030406,1506730292157030406,2022-03-23 16:31:10 Eastern Daylight Time,2022-03-23,16:31:10,-0400,903636248308436992,kayiveyforgov,Kay Ivey,,#alpolitics,und,[],[],[],2,2,17,['alpolitics'],[],https://twitter.com/kayiveyforgov/status/1506730292157030406,False,https://twitter.com/1819News/status/1506684737821319181,0,,,,,,,,[],,,,
1506663319431790593,1506663319431790593,2022-03-23 12:05:02 Eastern Daylight Time,2022-03-23,12:05:02,-0400,903636248308436992,kayiveyforgov,Kay Ivey,,"Our campaign to keep fighting for Alabama is looking STRONG in the polls, and I want to keep you in the loop on this race.  Stay up to date on all the latest by signing up for campaign alerts here &gt;&gt;  https://t.co/Etwpu1t1Im",en,[],['https://bit.ly/36JBXS9'],[],6,0,8,[],[],https://twitter.com/kayiveyforgov/status/1506663319431790593,False,,0,,,,,,,,[],,,,
