id,conversation_id,created_at,date,time,timezone,user_id,username,name,place,tweet,language,mentions,urls,photos,replies_count,retweets_count,likes_count,hashtags,cashtags,link,retweet,quote_url,video,thumbnail,near,geo,source,user_rt_id,user_rt,retweet_id,reply_to,retweet_date,translate,trans_src,trans_dest
1502304297106743305,1502304297106743305,2022-03-11 10:23:50 Eastern Standard Time,2022-03-11,10:23:50,-0400,269992801,asahutchinson,Gov. Asa Hutchinson,,Great way to start March madness with an early morning full court game of Bball with some fantastic guys.  https://t.co/LPFzk3ugSw,en,[],[],['https://pbs.twimg.com/media/FNlBy0QWYAUe69k.jpg'],9,6,116,[],[],https://twitter.com/AsaHutchinson/status/1502304297106743305,False,,1,https://pbs.twimg.com/media/FNlBy0QWYAUe69k.jpg,,,,,,,[],,,,
1502047799382319113,1502047799382319113,2022-03-10 17:24:36 Eastern Standard Time,2022-03-10,17:24:36,-0400,269992801,asahutchinson,Gov. Asa Hutchinson,,"When it comes to rice, no state grows it like Arkansas. This morning I met with rice farmers from across the state as part of @RicelandFoods In-Depth Leadership Class. We’re proud of Arkansas rice farmers who work hard to make us number one! @usaricenews @RiceArkansas  https://t.co/Zq0020PDpX",en,"[{'screen_name': 'ricelandfoods', 'name': 'riceland foods', 'id': '1380259352'}, {'screen_name': 'usaricenews', 'name': 'usa rice', 'id': '2291602766'}, {'screen_name': 'ricearkansas', 'name': 'arkansas rice', 'id': '302368531'}]",[],"['https://pbs.twimg.com/media/FNhXtjpWQAYzDRj.jpg', 'https://pbs.twimg.com/media/FNhXtjoXIAwb-aA.jpg']",8,13,78,[],[],https://twitter.com/AsaHutchinson/status/1502047799382319113,False,,1,https://pbs.twimg.com/media/FNhXtjpWQAYzDRj.jpg,,,,,,,[],,,,
1501974493190934533,1501759647837036546,2022-03-10 12:33:19 Eastern Standard Time,2022-03-10,12:33:19,-0400,269992801,asahutchinson,Gov. Asa Hutchinson,,"@NWAChip @BentonvilleHS @nwademgaz Fun story and Abel is correct, his jump shot is a lot better than mine.  Thanks for sharing.",en,[],[],[],1,0,6,[],[],https://twitter.com/AsaHutchinson/status/1501974493190934533,False,,0,,,,,,,,"[{'screen_name': 'NWAChip', 'name': 'Chip Souza | #whatelseyougot?', 'id': '66459579'}, {'screen_name': 'BentonvilleHS', 'name': 'Bentonville Tigers', 'id': '3253656960'}, {'screen_name': 'nwademgaz', 'name': 'NWA Democrat-Gazette', 'id': '30012029'}]",,,,
1501614303245438980,1501614303245438980,2022-03-09 12:42:03 Eastern Standard Time,2022-03-09,12:42:03,-0400,269992801,asahutchinson,Gov. Asa Hutchinson,,"ICYMI: Last week, we debuted the “10 Minutes Matter” campaign to encourage parents to read to their infant or newborn. Research has shown just 10 minutes of reading a day can expand a child’s vocabulary by over 300,000 words before kindergarten.  https://t.co/hnwgCiGz0l  https://t.co/NZKbHcTyjp",en,[],['http://Ar.gov/10minutes'],['https://pbs.twimg.com/media/FNbOE_aX0AwIBOI.png'],6,7,21,[],[],https://twitter.com/AsaHutchinson/status/1501614303245438980,False,,1,https://pbs.twimg.com/media/FNbOE_aX0AwIBOI.png,,,,,,,[],,,,
1501270574269485056,1501270574269485056,2022-03-08 13:56:11 Eastern Standard Time,2022-03-08,13:56:11,-0400,269992801,asahutchinson,Gov. Asa Hutchinson,,My statement on the ban on U.S. imports of Russian oil.  https://t.co/vCFXaJVESN,en,[],[],['https://pbs.twimg.com/media/FNWVPoNXwAo-ZBA.jpg'],61,44,322,[],[],https://twitter.com/AsaHutchinson/status/1501270574269485056,False,,1,https://pbs.twimg.com/media/FNWVPoNXwAo-ZBA.jpg,,,,,,,[],,,,
1501261116294537218,1501261116294537218,2022-03-08 13:18:36 Eastern Standard Time,2022-03-08,13:18:36,-0400,269992801,asahutchinson,Gov. Asa Hutchinson,,"Today we followed through on our promise to strengthen law enforcement in Arkansas. Increased pay for State Troopers, a one-time stipend for eligible law enforcement officers, and increased funding for the Public Safety Grant Program will support those who protect and serve.  https://t.co/qlP0v1Hy89",en,[],[],"['https://pbs.twimg.com/media/FNWMUuSWYAMonsZ.jpg', 'https://pbs.twimg.com/media/FNWMUuQXIAUyBRM.jpg', 'https://pbs.twimg.com/media/FNWMUuQXsAkQ6ki.jpg']",14,11,68,[],[],https://twitter.com/AsaHutchinson/status/1501261116294537218,False,,1,https://pbs.twimg.com/media/FNWMUuSWYAMonsZ.jpg,,,,,,,[],,,,
1501241243908591623,1501241243908591623,2022-03-08 11:59:38 Eastern Standard Time,2022-03-08,11:59:38,-0400,269992801,asahutchinson,Gov. Asa Hutchinson,,LIVE: Gov. Asa Hutchinson Signs Law Enforcement Bills:  https://t.co/iJGnksp5vm,en,[],['https://youtu.be/oT1MjxscCFo'],[],0,3,6,[],[],https://twitter.com/AsaHutchinson/status/1501241243908591623,False,,0,,,,,,,,[],,,,
1501198552160247811,1501198552160247811,2022-03-08 09:10:00 Eastern Standard Time,2022-03-08,09:10:00,-0400,269992801,asahutchinson,Gov. Asa Hutchinson,,"Elsijane Trimble Roy was only the third woman to graduate from the University of Arkansas with a law degree. She was also the first woman to serve as a judge in Arkansas, and it was an honor for me to have tried cases in her court.  https://t.co/DdhPpYGYJX  https://t.co/8HjMoalXjw",en,[],['https://encyclopediaofarkansas.net/entries/elsijane-trimble-roy-2245/'],['https://pbs.twimg.com/media/FNSMNXqXIAccikt.jpg'],6,2,36,[],[],https://twitter.com/AsaHutchinson/status/1501198552160247811,False,,1,https://pbs.twimg.com/media/FNSMNXqXIAccikt.jpg,,,,,,,[],,,,
1500518195492446208,1500518195492446208,2022-03-06 12:06:30 Eastern Standard Time,2022-03-06,12:06:30,-0400,269992801,asahutchinson,Gov. Asa Hutchinson,,"A lot of fun today cheering on the Little Rock Marathon runners. We had a great cheer squad, the weather was great and a lot of excitement.  https://t.co/u60j7lYUCR",en,[],[],['https://pbs.twimg.com/media/FNLpWAeXIAkph7n.jpg'],5,3,112,[],[],https://twitter.com/AsaHutchinson/status/1500518195492446208,False,,1,https://pbs.twimg.com/media/FNLpWAeXIAkph7n.jpg,,,,,,,[],,,,
1500471007341002753,1500471007341002753,2022-03-06 08:59:00 Eastern Standard Time,2022-03-06,08:59:00,-0400,269992801,asahutchinson,Gov. Asa Hutchinson,, https://t.co/66eVXpzm2k,und,[],[],['https://pbs.twimg.com/media/FNCwcm4XsAAm_j1.jpg'],16,5,88,[],[],https://twitter.com/AsaHutchinson/status/1500471007341002753,False,,1,https://pbs.twimg.com/media/FNCwcm4XsAAm_j1.jpg,,,,,,,[],,,,
1499889372316979206,1499889372316979206,2022-03-04 18:27:47 Eastern Standard Time,2022-03-04,18:27:47,-0400,269992801,asahutchinson,Gov. Asa Hutchinson,,"In this week’s radio address, I share how the ongoing invasion of Ukraine by Russia is impacting people in Arkansas. You can listen here:  https://t.co/iIdWs8mLYW  https://t.co/q1GqvmEBHE",en,[],['https://governor.arkansas.gov/news-media/weekly-address/arkansas-s-support-for-ukraine'],['https://pbs.twimg.com/media/FNCtYdjXwAIfKOm.jpg'],6,2,7,[],[],https://twitter.com/AsaHutchinson/status/1499889372316979206,False,,1,https://pbs.twimg.com/media/FNCtYdjXwAIfKOm.jpg,,,,,,,[],,,,
1499861323307495437,1499861323307495437,2022-03-04 16:36:20 Eastern Standard Time,2022-03-04,16:36:20,-0400,269992801,asahutchinson,Gov. Asa Hutchinson,,So great to be in Panther Country celebrating academic success. Students excel in kindness as well as grades.,en,[],[],[],0,4,15,[],[],https://twitter.com/AsaHutchinson/status/1499861323307495437,False,https://twitter.com/cabotsd/status/1499558591518453764,0,,,,,,,,[],,,,
1499754101822922761,1499754101822922761,2022-03-04 09:30:16 Eastern Standard Time,2022-03-04,09:30:16,-0400,269992801,asahutchinson,Gov. Asa Hutchinson,,"The candidate filing period is closed, which means primary elections are around the corner. Poll workers are vital to ensure a complete and secure election. You can sign up by visiting  https://t.co/xoMUzFMtt5 and contacting your local county clerk and election commission.",en,[],['https://appengine.egov.com/apps/ar/SBEC'],[],2,4,11,[],[],https://twitter.com/AsaHutchinson/status/1499754101822922761,False,,0,,,,,,,,[],,,,
1499484259949723656,1499484259949723656,2022-03-03 15:38:01 Eastern Standard Time,2022-03-03,15:38:01,-0400,269992801,asahutchinson,Gov. Asa Hutchinson,,"During the annual Arkansas Leadership Prayer Breakfast this morning, we held a special moment of prayer for the people of Ukraine. It was a blessing to have Dr. Kateryna Pitchford, who has family in Ukraine, join us today.  https://t.co/F4Emcw7ZFN",en,[],[],[],4,9,61,[],[],https://twitter.com/AsaHutchinson/status/1499484259949723656,False,,1,https://pbs.twimg.com/ext_tw_video_thumb/1499483120084688898/pu/img/VANsadpwGrGwuVHf.jpg,,,,,,,[],,,,
1499142951238307853,1499142951238307853,2022-03-02 17:01:46 Eastern Standard Time,2022-03-02,17:01:46,-0400,269992801,asahutchinson,Gov. Asa Hutchinson,,"Civic organizations in Arkansas are vital to our communities. I was in Morrilton today at the Morrilton Civic Alliance, composed of the Rotary Club, Kiwanis, and Lions Club. They’ve got some big plans for the next total solar eclipse in 2024, which will pass through Arkansas.  https://t.co/EZ2UYfluzL",en,[],[],"['https://pbs.twimg.com/media/FM4Gjy7X0Asv706.jpg', 'https://pbs.twimg.com/media/FM4GjzmWYAETsn_.jpg']",2,0,14,[],[],https://twitter.com/AsaHutchinson/status/1499142951238307853,False,,1,https://pbs.twimg.com/media/FM4Gjy7X0Asv706.jpg,,,,,,,[],,,,
1499118269537697794,1499118269537697794,2022-03-02 15:23:42 Eastern Standard Time,2022-03-02,15:23:42,-0400,269992801,asahutchinson,Gov. Asa Hutchinson,,My statement on the February Revenue Report.  https://t.co/tUxKuxUp6x,en,[],[],['https://pbs.twimg.com/media/FM3vlIdWYAAc5ua.jpg'],8,4,33,[],[],https://twitter.com/AsaHutchinson/status/1499118269537697794,False,,1,https://pbs.twimg.com/media/FM3vlIdWYAAc5ua.jpg,,,,,,,[],,,,
1499025483320725513,1499025483320725513,2022-03-02 09:15:00 Eastern Standard Time,2022-03-02,09:15:00,-0400,269992801,asahutchinson,Gov. Asa Hutchinson,,"March is Women’s History Month, and today I want to recognize Hattie Caraway of Arkansas. 12 years after women were granted the right to vote, Hattie was the first woman elected to serve in the U.S. Senate &amp; the first woman to preside over the chamber.  https://t.co/Z2PU5tIsV9  https://t.co/pF90nCS2xK",en,[],['https://encyclopediaofarkansas.net/entries/hattie-ophelia-wyatt-caraway-1278/'],['https://pbs.twimg.com/media/FMzRUaaXEAcyPsE.jpg'],7,15,64,[],[],https://twitter.com/AsaHutchinson/status/1499025483320725513,False,,1,https://pbs.twimg.com/media/FMzRUaaXEAcyPsE.jpg,,,,,,,[],,,,
1498834656296329217,1498834656296329217,2022-03-01 20:36:43 Eastern Standard Time,2022-03-01,20:36:43,-0400,269992801,asahutchinson,Gov. Asa Hutchinson,,"Tonight, @ARFirstLady and I lit the Governor’s Mansion in the colors of the flag of Ukraine to show our support for the Ukrainian people in their ongoing fight against an invasion.  https://t.co/R3Ook6RaYs",en,"[{'screen_name': 'arfirstlady', 'name': 'susan hutchinson', 'id': '3070146696'}]",[],['https://pbs.twimg.com/media/FMzuK8kWUAA9WhA.jpg'],24,34,382,[],[],https://twitter.com/AsaHutchinson/status/1498834656296329217,False,,1,https://pbs.twimg.com/media/FMzuK8kWUAA9WhA.jpg,,,,,,,[],,,,
1498787357776097283,1498787357776097283,2022-03-01 17:28:46 Eastern Standard Time,2022-03-01,17:28:46,-0400,269992801,asahutchinson,Gov. Asa Hutchinson,,10 minutes a day makes a difference in the life of a child. We’re working to strengthen Arkansas families with the “10 Minutes Matter” campaign. Reading to your newborn or infant prepares them for their future. Read more on our campaign here:  https://t.co/7zmO6w4mCu  https://t.co/u62t6PuzTZ,en,[],['http://ar.gov/10minutes'],['https://pbs.twimg.com/media/FMzCTpLX0AI3bD1.png'],1,5,20,[],[],https://twitter.com/AsaHutchinson/status/1498787357776097283,False,,1,https://pbs.twimg.com/media/FMzCTpLX0AI3bD1.png,,,,,,,[],,,,
1498742247281602567,1498742247281602567,2022-03-01 14:29:31 Eastern Standard Time,2022-03-01,14:29:31,-0400,269992801,asahutchinson,Gov. Asa Hutchinson,,LIVE: Governor Hutchinson’s Weekly Media Briefing (03.01.22):  https://t.co/moRXmuFMbr,en,[],['https://youtu.be/YA1DkWS5TAU'],[],2,0,1,[],[],https://twitter.com/AsaHutchinson/status/1498742247281602567,False,,0,,,,,,,,[],,,,
1498718918986420227,1498718918986420227,2022-03-01 12:56:49 Eastern Standard Time,2022-03-01,12:56:49,-0400,269992801,asahutchinson,Gov. Asa Hutchinson,,This morning I was on @MSNBC talking about how @POTUS #SOTU needs to be a State of the World not a just a State of the Union. We need to come together to support Ukraine Watch below:   Governor Asa Hutchinson on MSNBC - SOTU Preview (03.01.22)  https://t.co/EM8371K7lh via @YouTube,en,"[{'screen_name': 'msnbc', 'name': 'msnbc', 'id': '2836421'}, {'screen_name': 'potus', 'name': 'president biden', 'id': '1349149096909668363'}, {'screen_name': 'youtube', 'name': 'youtube', 'id': '10228272'}]",['https://youtu.be/plme9prIfwU'],[],19,5,62,['sotu'],[],https://twitter.com/AsaHutchinson/status/1498718918986420227,False,,0,,,,,,,,[],,,,
1498716744982138885,1498716744982138885,2022-03-01 12:48:11 Eastern Standard Time,2022-03-01,12:48:11,-0400,269992801,asahutchinson,Gov. Asa Hutchinson,,I will provide my weekly media briefing at 1:30 pm today. You can watch here:  https://t.co/moRXmuFMbr,en,[],['https://youtu.be/YA1DkWS5TAU'],[],1,0,4,[],[],https://twitter.com/AsaHutchinson/status/1498716744982138885,False,,0,,,,,,,,[],,,,
1498674358201597956,1498674358201597956,2022-03-01 09:59:45 Eastern Standard Time,2022-03-01,09:59:45,-0400,269992801,asahutchinson,Gov. Asa Hutchinson,,Today we celebrate 50 years of the Buffalo National River. The Buffalo was the first to receive the designation of a National River in 1972 and attracts visitors from around the world. It’s up to us to continue to protect this incredible natural resource.  https://t.co/R0DZvd3sro  https://t.co/c7qRxiLjhv,en,[],['https://governor.arkansas.gov/images/uploads/proclamations/2022_Buffalo_River%2C_50TH_Anniversary_%28March_1%29.pdf'],"['https://pbs.twimg.com/media/FMxcNv4XEAc2OhV.jpg', 'https://pbs.twimg.com/media/FMxcNv3XsAQnok8.jpg']",2,10,82,[],[],https://twitter.com/AsaHutchinson/status/1498674358201597956,False,,1,https://pbs.twimg.com/media/FMxcNv4XEAc2OhV.jpg,,,,,,,[],,,,
1498444822147141632,1498444822147141632,2022-02-28 18:47:40 Eastern Standard Time,2022-02-28,18:47:40,-0400,269992801,asahutchinson,Gov. Asa Hutchinson,,"I am deeply saddened at the passing of Arkansas Department of Corrections Sgt. Joshua Caudell. To honor Sgt. Caudell’s life, I have lowered the flags to half-staff. Please remember his family and the Department of Corrections in your thoughts and prayers.  https://t.co/xbmOLI2aDo",en,[],['https://governor.arkansas.gov/images/uploads/proclamations/Half_Staff_Proclamation%2C_In_Remembrance_of_Sergeant_Joshua_Caudell.pdf'],[],0,5,37,[],[],https://twitter.com/AsaHutchinson/status/1498444822147141632,False,,0,,,,,,,,[],,,,
1498427763103051779,1498427763103051779,2022-02-28 17:39:52 Eastern Standard Time,2022-02-28,17:39:52,-0400,269992801,asahutchinson,Gov. Asa Hutchinson,,"I have proclaimed March 1 – 3 as special days of prayer for Ukraine in Arkansas. I hope you’ll join me in prayer for the protection and safety of Ukrainians of all faiths and world leaders to navigate this crisis with strength, guidance, and wisdom.  https://t.co/tIbJfZgXG9",en,[],['https://governor.arkansas.gov/images/uploads/proclamations/2022_Days_of_Prayer_for_Ukraine_%28March_1-3%29.pdf'],[],22,59,386,[],[],https://twitter.com/AsaHutchinson/status/1498427763103051779,False,,0,,,,,,,,[],,,,
1498419861881511946,1498419861881511946,2022-02-28 17:08:29 Eastern Standard Time,2022-02-28,17:08:29,-0400,269992801,asahutchinson,Gov. Asa Hutchinson,,Our hearts go out to the family of fallen West Memphis Firefighter Jason Lang. He passed from this life while serving his neighbor &amp; I have lowered the flags in his honor. Susan &amp; I are praying for his family &amp; the West Memphis Fire Department.  https://t.co/I3YhEf0tWk,en,[],['https://governor.arkansas.gov/images/uploads/proclamations/2022_Firefighter_Jason_Lang%2C_Half_Staff_proclamation.pdf'],[],1,5,38,[],[],https://twitter.com/AsaHutchinson/status/1498419861881511946,False,,0,,,,,,,,[],,,,
1497932782382850052,1497932782382850052,2022-02-27 08:53:00 Eastern Standard Time,2022-02-27,08:53:00,-0400,269992801,asahutchinson,Gov. Asa Hutchinson,, https://t.co/waAJNchFzM,und,[],[],['https://pbs.twimg.com/media/FMeit5gWQAAideB.jpg'],16,10,124,[],[],https://twitter.com/AsaHutchinson/status/1497932782382850052,False,,1,https://pbs.twimg.com/media/FMeit5gWQAAideB.jpg,,,,,,,[],,,,
1497620638185439237,1497620638185439237,2022-02-26 12:12:39 Eastern Standard Time,2022-02-26,12:12:39,-0400,269992801,asahutchinson,Gov. Asa Hutchinson,, https://t.co/GJBApzRHEJ,und,[],[],['https://pbs.twimg.com/media/FMid7YtXEAkXXOG.jpg'],110,192,1592,[],[],https://twitter.com/AsaHutchinson/status/1497620638185439237,False,,1,https://pbs.twimg.com/media/FMid7YtXEAkXXOG.jpg,,,,,,,[],,,,
1497606130008145922,1497606130008145922,2022-02-26 11:15:00 Eastern Standard Time,2022-02-26,11:15:00,-0400,269992801,asahutchinson,Gov. Asa Hutchinson,,"Johnny Cash is an Arkansas legend known around the world. He was born on this day in 1932 and went on the be one of the most successful musicians of the 20th century. He’ll soon represent us in National Statuary Hall, and we celebrate his life today.  https://t.co/041QWDe9vg",en,[],['https://governor.arkansas.gov/images/uploads/proclamations/2022_Johnny_Cash_Day_%28AR_Code%29._.pdf'],[],3,19,128,[],[],https://twitter.com/AsaHutchinson/status/1497606130008145922,False,,0,,,,,,,,[],,,,
1497337304226144261,1497337304226144261,2022-02-25 17:26:47 Eastern Standard Time,2022-02-25,17:26:47,-0400,269992801,asahutchinson,Gov. Asa Hutchinson,,"In this week’s radio address, I discuss Arkansas’s position as the leader in future mobility and share my vision for our work in this field. You can listen here:  https://t.co/ntYsopM0zU  https://t.co/R9C1XdIOOF",en,[],['https://governor.arkansas.gov/news-media/weekly-address/paving-the-way-for-the-future-of-mobility'],['https://pbs.twimg.com/media/FMebzOTXIAg6Lw7.jpg'],4,1,4,[],[],https://twitter.com/AsaHutchinson/status/1497337304226144261,False,,1,https://pbs.twimg.com/media/FMebzOTXIAg6Lw7.jpg,,,,,,,[],,,,
1497326219351711754,1497326219351711754,2022-02-25 16:42:44 Eastern Standard Time,2022-02-25,16:42:44,-0400,269992801,asahutchinson,Gov. Asa Hutchinson,,Today I expressed my support for the people of Ukraine as they strive to protect their sovereignty. We must be clear in our condemnation of Russia’s aggression and impose the most severe sanctions possible in response to the actions of Mr. Putin.  https://t.co/fBsfMrs8L4,en,[],['https://youtu.be/tvCuA_o419g'],[],21,22,245,[],[],https://twitter.com/AsaHutchinson/status/1497326219351711754,False,,0,,,,,,,,[],,,,
1497315061227999238,1497315061227999238,2022-02-25 15:58:24 Eastern Standard Time,2022-02-25,15:58:24,-0400,269992801,asahutchinson,Gov. Asa Hutchinson,,"During my weekly briefing today, I discussed the continued decline in new cases, active cases, and hospitalizations across the state. You can continue to monitor daily COVID information on the @ADHPIO  dashboard.  https://t.co/ZZlUfJSU1a",en,"[{'screen_name': 'adhpio', 'name': 'arkansas department of health', 'id': '111630094'}]",['https://experience.arcgis.com/experience/633006d0782b4544bd5113a314f6268a/'],[],18,2,21,[],[],https://twitter.com/AsaHutchinson/status/1497315061227999238,False,,0,,,,,,,,[],,,,
1497240022805790726,1497240022805790726,2022-02-25 11:00:13 Eastern Standard Time,2022-02-25,11:00:13,-0400,269992801,asahutchinson,Gov. Asa Hutchinson,,LIVE: Governor Hutchinson’s Weekly Media Briefing (02.25.22):  https://t.co/fBsfMrs8L4,en,[],['https://youtu.be/tvCuA_o419g'],[],2,1,5,[],[],https://twitter.com/AsaHutchinson/status/1497240022805790726,False,,0,,,,,,,,[],,,,
1497236019573362688,1497236019573362688,2022-02-25 10:44:19 Eastern Standard Time,2022-02-25,10:44:19,-0400,269992801,asahutchinson,Gov. Asa Hutchinson,,I will provide my weekly media briefing at 10am today. You can watch here:  https://t.co/fBsfMrs8L4,en,[],['https://youtu.be/tvCuA_o419g'],[],1,2,7,[],[],https://twitter.com/AsaHutchinson/status/1497236019573362688,False,,0,,,,,,,,[],,,,
1496885172750405635,1496885172750405635,2022-02-24 11:30:10 Eastern Standard Time,2022-02-24,11:30:10,-0400,269992801,asahutchinson,Gov. Asa Hutchinson,,"We currently have around 34,000 Arkansans without power due to the winter storm. We expect this number to increase before it starts to come down. We’re thankful for the electrical line crews who often work in the worst conditions to ensure we have power.",en,[],[],[],7,31,169,[],[],https://twitter.com/AsaHutchinson/status/1496885172750405635,False,,0,,,,,,,,[],,,,
1496689582917754882,1496689582917754882,2022-02-23 22:32:58 Eastern Standard Time,2022-02-23,22:32:58,-0400,269992801,asahutchinson,Gov. Asa Hutchinson,,An invasion of a sovereign nation cannot stand uncontested. I hope you’ll join me tonight in praying for the people of Ukraine and for a unified allied response.,en,[],[],[],193,253,3176,[],[],https://twitter.com/AsaHutchinson/status/1496689582917754882,False,,0,,,,,,,,[],,,,
1496652256967639040,1496652256967639040,2022-02-23 20:04:39 Eastern Standard Time,2022-02-23,20:04:39,-0400,269992801,asahutchinson,Gov. Asa Hutchinson,, https://t.co/GFgvcdSg9m,und,[],[],['https://pbs.twimg.com/media/FMUtQAVXwAEuuPS.jpg'],2,9,24,[],[],https://twitter.com/AsaHutchinson/status/1496652256967639040,False,,1,https://pbs.twimg.com/media/FMUtQAVXwAEuuPS.jpg,,,,,,,[],,,,
1496570329476513802,1496570329476513802,2022-02-23 14:39:06 Eastern Standard Time,2022-02-23,14:39:06,-0400,269992801,asahutchinson,Gov. Asa Hutchinson,,"We currently have 88 Arkansas Guard members and 32 humvees deployed across the state to assist the Arkansas State Police with traffic issues in the current winter storm. Please stay off the roads if you can. If you must travel, please check road conditions &amp; drive with caution.",en,[],[],[],4,37,95,[],[],https://twitter.com/AsaHutchinson/status/1496570329476513802,False,,0,,,,,,,,[],,,,
1496550054131294211,1496550054131294211,2022-02-23 13:18:32 Eastern Standard Time,2022-02-23,13:18:32,-0400,269992801,asahutchinson,Gov. Asa Hutchinson,,"Great team effort last night with Abel setting the pace with 21 points, 5 rebounds, 2 assists and no turnovers.",en,[],[],[],7,2,33,[],[],https://twitter.com/AsaHutchinson/status/1496550054131294211,False,https://twitter.com/WEAREBVILLE/status/1496328207846584324,0,,,,,,,,[],,,,
1496490780726157313,1496490780726157313,2022-02-23 09:23:00 Eastern Standard Time,2022-02-23,09:23:00,-0400,269992801,asahutchinson,Gov. Asa Hutchinson,,"I had the privilege of meeting two high school basketball teams with great sportsmanship. During Lake Hamilton High School’s recent Senior Night, senior manager Andy Tolleson came in to score 9 points on 3/4 from the three-point line. We’re all proud of these student athletes!  https://t.co/SF1wMiDYES",en,[],[],['https://pbs.twimg.com/media/FMPTsHCXMA0ZxTt.jpg'],6,27,236,[],[],https://twitter.com/AsaHutchinson/status/1496490780726157313,False,,1,https://pbs.twimg.com/media/FMPTsHCXMA0ZxTt.jpg,,,,,,,[],,,,
1496263601191063552,1496263601191063552,2022-02-22 18:20:16 Eastern Standard Time,2022-02-22,18:20:16,-0400,269992801,asahutchinson,Gov. Asa Hutchinson,,"On this day in 1732, our first president was born. President George Washington was a true revolutionary who changed the course of human history, and we would do well to learn from his life of service.  https://t.co/q24tMIYwCS",en,[],[],[],6,3,33,[],[],https://twitter.com/AsaHutchinson/status/1496263601191063552,False,,1,https://pbs.twimg.com/ext_tw_video_thumb/1496263065788198912/pu/img/7Z_mFrOrzvWwjQ_6.jpg,,,,,,,[],,,,
1496250128121974805,1496250128121974805,2022-02-22 17:26:44 Eastern Standard Time,2022-02-22,17:26:44,-0400,269992801,asahutchinson,Gov. Asa Hutchinson,,"It was an honor to have leaders in advanced mobility present as we announced the beginning of the Governor’s Council on Future Mobility. Arkansas is already becoming a hub for future mobility, and the work of this council will ensure we remain in the driver’s seat.  https://t.co/VptbItD5w2",en,[],[],[],8,22,104,[],[],https://twitter.com/AsaHutchinson/status/1496250128121974805,False,,1,https://pbs.twimg.com/ext_tw_video_thumb/1496249536716619777/pu/img/Od99_a0177re-s4t.jpg,,,,,,,[],,,,
1496167911169396744,1496167911169396744,2022-02-22 12:00:02 Eastern Standard Time,2022-02-22,12:00:02,-0400,269992801,asahutchinson,Gov. Asa Hutchinson,,LIVE: Future Mobility Advisory Council Press Conference:  https://t.co/kxLWsznpQq,en,[],['https://youtu.be/_1E1mBDmwyg'],[],2,6,9,[],[],https://twitter.com/AsaHutchinson/status/1496167911169396744,False,,0,,,,,,,,[],,,,
1496154469410787328,1496154469410787328,2022-02-22 11:06:37 Eastern Standard Time,2022-02-22,11:06:37,-0400,269992801,asahutchinson,Gov. Asa Hutchinson,,I’ll be hosting a news conference at 11am today on the future of advanced mobility. Be sure to tune in.  https://t.co/kxLWsznpQq,en,[],['https://youtu.be/_1E1mBDmwyg'],[],5,3,9,[],[],https://twitter.com/AsaHutchinson/status/1496154469410787328,False,,0,,,,,,,,[],,,,
