id,conversation_id,created_at,date,time,timezone,user_id,username,name,place,tweet,language,mentions,urls,photos,replies_count,retweets_count,likes_count,hashtags,cashtags,link,retweet,quote_url,video,thumbnail,near,geo,source,user_rt_id,user_rt,retweet_id,reply_to,retweet_date,translate,trans_src,trans_dest
1496149968779943944,1496149968779943944,2022-02-22 10:48:44 Eastern Standard Time,2022-02-22,10:48:44,-0400,269992801,asahutchinson,Gov. Asa Hutchinson,,"During our morning staff meeting, our team learned about John Edward Bush for today’s moment in Black History. John was born a slave in 1856 &amp; founded the Mosaic Templars in 1883 in Little Rock. Read more about this famous Arkansan for Black History Month.  https://t.co/kosmxBUBAH  https://t.co/O4WhWOSRY1",en,[],['https://encyclopediaofarkansas.net/entries/john-bush-1608/https://encyclopediaofarkansas.net/entries/john-bush-1608/'],['https://pbs.twimg.com/media/FMNkd6xXEBAwh1q.jpg'],2,2,15,[],[],https://twitter.com/AsaHutchinson/status/1496149968779943944,False,,1,https://pbs.twimg.com/media/FMNkd6xXEBAwh1q.jpg,,,,,,,[],,,,
1495762733471604739,1495762733471604739,2022-02-21 09:10:00 Eastern Standard Time,2022-02-21,09:10:00,-0400,269992801,asahutchinson,Gov. Asa Hutchinson,,"Daisy Gatson Bates was a fierce advocate for civil rights in Arkansas and across the country throughout her life. We celebrate her legacy today, and we will soon honor her as one of Arkansas’s representatives in National Statuary Hall.  https://t.co/nInOdwdnLz  https://t.co/WzTGitV5Gw",en,[],['https://governor.arkansas.gov/images/uploads/proclamations/2022_Daisy_Bates_Day_%28Feb_21%29.pdf'],['https://pbs.twimg.com/media/FL6wFsBWUAAsrD8.png'],7,13,116,[],[],https://twitter.com/AsaHutchinson/status/1495762733471604739,False,,1,https://pbs.twimg.com/media/FL6wFsBWUAAsrD8.png,,,,,,,[],,,,
1495397325614686210,1495397325614686210,2022-02-20 08:58:00 Eastern Standard Time,2022-02-20,08:58:00,-0400,269992801,asahutchinson,Gov. Asa Hutchinson,, https://t.co/RevuL0KYKM,und,[],[],['https://pbs.twimg.com/media/FL6vwmQWUAQIaRG.jpg'],23,4,78,[],[],https://twitter.com/AsaHutchinson/status/1495397325614686210,False,,1,https://pbs.twimg.com/media/FL6vwmQWUAQIaRG.jpg,,,,,,,[],,,,
1494803733716287493,1494803733716287493,2022-02-18 17:39:16 Eastern Standard Time,2022-02-18,17:39:16,-0400,269992801,asahutchinson,Gov. Asa Hutchinson,,"In this week’s radio address, I celebrate Black History Month and recognize some of the remarkable Arkansans we recognize during February. You can listen here:  https://t.co/Puph004dUw  https://t.co/dpqQYX6nA2",en,[],['https://governor.arkansas.gov/news-media/weekly-address/arkansass-black-history-heroes'],['https://pbs.twimg.com/media/FL6bn1cXMAARgJr.jpg'],4,4,12,[],[],https://twitter.com/AsaHutchinson/status/1494803733716287493,False,,1,https://pbs.twimg.com/media/FL6bn1cXMAARgJr.jpg,,,,,,,[],,,,
1494676829109583872,1494676829109583872,2022-02-18 09:15:00 Eastern Standard Time,2022-02-18,09:15:00,-0400,269992801,asahutchinson,Gov. Asa Hutchinson,,It's been almost 50 years since a women’s commission was utilized in Arkansas. I'm excited to announce the creation of the Arkansas Commission on the Status of Women to focus on labor force participation &amp; removing barriers for Arkansas women.  https://t.co/qzwJKhkign  https://t.co/BOSXb5k2az,en,[],['https://governor.arkansas.gov/images/uploads/executiveOrders/EO_22_-_05._.pdf'],['https://pbs.twimg.com/media/FL1kKW9XIAMNkUU.jpg'],8,14,60,[],[],https://twitter.com/AsaHutchinson/status/1494676829109583872,False,,1,https://pbs.twimg.com/media/FL1kKW9XIAMNkUU.jpg,,,,,,,[],,,,
1494456356178477056,1494456356178477056,2022-02-17 18:38:55 Eastern Standard Time,2022-02-17,18:38:55,-0400,269992801,asahutchinson,Gov. Asa Hutchinson,,I announced today that my daily updates will change to weekly updates. The daily case data will still be available at the @ADHPIO dashboard.  https://t.co/ZZlUfJSU1a  https://t.co/tqhdbcZzRi,en,"[{'screen_name': 'adhpio', 'name': 'arkansas department of health', 'id': '111630094'}]",['https://experience.arcgis.com/experience/633006d0782b4544bd5113a314f6268a/'],['https://pbs.twimg.com/media/FL1fHWXWUAciop3.png'],39,4,35,[],[],https://twitter.com/AsaHutchinson/status/1494456356178477056,False,,1,https://pbs.twimg.com/media/FL1fHWXWUAciop3.png,,,,,,,[],,,,
1494447325787340803,1494447325787340803,2022-02-17 18:03:02 Eastern Standard Time,2022-02-17,18:03:02,-0400,269992801,asahutchinson,Gov. Asa Hutchinson,,"During my weekly briefing today, I announced a 2% COLA increase for executive branch employees due to recent inflation and funding for a new health center to benefit the Arkansas Schools for the Deaf and Blind. You can watch the full briefing here:  https://t.co/uIIHaDchMO",en,[],['https://youtu.be/mMyXootOQ8E'],[],2,5,11,[],[],https://twitter.com/AsaHutchinson/status/1494447325787340803,False,,0,,,,,,,,[],,,,
1494408395855650822,1494408395855650822,2022-02-17 15:28:20 Eastern Standard Time,2022-02-17,15:28:20,-0400,269992801,asahutchinson,Gov. Asa Hutchinson,,LIVE: Governor Hutchinson's Weekly Media Briefing (02.17.22):  https://t.co/uIIHaDchMO,en,[],['https://youtu.be/mMyXootOQ8E'],[],1,0,3,[],[],https://twitter.com/AsaHutchinson/status/1494408395855650822,False,,0,,,,,,,,[],,,,
1494377147636584451,1494377147636584451,2022-02-17 13:24:10 Eastern Standard Time,2022-02-17,13:24:10,-0400,269992801,asahutchinson,Gov. Asa Hutchinson,,I will provide my weekly media briefing at 2:30 pm today. You can watch here:  https://t.co/uIIHaDchMO,en,[],['https://youtu.be/mMyXootOQ8E'],[],3,2,9,[],[],https://twitter.com/AsaHutchinson/status/1494377147636584451,False,,0,,,,,,,,[],,,,
1494103439386816516,1494103439386816516,2022-02-16 19:16:33 Eastern Standard Time,2022-02-16,19:16:33,-0400,269992801,asahutchinson,Gov. Asa Hutchinson,,Today we recognized the opening of an exhibit in the State Capitol to remember the Sultana Disaster. The Sultana was a steamboat transporting former Union prisoners of war up the Mississippi River when the boat sank near West Memphis in 1865.  https://t.co/tK5qN5jjdL,en,[],[],['https://pbs.twimg.com/media/FLwfKBgXsAMIHLw.jpg'],10,2,28,[],[],https://twitter.com/AsaHutchinson/status/1494103439386816516,False,,1,https://pbs.twimg.com/media/FLwfKBgXsAMIHLw.jpg,,,,,,,[],,,,
1494069552971493381,1494069552971493381,2022-02-16 17:01:54 Eastern Standard Time,2022-02-16,17:01:54,-0400,269992801,asahutchinson,Gov. Asa Hutchinson,,New cases are again lower than last week. Our positivity rate of 12.4% is back to where it was around Christmas. Hospitalizations are also down to early January levels. Let’s keep moving in the right direction.  https://t.co/Sge7Pc59Kq,en,[],[],['https://pbs.twimg.com/media/FLv_mOhWUAM_X7k.png'],58,8,47,[],[],https://twitter.com/AsaHutchinson/status/1494069552971493381,False,,1,https://pbs.twimg.com/media/FLv_mOhWUAM_X7k.png,,,,,,,[],,,,
1493691932924645377,1493691932924645377,2022-02-15 16:01:22 Eastern Standard Time,2022-02-15,16:01:22,-0400,269992801,asahutchinson,Gov. Asa Hutchinson,,"We continue to see key metrics like new and active cases and hospitalizations decline. Regrettably, we are still seeing a high number of deaths, and over 81% of COVID deaths have been unvaccinated. It’s critical we all get vaccinated.  https://t.co/giJG1XVysj",en,[],[],['https://pbs.twimg.com/media/FLqoKCjXwAEW5Eo.png'],59,19,66,[],[],https://twitter.com/AsaHutchinson/status/1493691932924645377,False,,1,https://pbs.twimg.com/media/FLqoKCjXwAEW5Eo.png,,,,,,,[],,,,
1493354426265968644,1493354426265968644,2022-02-14 17:40:15 Eastern Standard Time,2022-02-14,17:40:15,-0400,269992801,asahutchinson,Gov. Asa Hutchinson,,"We celebrated Career and Technical Education Day at the Capitol in the rotunda this morning. Part of my W.I.N.S. in 2022 agenda is strengthening workforce education, and what I saw today shows the strength of our workforce training.  https://t.co/GDHX04oqhH",en,[],[],"['https://pbs.twimg.com/media/FLl1hEQXoAMT-p4.jpg', 'https://pbs.twimg.com/media/FLl1hEUWYAAPyuC.jpg']",6,7,38,[],[],https://twitter.com/AsaHutchinson/status/1493354426265968644,False,,1,https://pbs.twimg.com/media/FLl1hEQXoAMT-p4.jpg,,,,,,,[],,,,
1493334514046840834,1493334514046840834,2022-02-14 16:21:07 Eastern Standard Time,2022-02-14,16:21:07,-0400,269992801,asahutchinson,Gov. Asa Hutchinson,,"Here is today’s COVID update. During my State of the State Address today, I honored Emily McGee, a critical care nurse in the ICU at St. Bernards Medical Center in Jonesboro. The members of the General Assembly joined me in honoring health care heroes.  https://t.co/LlW0xMwBwE",en,[],[],['https://pbs.twimg.com/media/FLljj5AXsAgyWdy.png'],29,9,25,[],[],https://twitter.com/AsaHutchinson/status/1493334514046840834,False,,1,https://pbs.twimg.com/media/FLljj5AXsAgyWdy.png,,,,,,,[],,,,
1493309887790698497,1493297634144096268,2022-02-14 14:43:16 Eastern Standard Time,2022-02-14,14:43:16,-0400,269992801,asahutchinson,Gov. Asa Hutchinson,,(36/36) #arpx,und,[],[],[],3,0,5,['arpx'],[],https://twitter.com/AsaHutchinson/status/1493309887790698497,False,,0,,,,,,,,[],,,,
1493304431697354764,1493297634144096268,2022-02-14 14:21:35 Eastern Standard Time,2022-02-14,14:21:35,-0400,269992801,asahutchinson,Gov. Asa Hutchinson,,"(35/36) I’ve never been more hopeful and optimistic about the future of our state. Let’s work with courage to unite, inspire &amp; lead with hope. May God bless the state of Arkansas and give us courage to keep America strong, united, and free.",en,[],[],[],6,6,18,[],[],https://twitter.com/AsaHutchinson/status/1493304431697354764,False,,0,,,,,,,,[],,,,
1493304430401568768,1493297634144096268,2022-02-14 14:21:35 Eastern Standard Time,2022-02-14,14:21:35,-0400,269992801,asahutchinson,Gov. Asa Hutchinson,,"(34/36) Leaders can appeal to the instincts of fear, or they can lead with hope. In today’s world and, yes, in Arkansas, let’s join together to bring out the best of our fellow citizens.",en,[],[],[],2,5,16,[],[],https://twitter.com/AsaHutchinson/status/1493304430401568768,False,,0,,,,,,,,[],,,,
1493304283915239424,1493297634144096268,2022-02-14 14:21:00 Eastern Standard Time,2022-02-14,14:21:00,-0400,269992801,asahutchinson,Gov. Asa Hutchinson,,(33/36) These moments in history remind us that leaders make a difference and that we can do more and earn the respect of the world when we are united and when we are following the better angels of the American spirit.,en,[],[],[],2,3,12,[],[],https://twitter.com/AsaHutchinson/status/1493304283915239424,False,,0,,,,,,,,[],,,,
1493304185143664641,1493297634144096268,2022-02-14 14:20:36 Eastern Standard Time,2022-02-14,14:20:36,-0400,269992801,asahutchinson,Gov. Asa Hutchinson,,"(32/36) I witnessed Neil Armstrong land on the moon to win the space race, and I saw the fall of the Berlin wall. I observed from a very personal standpoint how we all came together as a nation after the 9-11 attack.",en,[],[],[],3,1,10,[],[],https://twitter.com/AsaHutchinson/status/1493304185143664641,False,,0,,,,,,,,[],,,,
1493304101291053062,1493297634144096268,2022-02-14 14:20:16 Eastern Standard Time,2022-02-14,14:20:16,-0400,269992801,asahutchinson,Gov. Asa Hutchinson,,"(31/36) If you simply concentrated on those tragic moments in our history, then you might be discouraged about America. But I also remember and lived through the Berlin airlift; the Cuban Missile Crisis when our leaders stood tall against a Soviet threat.",en,[],[],[],3,2,6,[],[],https://twitter.com/AsaHutchinson/status/1493304101291053062,False,,0,,,,,,,,[],,,,
1493304014313865218,1493297634144096268,2022-02-14 14:19:55 Eastern Standard Time,2022-02-14,14:19:55,-0400,269992801,asahutchinson,Gov. Asa Hutchinson,,"(30/36) And our nation is blessed as well. I think back in my lifetime, and I can recall the division and protests of the Vietnam War, the turmoil of Watergate, the assassinations of Presidents and civil rights leaders, and the bitter political fights in Washington.",en,[],[],[],2,2,6,[],[],https://twitter.com/AsaHutchinson/status/1493304014313865218,False,,0,,,,,,,,[],,,,
1493303917148520449,1493297634144096268,2022-02-14 14:19:32 Eastern Standard Time,2022-02-14,14:19:32,-0400,269992801,asahutchinson,Gov. Asa Hutchinson,,"(29/36) As to the state of our state, I am grateful to say that Arkansas is leading. We are leading in computer science education, technology innovation, agriculture, tourism, job creation &amp; support for veterans &amp; law enforcement. We have more to do, but our state is blessed.",en,[],[],[],5,1,10,[],[],https://twitter.com/AsaHutchinson/status/1493303917148520449,False,,0,,,,,,,,[],,,,
1493303459935928325,1493297634144096268,2022-02-14 14:17:43 Eastern Standard Time,2022-02-14,14:17:43,-0400,269992801,asahutchinson,Gov. Asa Hutchinson,,"(28/36) Currently, we have a record back-up of state prisoners in our county jails. This limits the counties &amp; cities in their capacity to enforce laws. This backlog must be remedied &amp; for that reason I recommend a one-time investment to fund a new 498 inmate prison facility.",en,[],[],[],3,3,8,[],[],https://twitter.com/AsaHutchinson/status/1493303459935928325,False,,0,,,,,,,,[],,,,
1493302943457722381,1493297634144096268,2022-02-14 14:15:40 Eastern Standard Time,2022-02-14,14:15:40,-0400,269992801,asahutchinson,Gov. Asa Hutchinson,,"(27/36) The troopers not only patrol the highways, but their SWAT units are regularly deployed in crisis situations across the state. They back up local law enforcement in the response and investigation of violent crime. I am very proud of their dedication and professionalism.",en,[],[],[],4,2,5,[],[],https://twitter.com/AsaHutchinson/status/1493302943457722381,False,,0,,,,,,,,[],,,,
1493302941603803143,1493297634144096268,2022-02-14 14:15:40 Eastern Standard Time,2022-02-14,14:15:40,-0400,269992801,asahutchinson,Gov. Asa Hutchinson,,"(26/36) As part of this effort, our budget will significantly increase the pay of our state troopers. Col. Bill Bryant has been a star in leading the State Police &amp; the troopers are deserving of a more competitive salary.",en,[],[],[],2,1,8,[],[],https://twitter.com/AsaHutchinson/status/1493302941603803143,False,,0,,,,,,,,[],,,,
1493302697906294786,1493297634144096268,2022-02-14 14:14:42 Eastern Standard Time,2022-02-14,14:14:42,-0400,269992801,asahutchinson,Gov. Asa Hutchinson,,"(25/36) Currently, our law enforcement is underfunded, underpaid, and underappreciated. The actions of this General Assembly to fund more, pay more, and to appreciate more will send the unmistakable message that in Arkansas, we support and value our law enforcement partners.",en,[],[],[],3,2,9,[],[],https://twitter.com/AsaHutchinson/status/1493302697906294786,False,,0,,,,,,,,[],,,,
1493302621528014855,1493297634144096268,2022-02-14 14:14:23 Eastern Standard Time,2022-02-14,14:14:23,-0400,269992801,asahutchinson,Gov. Asa Hutchinson,,(24/36) We have about $5 million in equipment requests from cities and counties but insufficient funds to cover those grant requests. I recommend $10 million of one-time funding from our June 30 surplus to adequately fund this grant program.,en,[],[],[],2,1,5,[],[],https://twitter.com/AsaHutchinson/status/1493302621528014855,False,,0,,,,,,,,[],,,,
1493302372797403136,1493297634144096268,2022-02-14 14:13:24 Eastern Standard Time,2022-02-14,14:13:24,-0400,269992801,asahutchinson,Gov. Asa Hutchinson,,"(23/36) Next, you passed Act 786 of 2021 to create the Public Safety Equipment Grant Program. The grant program has received applications for funding to purchase everything from body cameras to bullet proof vests.",en,[],[],[],1,1,7,[],[],https://twitter.com/AsaHutchinson/status/1493302372797403136,False,,0,,,,,,,,[],,,,
1493302371019075585,1493297634144096268,2022-02-14 14:13:24 Eastern Standard Time,2022-02-14,14:13:24,-0400,269992801,asahutchinson,Gov. Asa Hutchinson,,(22/36) It is designed to reward and incentivize those dedicated officers who keep our streets safe and our homes protected.  The total cost of this initiative in support of law enforcement will be approximately $45 million.,en,[],[],[],1,2,7,[],[],https://twitter.com/AsaHutchinson/status/1493302371019075585,False,,0,,,,,,,,[],,,,
1493302234645422086,1493297634144096268,2022-02-14 14:12:51 Eastern Standard Time,2022-02-14,14:12:51,-0400,269992801,asahutchinson,Gov. Asa Hutchinson,,"(21/36) Because of your advocacy and hard work, I am able to announce support for the $5,000 one-time payment to every county and city certified law enforcement officer. This will be a one-time payment from our surplus effective June 30 when the fiscal year ends.",en,[],[],[],1,4,9,[],[],https://twitter.com/AsaHutchinson/status/1493302234645422086,False,,0,,,,,,,,[],,,,
1493302232812601350,1493297634144096268,2022-02-14 14:12:51 Eastern Standard Time,2022-02-14,14:12:51,-0400,269992801,asahutchinson,Gov. Asa Hutchinson,,"(20/36) The budget before you includes increased funding for education, health care &amp; public safety. It includes stable funding for the victims of crime through the Crime Victims Reparations program. It provides funding for child abduction response teams &amp; for 2 new drug courts.",en,[],[],[],1,1,7,[],[],https://twitter.com/AsaHutchinson/status/1493302232812601350,False,,0,,,,,,,,[],,,,
1493301986883772417,1493297634144096268,2022-02-14 14:11:52 Eastern Standard Time,2022-02-14,14:11:52,-0400,269992801,asahutchinson,Gov. Asa Hutchinson,,(19/36) The businesses that drive these innovations in mobility will be leaders in the future economy. I want these companies to find a home in Arkansas and for our state to be a leader in future mobility.,en,[],[],[],1,1,6,[],[],https://twitter.com/AsaHutchinson/status/1493301986883772417,False,,0,,,,,,,,[],,,,
1493301984992141320,1493297634144096268,2022-02-14 14:11:52 Eastern Standard Time,2022-02-14,14:11:52,-0400,269992801,asahutchinson,Gov. Asa Hutchinson,,(18/36) I encourage you to build on the private sector success we have in Arkansas &amp; allow innovation &amp; new technologies to bolster our future.,en,[],[],[],1,1,4,[],[],https://twitter.com/AsaHutchinson/status/1493301984992141320,False,,0,,,,,,,,[],,,,
1493301840670343169,1493297634144096268,2022-02-14 14:11:17 Eastern Standard Time,2022-02-14,14:11:17,-0400,269992801,asahutchinson,Gov. Asa Hutchinson,,(17/36) You will have choices to make. You will have the opportunity to remove regulatory burdens &amp; pass legislation to advance new modes of transportation that will keep Arkansas in the lead.,en,[],[],[],1,1,5,[],[],https://twitter.com/AsaHutchinson/status/1493301840670343169,False,,0,,,,,,,,[],,,,
1493301838560567296,1493297634144096268,2022-02-14 14:11:17 Eastern Standard Time,2022-02-14,14:11:17,-0400,269992801,asahutchinson,Gov. Asa Hutchinson,,"(16/36) The Advisory Council will be charged with identifying state laws and regulations that create a barrier to the development and enhancement of electrification, autonomous vehicles, drone delivery and advanced air mobility in Arkansas.",en,[],[],[],2,1,5,[],[],https://twitter.com/AsaHutchinson/status/1493301838560567296,False,,0,,,,,,,,[],,,,
1493301836203315205,1493297634144096268,2022-02-14 14:11:16 Eastern Standard Time,2022-02-14,14:11:16,-0400,269992801,asahutchinson,Gov. Asa Hutchinson,,"(15/36) As governor, I won’t be here for the end of the story, but together we can write the first chapter. Today, I am announcing the creation of the Arkansas Council on Future Mobility.",en,[],[],[],1,1,6,[],[],https://twitter.com/AsaHutchinson/status/1493301836203315205,False,,0,,,,,,,,[],,,,
1493301562835406849,1493297634144096268,2022-02-14 14:10:11 Eastern Standard Time,2022-02-14,14:10:11,-0400,269992801,asahutchinson,Gov. Asa Hutchinson,,"(14/36) In order for us to lead, we need to have electric charging stations across the state.  Arkansas is scheduled to receive $54 million over the next 5 years from the federal government for electric charging station infrastructure.",en,[],[],[],2,1,6,[],[],https://twitter.com/AsaHutchinson/status/1493301562835406849,False,,0,,,,,,,,[],,,,
1493301560591495171,1493297634144096268,2022-02-14 14:10:10 Eastern Standard Time,2022-02-14,14:10:10,-0400,269992801,asahutchinson,Gov. Asa Hutchinson,,"(13/36) In Eastern Arkansas we produce the steel that is required for the battery casing in electric vehicles. So, we are in good position to shape the future from Arkansas.",en,[],[],[],1,1,7,[],[],https://twitter.com/AsaHutchinson/status/1493301560591495171,False,,0,,,,,,,,[],,,,
1493301558670417924,1493297634144096268,2022-02-14 14:10:10 Eastern Standard Time,2022-02-14,14:10:10,-0400,269992801,asahutchinson,Gov. Asa Hutchinson,,"(12/36) We have also recruited the headquarters of an electric vehicle manufacturing company, Canoo; and in South Arkansas Standard Lithium is piloting production of a critical element in supply chain for electric vehicles.",en,[],[],[],1,1,8,[],[],https://twitter.com/AsaHutchinson/status/1493301558670417924,False,,0,,,,,,,,[],,,,
1493301331498614785,1493297634144096268,2022-02-14 14:09:16 Eastern Standard Time,2022-02-14,14:09:16,-0400,269992801,asahutchinson,Gov. Asa Hutchinson,,"(11/36) I was the next speaker following the Minister &amp; I announced Arkansas passed a law in 2019 that allowed piloting of autonomous vehicles. Further, the pilot program was successful &amp; we’re using fully automated vehicles delivering goods from the warehouse to retail stores.",en,[],[],[],1,1,4,[],[],https://twitter.com/AsaHutchinson/status/1493301331498614785,False,,0,,,,,,,,[],,,,
1493301329430777858,1493297634144096268,2022-02-14 14:09:15 Eastern Standard Time,2022-02-14,14:09:15,-0400,269992801,asahutchinson,Gov. Asa Hutchinson,,"(10/36) Last year between the Delta &amp; Omicron surge, I was able to make an economic development trip to Israel. I was preceded on the stage by the Israeli Transportation Minister who announced they hope to get a bill through the Knesset to allow piloting of autonomous vehicles.",en,[],[],[],1,1,4,[],[],https://twitter.com/AsaHutchinson/status/1493301329430777858,False,,0,,,,,,,,[],,,,
1493301327606259716,1493297634144096268,2022-02-14 14:09:15 Eastern Standard Time,2022-02-14,14:09:15,-0400,269992801,asahutchinson,Gov. Asa Hutchinson,,(9/36) We know the success of our transportation industry is critical to the economic future of AR. To position our state for the future we must act today because the future of supply chain deliveries will be different tomorrow from trucks on our road today. Let’s keep leading.,en,[],[],[],1,1,5,[],[],https://twitter.com/AsaHutchinson/status/1493301327606259716,False,,0,,,,,,,,[],,,,
1493301021585592323,1493297634144096268,2022-02-14 14:08:02 Eastern Standard Time,2022-02-14,14:08:02,-0400,269992801,asahutchinson,Gov. Asa Hutchinson,,"(8/36) Why Arkansas? We have always led in transportation from entrepreneurs like J.B. Hunt who started hauling rice hulls from Stuttgart to NWA, Sheridan Garrison who started American Freightways that is now FedEx Freight, and Steve Williams of Maverick Transportation.",en,[],[],[],1,1,6,[],[],https://twitter.com/AsaHutchinson/status/1493301021585592323,False,,0,,,,,,,,[],,,,
1493300859832348675,1493297634144096268,2022-02-14 14:07:23 Eastern Standard Time,2022-02-14,14:07:23,-0400,269992801,asahutchinson,Gov. Asa Hutchinson,,"(7/36) I’m challenging Arkansas to lead in innovation by focusing on the future of advanced mobility. This focus includes autonomous vehicles, upward mobility, electric vehicles &amp; modes of transportation that don't exist today but could be the dream of an Arkansas student now.",en,[],[],[],1,1,7,[],[],https://twitter.com/AsaHutchinson/status/1493300859832348675,False,,0,,,,,,,,[],,,,
1493300478297489414,1493297634144096268,2022-02-14 14:05:52 Eastern Standard Time,2022-02-14,14:05:52,-0400,269992801,asahutchinson,Gov. Asa Hutchinson,,"(6/36) In 1956, the Eisenhower administration laid out a bold plan to change the way Americans moved. The Interstate Highway System connected all parts of America, even previously remote states like Arkansas. This concept was bold at a time when many Americans traveled by train.",en,[],[],[],1,1,4,[],[],https://twitter.com/AsaHutchinson/status/1493300478297489414,False,,0,,,,,,,,[],,,,
1493299255402012677,1493297634144096268,2022-02-14 14:01:01 Eastern Standard Time,2022-02-14,14:01:01,-0400,269992801,asahutchinson,Gov. Asa Hutchinson,,"(5/36) We navigated our way through a pandemic, and we kept our schools open because we knew our children needed to be in the classroom. I knew in Arkansas every business was essential, so we never sheltered in place or stopped producing.",en,[],[],[],3,4,7,[],[],https://twitter.com/AsaHutchinson/status/1493299255402012677,False,,0,,,,,,,,[],,,,
1493298467019661313,1493297634144096268,2022-02-14 13:57:53 Eastern Standard Time,2022-02-14,13:57:53,-0400,269992801,asahutchinson,Gov. Asa Hutchinson,,(4/36) In Arkansas we support our military bases and their missions. That is why we worked so hard to bring in the F-35 pilot training mission to Ebbing Air National Guard Base in Fort Smith. This will be an economic boon for Western Arkansas for decades to come.,en,[],[],[],2,2,9,[],[],https://twitter.com/AsaHutchinson/status/1493298467019661313,False,,0,,,,,,,,[],,,,
1493297797982035968,1493297634144096268,2022-02-14 13:55:13 Eastern Standard Time,2022-02-14,13:55:13,-0400,269992801,asahutchinson,Gov. Asa Hutchinson,,"(3/36) 7 years ago, I took office w/the desire to improve quality of life in Arkansas by improving education, increasing manufacturing, preserving our outdoor heritage &amp; supporting farmers. We now have the lowest unemployment ever at 3.1% &amp; a record number of Arkansans working.",en,[],[],[],1,1,8,[],[],https://twitter.com/AsaHutchinson/status/1493297797982035968,False,,0,,,,,,,,[],,,,
