id,conversation_id,created_at,date,time,timezone,user_id,username,name,place,tweet,language,mentions,urls,photos,replies_count,retweets_count,likes_count,hashtags,cashtags,link,retweet,quote_url,video,thumbnail,near,geo,source,user_rt_id,user_rt,retweet_id,reply_to,retweet_date,translate,trans_src,trans_dest
1509224857002823683,1509224857002823683,2022-03-30 13:43:40 Eastern Daylight Time,2022-03-30,13:43:40,-0400,1084924525232513025,govbilllee,Gov. Bill Lee,,Educators across TN are leading the charge to prepare students for success in our workforce. Enjoyed visiting with nursing &amp; mechatronics students today at Trousdale County High School as they skill up to become career ready.  https://t.co/XE1wPFjjVe,en,[],[],"['https://pbs.twimg.com/media/FPHX34ZX0AcMof9.jpg', 'https://pbs.twimg.com/media/FPHX34bXEAw5y07.jpg', 'https://pbs.twimg.com/media/FPHX34ZWYAQO-UP.jpg', 'https://pbs.twimg.com/media/FPHX34ZXoAs-q6Q.jpg']",14,3,52,[],[],https://twitter.com/GovBillLee/status/1509224857002823683,False,,1,https://pbs.twimg.com/media/FPHX34ZX0AcMof9.jpg,,,,,,,[],,,,
1508911975060938762,1508911975060938762,2022-03-29 17:00:23 Eastern Daylight Time,2022-03-29,17:00:23,-0400,1084924525232513025,govbilllee,Gov. Bill Lee,,"It was an honor to celebrate &amp; welcome Dr. @McQueenCandice as the 18th president of @lipscomb. Her leadership &amp; vision will help continue the longstanding, excellent work of Lipscomb University.  https://t.co/Oyk1BNDWPT",en,"[{'screen_name': 'mcqueencandice', 'name': 'candice mcqueen', 'id': '792673406'}, {'screen_name': 'lipscomb', 'name': 'lipscomb university', 'id': '17224160'}]",[],"['https://pbs.twimg.com/media/FPC5_J9WUAgw6Ny.jpg', 'https://pbs.twimg.com/media/FPC5_J9X0AILmbn.jpg']",5,11,67,[],[],https://twitter.com/GovBillLee/status/1508911975060938762,False,,1,https://pbs.twimg.com/media/FPC5_J9WUAgw6Ny.jpg,,,,,,,[],,,,
1508776242094485508,1508776242094485508,2022-03-29 08:01:02 Eastern Daylight Time,2022-03-29,08:01:02,-0400,1084924525232513025,govbilllee,Gov. Bill Lee,,"Today and every day, we honor the courage &amp; sacrifice of those who served in the Vietnam War, including nearly 1,300 Tennesseans who made the ultimate sacrifice. TN is grateful &amp; we are proud to be home to 160,000 Vietnam veterans.  https://t.co/SmMJv3dDrf",en,[],[],['https://pbs.twimg.com/media/FPA__pLWYAIx80u.jpg'],18,34,201,[],[],https://twitter.com/GovBillLee/status/1508776242094485508,False,,1,https://pbs.twimg.com/media/FPA__pLWYAIx80u.jpg,,,,,,,[],,,,
1508551589287628806,1508551589287628806,2022-03-28 17:08:21 Eastern Daylight Time,2022-03-28,17:08:21,-0400,1084924525232513025,govbilllee,Gov. Bill Lee,,"Each of these qualified Tennesseans will bring valuable experience to their respective roles. I am confident they will serve our state with the highest integrity, and I look forward to their service.  https://t.co/zi1028I0oa",en,[],['https://www.tn.gov/governor/news/2022/3/28/gov--lee-announces-judicial-appointments.html'],[],15,6,32,[],[],https://twitter.com/GovBillLee/status/1508551589287628806,False,,0,,,,,,,,[],,,,
1507351480034078723,1507351480034078723,2022-03-25 09:39:32 Eastern Daylight Time,2022-03-25,09:39:32,-0400,1084924525232513025,govbilllee,Gov. Bill Lee,,"Yesterday, I sat down with business leaders in Covington to discuss the challenges they are facing amid surging inflation &amp; how our proposed grocery tax suspension will provide direct relief to every Tennessean.  https://t.co/yPORrdnDlz",en,[],[],"['https://pbs.twimg.com/media/FOswLfoXIAQAzRf.jpg', 'https://pbs.twimg.com/media/FOswLfmX0AkEUvr.jpg', 'https://pbs.twimg.com/media/FOswLhfXMAUq4jm.jpg']",84,6,94,[],[],https://twitter.com/GovBillLee/status/1507351480034078723,False,,1,https://pbs.twimg.com/media/FOswLfoXIAQAzRf.jpg,,,,,,,[],,,,
1507089347769688071,1507089347769688071,2022-03-24 16:17:55 Eastern Daylight Time,2022-03-24,16:17:55,-0400,1084924525232513025,govbilllee,Gov. Bill Lee,,WATCH LIVE:  https://t.co/JuhQtXVN87,en,[],['https://www.actionnews5.com/2022/03/24/tennessee-gov-bill-lee-propose-30-day-grocery-tax-suspension/'],[],32,15,57,[],[],https://twitter.com/GovBillLee/status/1507089347769688071,False,,0,,,,,,,,[],,,,
1507029231934525443,1507029231934525443,2022-03-24 12:19:02 Eastern Daylight Time,2022-03-24,12:19:02,-0400,1084924525232513025,govbilllee,Gov. Bill Lee,,"Thanks to the efforts of the @tennesseeguard, @tnhospitals &amp; @bfrist, pallets of medical supplies have landed overseas to help Ukrainians. The Volunteer State stands in support of Ukraine 🇺🇦  https://t.co/8nK3g5b93H",en,"[{'screen_name': 'tennesseeguard', 'name': 'tn national guard', 'id': '1963387057'}, {'screen_name': 'tnhospitals', 'name': 'tha', 'id': '3073343214'}, {'screen_name': 'bfrist', 'name': 'bill frist, m.d.', 'id': '5660532'}]",[],"['https://pbs.twimg.com/media/FOoKmnmXEAUfRnt.jpg', 'https://pbs.twimg.com/media/FOoKoGYWUAkR5im.jpg', 'https://pbs.twimg.com/media/FOoK0YpXsAoldfW.jpg']",15,22,119,[],[],https://twitter.com/GovBillLee/status/1507029231934525443,False,,1,https://pbs.twimg.com/media/FOoKmnmXEAUfRnt.jpg,,,,,,,[],,,,
1506950932478763014,1506950931459551232,2022-03-24 07:07:54 Eastern Daylight Time,2022-03-24,07:07:54,-0400,1084924525232513025,govbilllee,Gov. Bill Lee,,"Our state has the ability to put dollars back in the pockets of hardworking Tennesseans, &amp; I thank members of the General Assembly for their continued partnership in maintaining our fiscally conservative approach.  https://t.co/jgvAqywHzf",en,[],['https://www.tn.gov/governor/news/2022/3/24/gov--lee-announces-30-day-grocery-tax-suspension.html'],[],31,42,176,[],[],https://twitter.com/GovBillLee/status/1506950932478763014,False,,0,,,,,,,,[],,,,
1506950931459551232,1506950931459551232,2022-03-24 07:07:54 Eastern Daylight Time,2022-03-24,07:07:54,-0400,1084924525232513025,govbilllee,Gov. Bill Lee,,"As Americans see their cost-of-living skyrocket amid historic inflation, suspending the grocery tax is the most effective way to provide direct relief to every Tennessean.",en,[],[],[],109,53,566,[],[],https://twitter.com/GovBillLee/status/1506950931459551232,False,,0,,,,,,,,[],,,,
1506774518152507412,1506774518152507412,2022-03-23 19:26:54 Eastern Daylight Time,2022-03-23,19:26:54,-0400,1084924525232513025,govbilllee,Gov. Bill Lee,,"As a product of rural TN, some of my fondest memories were with @4H. It was an honor to welcome students to the 75th TN 4-H Congress. It’s critical we develop young people with a passion for rural &amp; local communities &amp; I’m inspired to see these young leaders strengthen our state.  https://t.co/quX2uYxIIi",en,"[{'screen_name': '4h', 'name': '4-h', 'id': '14107459'}]",[],"['https://pbs.twimg.com/media/FOkhyF8WQAUlYdf.jpg', 'https://pbs.twimg.com/media/FOkhz88XwAULFgv.jpg', 'https://pbs.twimg.com/media/FOkh1XrXMAMLxQH.jpg']",12,9,67,[],[],https://twitter.com/GovBillLee/status/1506774518152507412,False,,1,https://pbs.twimg.com/media/FOkhyF8WQAUlYdf.jpg,,,,,,,[],,,,
1506671177724575751,1506671177724575751,2022-03-23 12:36:16 Eastern Daylight Time,2022-03-23,12:36:16,-0400,1084924525232513025,govbilllee,Gov. Bill Lee,,".@marialeetn &amp; I were honored to join @HelpingAHero &amp; @theleegreenwood to break ground on a home for Marine Lance Cpl. Eric Frazier. Eric represents the very best of Tennessee, &amp; we are deeply grateful for his faithful service to our state &amp; nation.  https://t.co/F7Mg4gAMEz",en,"[{'screen_name': 'marialeetn', 'name': 'first lady maria lee', 'id': '1084890796648816641'}, {'screen_name': 'helpingahero', 'name': 'helping a hero', 'id': '137779067'}, {'screen_name': 'theleegreenwood', 'name': 'lee greenwood', 'id': '32897787'}]",[],"['https://pbs.twimg.com/media/FOjE7fcXwAUldEo.jpg', 'https://pbs.twimg.com/media/FOjE7feXMA0dBZv.jpg', 'https://pbs.twimg.com/media/FOjFCQ7X0AMrFGE.jpg', 'https://pbs.twimg.com/media/FOjFFIDXwAUZOto.jpg']",8,7,47,[],[],https://twitter.com/GovBillLee/status/1506671177724575751,False,,1,https://pbs.twimg.com/media/FOjE7fcXwAUldEo.jpg,,,,,,,[],,,,
1506343226453680135,1506343226453680135,2022-03-22 14:53:06 Eastern Daylight Time,2022-03-22,14:53:06,-0400,1084924525232513025,govbilllee,Gov. Bill Lee,,It's not every day that you get to milk a cow outside the TN Capitol. Enjoyed putting some old skills to use during another legenDAIRY Ag Day on the Hill.  https://t.co/StM5W7PQQL,en,[],[],"['https://pbs.twimg.com/media/FOebBh3XoAg_UYF.jpg', 'https://pbs.twimg.com/media/FOebF4hXsAQMdhJ.jpg', 'https://pbs.twimg.com/media/FOebJELXsAEfmY4.jpg']",49,17,250,[],[],https://twitter.com/GovBillLee/status/1506343226453680135,False,,1,https://pbs.twimg.com/media/FOebBh3XoAg_UYF.jpg,,,,,,,[],,,,
1506257873449406469,1506257873449406469,2022-03-22 09:13:56 Eastern Daylight Time,2022-03-22,09:13:56,-0400,1084924525232513025,govbilllee,Gov. Bill Lee,,"Today we celebrate TN's #1 industry &amp; the hard-working Tennesseans who make that possible. Thank you, ag professionals, for your commitment to an industry that keeps TN's economy &amp; communities strong.  https://t.co/kpBvDRxiZx",en,[],[],['https://pbs.twimg.com/media/FOdM1CyWUAcpbfz.jpg'],16,30,167,[],[],https://twitter.com/GovBillLee/status/1506257873449406469,False,,1,https://pbs.twimg.com/media/FOdM1CyWUAcpbfz.jpg,,,,,,,[],,,,
1505975261254270982,1505975261254270982,2022-03-21 14:30:56 Eastern Daylight Time,2022-03-21,14:30:56,-0400,1084924525232513025,govbilllee,Gov. Bill Lee,,TN is a driving force in the auto industry because of our skilled workforce &amp; business climate. @GM’s continued partnership ensures our economy thrives &amp; that Tennesseans have opportunities to thrive. Congratulations on a milestone for the Cadillac LYRIQ &amp; TN craftsmanship.  https://t.co/qNrscg8bhj,en,"[{'screen_name': 'gm', 'name': 'general motors', 'id': '10850192'}]",[],"['https://pbs.twimg.com/media/FOZL2FhXoAEV281.jpg', 'https://pbs.twimg.com/media/FOZL2FlWQAQJ9dT.jpg']",31,16,113,[],[],https://twitter.com/GovBillLee/status/1505975261254270982,False,,1,https://pbs.twimg.com/media/FOZL2FhXoAEV281.jpg,,,,,,,[],,,,
1505237948744273933,1505237948744273933,2022-03-19 13:41:07 Eastern Daylight Time,2022-03-19,13:41:07,-0400,1084924525232513025,govbilllee,Gov. Bill Lee,,An exciting day for @MarchMadnessWBB in Knoxville. Cheering on our @LadyVol_Hoops &amp; @BelmontWBB!,en,"[{'screen_name': 'marchmadnesswbb', 'name': 'ncaa march madness', 'id': '63799043'}, {'screen_name': 'ladyvol_hoops', 'name': 'lady vol basketball', 'id': '245536839'}, {'screen_name': 'belmontwbb', 'name': 'belmont wbasketball', 'id': '24284494'}]",[],[],15,5,71,[],[],https://twitter.com/GovBillLee/status/1505237948744273933,False,,0,,,,,,,,[],,,,
1503790866988781575,1503790866988781575,2022-03-15 13:50:56 Eastern Daylight Time,2022-03-15,13:50:56,-0400,1084924525232513025,govbilllee,Gov. Bill Lee,,"For nearly 50 years, the TN Prayer Breakfast has brought faith &amp; community leaders together for prayer, praise, &amp; worship. Honored to join hundreds of Tennesseans at @lipscomb to thank God for our blessings &amp; ask Him for healing, grace &amp; favor over our state &amp; nation.  https://t.co/4kSp0GhrdV",en,"[{'screen_name': 'lipscomb', 'name': 'lipscomb university', 'id': '17224160'}]",[],"['https://pbs.twimg.com/media/FN6IKe5WYAESzr6.jpg', 'https://pbs.twimg.com/media/FN6IKe3XwAEQYd0.jpg', 'https://pbs.twimg.com/media/FN6IcCeWUAoCfJH.jpg', 'https://pbs.twimg.com/media/FN6IcCrXIAEEOe8.jpg']",86,17,139,[],[],https://twitter.com/GovBillLee/status/1503790866988781575,False,,1,https://pbs.twimg.com/media/FN6IKe5WYAESzr6.jpg,,,,,,,[],,,,
1503505153089064967,1503505153089064967,2022-03-14 18:55:36 Eastern Daylight Time,2022-03-14,18:55:36,-0400,1084924525232513025,govbilllee,Gov. Bill Lee,,Enjoyed meeting w/ TN Municipal League &amp; discussing how TN's continued growth relies on improving public education. Our funding formula will positively impact every community — from rural to urban — by investing more in each district with greater accountability &amp; transparency.  https://t.co/EohwT7phXl,en,[],[],"['https://pbs.twimg.com/media/FN2Fv4AWYAQUUj8.jpg', 'https://pbs.twimg.com/media/FN2Fv4DWQAUEKm4.jpg']",58,4,69,[],[],https://twitter.com/GovBillLee/status/1503505153089064967,False,,1,https://pbs.twimg.com/media/FN2Fv4AWYAQUUj8.jpg,,,,,,,[],,,,
1503152094764838914,1503152094764838914,2022-03-13 19:32:41 Eastern Daylight Time,2022-03-13,19:32:41,-0400,1084924525232513025,govbilllee,Gov. Bill Lee,,"Congrats @Vol_Hoops, @Memphis_MBB &amp; @GoMocsMBB on making it to the big dance. Exciting @MarchMadnessMBB for The Volunteer State!",en,"[{'screen_name': 'vol_hoops', 'name': 'tennessee basketball', 'id': '35761328'}, {'screen_name': 'memphis_mbb', 'name': 'memphis basketball', 'id': '59170955'}, {'screen_name': 'gomocsmbb', 'name': 'chattanooga mocs mbb', 'id': '714465582'}, {'screen_name': 'marchmadnessmbb', 'name': 'ncaa march madness', 'id': '202416362'}]",[],[],16,17,162,[],[],https://twitter.com/GovBillLee/status/1503152094764838914,False,,0,,,,,,,,[],,,,
1502434453351768075,1502434453351768075,2022-03-11 19:01:02 Eastern Standard Time,2022-03-11,19:01:02,-0400,1084924525232513025,govbilllee,Gov. Bill Lee,,"In TN, we are committed to serving the 1.6+ million Tennesseans with disabilities across our state, &amp; we are proud to recognize &amp; celebrate the important advocacy work done by this community. #DisabilityAdvocacyDayTN  https://t.co/pIf09SqGca",en,[],[],['https://pbs.twimg.com/media/FNm4K93WQAAFt_z.jpg'],58,24,134,['disabilityadvocacydaytn'],[],https://twitter.com/GovBillLee/status/1502434453351768075,False,,1,https://pbs.twimg.com/media/FNm4K93WQAAFt_z.jpg,,,,,,,[],,,,
1501633192851353603,1501633192851353603,2022-03-09 13:57:06 Eastern Standard Time,2022-03-09,13:57:06,-0400,1084924525232513025,govbilllee,Gov. Bill Lee,,Our business community plays a vital role in ensuring TN’s success. Honored to join @nashchamber  members to discuss how our proposed budget will position our state to make historic investments in education &amp; infrastructure to prepare TN’s economy for continued growth.  https://t.co/uAaRczCgof,en,"[{'screen_name': 'nashchamber', 'name': 'nashville chamber', 'id': '40154873'}]",[],"['https://pbs.twimg.com/media/FNbeevNVkAItVwL.jpg', 'https://pbs.twimg.com/media/FNbeevNVQAAZ-gL.jpg', 'https://pbs.twimg.com/media/FNbeeuuXwAUOkwl.jpg']",51,7,46,[],[],https://twitter.com/GovBillLee/status/1501633192851353603,False,,1,https://pbs.twimg.com/media/FNbeevNVkAItVwL.jpg,,,,,,,[],,,,
