id,conversation_id,created_at,date,time,timezone,user_id,username,name,place,tweet,language,mentions,urls,photos,replies_count,retweets_count,likes_count,hashtags,cashtags,link,retweet,quote_url,video,thumbnail,near,geo,source,user_rt_id,user_rt,retweet_id,reply_to,retweet_date,translate,trans_src,trans_dest
1506304772424482817,1506304772424482817,2022-03-22 12:20:18 Eastern Daylight Time,2022-03-22,12:20:18,-0400,19668491,governorkayivey,Governor Kay Ivey,,"Happy #NationalAgDay! Over the last few months, I’ve had an opportunity to tour the new Dothan AG Museum &amp; learn about a school operated hydroponic system run by FFA students in Grant. AG is a $70B industry in AL, &amp; I’m encouraged we're preparing the next gen of agriculturalists.  https://t.co/js2qVPi6c0",en,[],[],"['https://pbs.twimg.com/media/FOd4MPRWQAEZEGk.jpg', 'https://pbs.twimg.com/media/FOd4MPUXIBAVe96.jpg', 'https://pbs.twimg.com/media/FOd4MPQWYAAvluW.jpg', 'https://pbs.twimg.com/media/FOd4MPNXsA0CYLL.jpg']",0,1,8,['nationalagday'],[],https://twitter.com/GovernorKayIvey/status/1506304772424482817,False,,1,https://pbs.twimg.com/media/FOd4MPRWQAEZEGk.jpg,,,,,,,[],,,,
1506284917096861699,1506284917096861699,2022-03-22 11:01:24 Eastern Daylight Time,2022-03-22,11:01:24,-0400,19668491,governorkayivey,Governor Kay Ivey,,I commend the men &amp; women in AL who uphold our laws &amp; put their lives on the line every time they wear their uniform. I’m hopeful that these grants will benefit &amp; protect AL citizens &amp; officers. #alpolitics @ADECA    https://t.co/bIrhK66A5D,en,"[{'screen_name': 'adeca', 'name': 'adeca', 'id': '45939226'}]",['https://governor.alabama.gov/newsroom/2022/03/governor-ivey-awards-grants-to-equip-more-law-enforcement-agencies/'],[],5,3,14,['alpolitics'],[],https://twitter.com/GovernorKayIvey/status/1506284917096861699,False,,0,,,,,,,,[],,,,
1506273322065084424,1506273322065084424,2022-03-22 10:15:19 Eastern Daylight Time,2022-03-22,10:15:19,-0400,19668491,governorkayivey,Governor Kay Ivey,,"Folks, we’re anticipating another bout of severe weather this evening going into tomorrow morning. Please make sure you have multiple ways of receiving reliable weather alerts. Nighttime storms can be even more dangerous, so stay weather aware. #alwx #alpolitics @AlabamaEMA",en,"[{'screen_name': 'alabamaema', 'name': 'alabama ema', 'id': '36471939'}]",[],[],1,7,24,"['alwx', 'alpolitics']",[],https://twitter.com/GovernorKayIvey/status/1506273322065084424,False,https://twitter.com/alabamaema/status/1506238904764149765,0,,,,,,,,[],,,,
1506012509312266249,1506012509312266249,2022-03-21 16:58:57 Eastern Daylight Time,2022-03-21,16:58:57,-0400,19668491,governorkayivey,Governor Kay Ivey,,".@RubberNews recently named Specification Rubber Products as the Best Place to Work, &amp; this morning I had an opportunity to see why! Since 1968, this #MadeinAL company has made the components we need to have clean water in our homes. I’m proud of their accomplishment! #alpolitics  https://t.co/qklNi4nHz1",en,"[{'screen_name': 'rubbernews', 'name': 'rubber news', 'id': '41136733'}]",[],"['https://pbs.twimg.com/media/FOZuZMcWQAENhCg.jpg', 'https://pbs.twimg.com/media/FOZuZMbXoAA8GOx.jpg', 'https://pbs.twimg.com/media/FOZuZOxXEAAx05n.jpg', 'https://pbs.twimg.com/media/FOZuZQwXoAAcEdH.jpg']",7,2,19,"['madeinal', 'alpolitics']",[],https://twitter.com/GovernorKayIvey/status/1506012509312266249,False,,1,https://pbs.twimg.com/media/FOZuZMcWQAENhCg.jpg,,,,,,,[],,,,
1504917952558243846,1504917952558243846,2022-03-18 16:29:34 Eastern Daylight Time,2022-03-18,16:29:34,-0400,19668491,governorkayivey,Governor Kay Ivey,,"While visiting Ozark, I toured Motobilt, an offroad vehicles aftermarket parts manufacturer, &amp; Brauer Aerospace, the largest manufacturer of helicopter skid shoes in the U.S. Here are 2 successful, AL companies that are showing all that AL has to offer. #MadeinAL #alpolitics  https://t.co/fzoibA3OlG",en,[],[],"['https://pbs.twimg.com/media/FOKK5p0WUAcyQmU.jpg', 'https://pbs.twimg.com/media/FOKK5pyXIAQWcQo.jpg', 'https://pbs.twimg.com/media/FOKK5qfX0Awrm4P.jpg', 'https://pbs.twimg.com/media/FOKK5sqXoAQsVlG.jpg']",8,3,28,"['madeinal', 'alpolitics']",[],https://twitter.com/GovernorKayIvey/status/1504917952558243846,False,,1,https://pbs.twimg.com/media/FOKK5p0WUAcyQmU.jpg,,,,,,,[],,,,
1504897257686114306,1504897257686114306,2022-03-18 15:07:20 Eastern Daylight Time,2022-03-18,15:07:20,-0400,19668491,governorkayivey,Governor Kay Ivey,,"I am pleased to award @ADECA grants totaling $101,025 to help five law enforcement agencies purchase new or update existing equipment.   Find out more here:  https://t.co/lK8BQBrPBk.   #alpolitics",en,"[{'screen_name': 'adeca', 'name': 'adeca', 'id': '45939226'}]",['https://governor.alabama.gov/newsroom/2022/03/governor-ivey-awards-grants-for-law-enforcement-equipment-in-five-counties/'],[],7,2,7,['alpolitics'],[],https://twitter.com/GovernorKayIvey/status/1504897257686114306,False,,0,,,,,,,,[],,,,
1504837129158934550,1504837129158934550,2022-03-18 11:08:24 Eastern Daylight Time,2022-03-18,11:08:24,-0400,19668491,governorkayivey,Governor Kay Ivey,,Alabama is receiving almost $312 million in CDBG funds for recovery efforts from Hurricanes Sally &amp; Zeta. Our coastal communities were battered in the fall of 2020 &amp; these funds will provide a boost to their long-term recovery. @ADECA #alpolitics     https://t.co/uQ8F7M2Or4,en,"[{'screen_name': 'adeca', 'name': 'adeca', 'id': '45939226'}]",['https://governor.alabama.gov/newsroom/2022/03/governor-ivey-announces-alabama-receiving-nearly-312-million-to-aid-hurricane-recovery/'],[],19,6,20,['alpolitics'],[],https://twitter.com/GovernorKayIvey/status/1504837129158934550,False,,0,,,,,,,,[],,,,
1504813458159771667,1504813458159771667,2022-03-18 09:34:21 Eastern Daylight Time,2022-03-18,09:34:21,-0400,19668491,governorkayivey,Governor Kay Ivey,,"Folks, please make sure you monitor the weather in your area today, as we anticipate two rounds of severe weather across the state. Stay safe! #alwx #alpolitics",en,[],[],[],5,10,31,"['alwx', 'alpolitics']",[],https://twitter.com/GovernorKayIvey/status/1504813458159771667,False,https://twitter.com/AlabamaEMA/status/1504791945641607169,0,,,,,,,,[],,,,
1504611189296410631,1504611189296410631,2022-03-17 20:10:36 Eastern Daylight Time,2022-03-17,20:10:36,-0400,19668491,governorkayivey,Governor Kay Ivey,,I had a good visit with the AL Committee on Credentialing on Career Pathways (ACCCP) today. The work they’re doing to enhance our workforce dev initiatives has been featured in USA Today &amp; Forbes as a national best practice for connecting the workforce &amp; the economy. Keep it up!  https://t.co/jql4ab0IYD,en,[],[],"['https://pbs.twimg.com/media/FOFz5d_WYAAecAI.jpg', 'https://pbs.twimg.com/media/FOFz5eGXwAg50jR.jpg']",5,7,40,[],[],https://twitter.com/GovernorKayIvey/status/1504611189296410631,False,,1,https://pbs.twimg.com/media/FOFz5d_WYAAecAI.jpg,,,,,,,[],,,,
1504596271859970056,1504596271859970056,2022-03-17 19:11:19 Eastern Daylight Time,2022-03-17,19:11:19,-0400,19668491,governorkayivey,Governor Kay Ivey,,"Thank you to the Women’s Foundation of Alabama for inviting me to speak at your 4th annual Capitol Heels Advocacy Day in Montgomery. As I often say, sometimes the best man for a job is a woman! #WomensHistoryMonth @WomensFdnAL  https://t.co/Q9vs6UKzPF",en,"[{'screen_name': 'womensfdnal', 'name': 'women’s foundation of alabama', 'id': '63487312'}]",[],"['https://pbs.twimg.com/media/FOFmU2GXwAIqgxK.jpg', 'https://pbs.twimg.com/media/FOFmU2LXwAQwf9s.jpg']",3,1,19,['womenshistorymonth'],[],https://twitter.com/GovernorKayIvey/status/1504596271859970056,False,,1,https://pbs.twimg.com/media/FOFmU2GXwAIqgxK.jpg,,,,,,,[],,,,
1504559458713747464,1504559458713747464,2022-03-17 16:45:02 Eastern Daylight Time,2022-03-17,16:45:02,-0400,19668491,governorkayivey,Governor Kay Ivey,,"In 2019, I helped Koch Foods break ground on their state-of-the-art grain storage &amp; distribution facility. Now, I’m back in Atalla to help cut the ribbon on this $50M+ facility! I am grateful for the more than 3,000 jobs Koch Foods provides across our state. #alpolitics  https://t.co/BB8fF0Hxme",en,[],[],"['https://pbs.twimg.com/media/FOFE11yXEAUFaF5.jpg', 'https://pbs.twimg.com/media/FOFE11rWQAADf3Y.jpg', 'https://pbs.twimg.com/media/FOFE11sXoAg1IfM.jpg']",10,0,22,['alpolitics'],[],https://twitter.com/GovernorKayIvey/status/1504559458713747464,False,,1,https://pbs.twimg.com/media/FOFE11yXEAUFaF5.jpg,,,,,,,[],,,,
1504554330740899848,1504554330740899848,2022-03-17 16:24:40 Eastern Daylight Time,2022-03-17,16:24:40,-0400,19668491,governorkayivey,Governor Kay Ivey,,I’m proud to announce that more than $5 million in state funding is being awarded to cities and counties for various road and bridge projects as part of the Rebuild Alabama Act grant program! #alpolitics    https://t.co/E8ys2aWt5Y,en,[],['https://governor.alabama.gov/newsroom/2022/03/governor-ivey-announces-another-round-of-local-projects-funded-by-rebuild-alabama/'],[],13,5,30,['alpolitics'],[],https://twitter.com/GovernorKayIvey/status/1504554330740899848,False,,0,,,,,,,,[],,,,
1504472997658198031,1504472997658198031,2022-03-17 11:01:29 Eastern Daylight Time,2022-03-17,11:01:29,-0400,19668491,governorkayivey,Governor Kay Ivey,,We couldn’t drive safely in the rain or snow today if it wasn’t for Mary Anderson. Her invention of the automatic wiper blade earned her a spot in the @InventorsHOF. #womenshistorymonth @AlabamaArchives @APTV   ▶️  https://t.co/d20dKEqrW2  https://t.co/MhneIebMjx,en,"[{'screen_name': 'inventorshof', 'name': 'inventors hof', 'id': '1140231224'}, {'screen_name': 'alabamaarchives', 'name': 'alabama department of archives and history', 'id': '1202616420'}, {'screen_name': 'aptv', 'name': 'alabama public television', 'id': '20341454'}]",['https://www.alabamalegacy.org/mary-anderson/'],['https://pbs.twimg.com/media/FOD2Nr1VkA8z6Kt.jpg'],3,7,25,['womenshistorymonth'],[],https://twitter.com/GovernorKayIvey/status/1504472997658198031,False,,1,https://pbs.twimg.com/media/FOD2Nr1VkA8z6Kt.jpg,,,,,,,[],,,,
1504163947632603138,1504163900228521984,2022-03-16 14:33:25 Eastern Daylight Time,2022-03-16,14:33:25,-0400,19668491,governorkayivey,Governor Kay Ivey,,This continued leadership collaboration will strengthen Alabama’s ability to prepare for the economy of the future. @InnovateAlabama #alpolitics 2/2,en,"[{'screen_name': 'innovatealabama', 'name': 'innovate alabama', 'id': '1338977922934321152'}]",[],[],2,0,2,['alpolitics'],[],https://twitter.com/GovernorKayIvey/status/1504163947632603138,False,,0,,,,,,,,[],,,,
1504163900228521984,1504163900228521984,2022-03-16 14:33:14 Eastern Daylight Time,2022-03-16,14:33:14,-0400,19668491,governorkayivey,Governor Kay Ivey,,March has been a milestone month for @InnovateAlabama! I was proud to recently join the inaugural Alabama Innovation Corporation Board meeting &amp; sign Articles of Incorporation. Learn more via  https://t.co/R1DVBAjRZO. #alpolitics 1/2  https://t.co/wpA5sYqQOR,en,"[{'screen_name': 'innovatealabama', 'name': 'innovate alabama', 'id': '1338977922934321152'}]",['https://bit.ly/3iaUtoP'],['https://pbs.twimg.com/media/FN_dF_0X0AYlF0w.jpg'],5,6,22,['alpolitics'],[],https://twitter.com/GovernorKayIvey/status/1504163900228521984,False,,1,https://pbs.twimg.com/media/FN_dF_0X0AYlF0w.jpg,,,,,,,[],,,,
1504138802301968387,1504138802301968387,2022-03-16 12:53:30 Eastern Daylight Time,2022-03-16,12:53:30,-0400,19668491,governorkayivey,Governor Kay Ivey,,"Although I’m from Camden, I consider @MGMChamber as my home chamber. It was a pleasure to provide a state of the state address to this group, many of whom are friends. I appreciate our Capital City chamber partners for all that they’re doing to make Montgomery &amp; our state better.  https://t.co/Jtdc8RhSVJ",en,"[{'screen_name': 'mgmchamber', 'name': 'montgomery chamber', 'id': '259823124'}]",[],"['https://pbs.twimg.com/media/FN_GRL8XsAE5RBm.jpg', 'https://pbs.twimg.com/media/FN_GRL9XoAArTJu.jpg']",1,0,19,[],[],https://twitter.com/GovernorKayIvey/status/1504138802301968387,False,,1,https://pbs.twimg.com/media/FN_GRL8XsAE5RBm.jpg,,,,,,,[],,,,
1504082425869127685,1504082425869127685,2022-03-16 09:09:29 Eastern Daylight Time,2022-03-16,09:09:29,-0400,19668491,governorkayivey,Governor Kay Ivey,,".@Niagara_Water plans to open a new production facility in Opelika, creating 50 jobs! Niagara Bottling is making a significant investment to launch this operation, &amp; we are happy that the company chose to do it in Sweet Home Alabama. #MadeinAL #alpolitics   https://t.co/bXuv6o4vMu",en,"[{'screen_name': 'niagara_water', 'name': 'niagara water', 'id': '1710767102'}]",['https://governor.alabama.gov/newsroom/2022/03/governor-ivey-announces-niagara-bottling-plans-alabama-production-facility-creating-50-jobs-in-opelika/'],[],1,8,22,"['madeinal', 'alpolitics']",[],https://twitter.com/GovernorKayIvey/status/1504082425869127685,False,,0,,,,,,,,[],,,,
1503824215773962248,1503824215773962248,2022-03-15 16:03:27 Eastern Daylight Time,2022-03-15,16:03:27,-0400,19668491,governorkayivey,Governor Kay Ivey,,"This is fantastic news, @al_labor! #alpolitics",en,"[{'screen_name': 'al_labor', 'name': 'adol', 'id': '500126565'}]",[],[],9,6,23,['alpolitics'],[],https://twitter.com/GovernorKayIvey/status/1503824215773962248,False,https://twitter.com/al_labor/status/1503823815624822784,0,,,,,,,,[],,,,
1503796090818211842,1503796090818211842,2022-03-15 14:11:41 Eastern Daylight Time,2022-03-15,14:11:41,-0400,19668491,governorkayivey,Governor Kay Ivey,,"We’re proud to call @MercedesBenzUSA a partner, and we’re excited about the future that we are building together in Alabama. #MadeinAL",en,"[{'screen_name': 'mercedesbenzusa', 'name': 'mercedes-benz usaㅤ', 'id': '224359740'}]",[],[],14,8,46,['madeinal'],[],https://twitter.com/GovernorKayIvey/status/1503796090818211842,False,https://twitter.com/MadeinAL/status/1503768121026433038,0,,,,,,,,[],,,,
1503795753495449602,1503795753495449602,2022-03-15 14:10:21 Eastern Daylight Time,2022-03-15,14:10:21,-0400,19668491,governorkayivey,Governor Kay Ivey,,"25 years ago, @MercedesBenzUSA produced the first M-Class in AL. Since then, they’ve turned out 4 million #MadeinAL vehicles! I’m thrilled to celebrate their battery plant grand opening, which is yet another milestone for the crown jewel of AL’s automotive industry. #alpolitics  https://t.co/kQyHvyAU2V",en,"[{'screen_name': 'mercedesbenzusa', 'name': 'mercedes-benz usaㅤ', 'id': '224359740'}]",[],"['https://pbs.twimg.com/media/FN6ORDAXsAo7nqw.jpg', 'https://pbs.twimg.com/media/FN6ORC_WYAIfswL.jpg']",12,8,59,"['madeinal', 'alpolitics']",[],https://twitter.com/GovernorKayIvey/status/1503795753495449602,False,,1,https://pbs.twimg.com/media/FN6ORDAXsAo7nqw.jpg,,,,,,,[],,,,
1503511960469528578,1503511960469528578,2022-03-14 19:22:39 Eastern Daylight Time,2022-03-14,19:22:39,-0400,19668491,governorkayivey,Governor Kay Ivey,,"This afternoon, I swung by Mel’s Steakhouse in Moulton to visit with the Lawrence County Chamber of Commerce during lunch. I appreciate their hospitality and the members’ dedication to advocating for their local business community.  https://t.co/hFaJh1cHtE",en,[],[],"['https://pbs.twimg.com/media/FN2MKITXoAgqqLg.jpg', 'https://pbs.twimg.com/media/FN2MKIVWQAA0-2v.jpg', 'https://pbs.twimg.com/media/FN2MKIRXIAcUjrh.jpg', 'https://pbs.twimg.com/media/FN2MKI7XIAULTsi.jpg']",10,4,48,[],[],https://twitter.com/GovernorKayIvey/status/1503511960469528578,False,,1,https://pbs.twimg.com/media/FN2MKITXoAgqqLg.jpg,,,,,,,[],,,,
1503485046967185421,1503485046967185421,2022-03-14 17:35:43 Eastern Daylight Time,2022-03-14,17:35:43,-0400,19668491,governorkayivey,Governor Kay Ivey,,🚨NEW - Be sure to check out my March newsletter:  https://t.co/qKNbRwhqbX! #alpolitics  https://t.co/5pjufTNzk1,en,[],['https://bit.ly/3CJVcGR'],['https://pbs.twimg.com/media/FN1zrrQX0A0aOQF.jpg'],9,3,17,['alpolitics'],[],https://twitter.com/GovernorKayIvey/status/1503485046967185421,False,,1,https://pbs.twimg.com/media/FN1zrrQX0A0aOQF.jpg,,,,,,,[],,,,
1503476604948910090,1503476604948910090,2022-03-14 17:02:10 Eastern Daylight Time,2022-03-14,17:02:10,-0400,19668491,governorkayivey,Governor Kay Ivey,,"No doubt, AL’s 1st Class Pre-K program is top of the line &amp; helping many of our youngest citizens receive a strong start to their educational journeys. It’s only fitting @barbarajeancoop was selected to serve on this national board. I know she'll be a tremendous asset to @NAEYC!",en,"[{'screen_name': 'barbarajeancoop', 'name': 'secretary barbara j. cooper, ph.d', 'id': '2478778525'}, {'screen_name': 'naeyc', 'name': 'naeyc', 'id': '36429302'}]",[],[],7,3,20,[],[],https://twitter.com/GovernorKayIvey/status/1503476604948910090,False,https://twitter.com/AL_DECE/status/1503476061631397890,0,,,,,,,,[],,,,
1503393333997096962,1503393333997096962,2022-03-14 11:31:17 Eastern Daylight Time,2022-03-14,11:31:17,-0400,19668491,governorkayivey,Governor Kay Ivey,,Our summer internship application is open for ONE more week!   Interested college students can learn more here:  https://t.co/67oXjxaClT.   @ALHigherEd @ACCS_Education #alpolitics #aledchat  https://t.co/j8myXXsL38,en,"[{'screen_name': 'alhighered', 'name': 'higher education partnership of alabama', 'id': '2893208910'}, {'screen_name': 'accs_education', 'name': 'alabama community college system (accs)', 'id': '1737838892'}]",['https://governor.alabama.gov/administration/internship-program/'],['https://pbs.twimg.com/media/FN0gRNTXoAMh-WP.jpg'],2,3,12,"['alpolitics', 'aledchat']",[],https://twitter.com/GovernorKayIvey/status/1503393333997096962,False,,1,https://pbs.twimg.com/media/FN0gRNTXoAMh-WP.jpg,,,,,,,[],,,,
1503385533388570625,1503385533388570625,2022-03-14 11:00:17 Eastern Daylight Time,2022-03-14,11:00:17,-0400,19668491,governorkayivey,Governor Kay Ivey,,"I’m awarding $30 million of the State Fiscal Recovery Fund from ARPA to establish COVID recovery grants for rural hospitals. They’re the primary health care for so many of our citizens, &amp; I know this funding will go a long way. #alpolitics    https://t.co/b3bDd4CxbB",en,[],['https://governor.alabama.gov/newsroom/2022/03/governor-ivey-awards-30-million-for-rural-hospitals-covid-recovery-grants/'],[],24,2,20,['alpolitics'],[],https://twitter.com/GovernorKayIvey/status/1503385533388570625,False,,0,,,,,,,,[],,,,
1503371324231753743,1503371324231753743,2022-03-14 10:03:49 Eastern Daylight Time,2022-03-14,10:03:49,-0400,19668491,governorkayivey,Governor Kay Ivey,,"During this National Reading Month, our friends at the Alabama Department of Commerce &amp; @aidtedu are hosting a book drive. They’re accepting drop-offs until Friday, so be sure to stop by soon! @MadeinAL   #StrongStartStrongFinish 📚  https://t.co/PQRAr4Gqgt",en,"[{'screen_name': 'aidtedu', 'name': 'aidt', 'id': '63215476'}, {'screen_name': 'madeinal', 'name': 'made in alabama', 'id': '933112802'}]",[],['https://pbs.twimg.com/media/FN0MP7SWYAAWrwY.jpg'],3,6,14,['strongstartstrongfinish'],[],https://twitter.com/GovernorKayIvey/status/1503371324231753743,False,,1,https://pbs.twimg.com/media/FN0MP7SWYAAWrwY.jpg,,,,,,,[],,,,
1502683837779824641,1502683837779824641,2022-03-12 11:32:00 Eastern Standard Time,2022-03-12,11:32:00,-0400,19668491,governorkayivey,Governor Kay Ivey,,"With strong bipartisan support, I proudly signed the Rebuild Alabama Act three years ago today. As promised, every penny has gone to road, bridge and port projects in order to fix our crumbling infrastructure, keep Alabamians safe and help our economy keep growing. #alpolitics  https://t.co/BnDmgPGJWe",en,[],[],[],49,13,90,['alpolitics'],[],https://twitter.com/GovernorKayIvey/status/1502683837779824641,False,,1,https://pbs.twimg.com/ext_tw_video_thumb/1502683675720310786/pu/img/_1rR0naNYNyFi5Hi.jpg,,,,,,,[],,,,
1502384255061700608,1502383990359085059,2022-03-11 15:41:34 Eastern Standard Time,2022-03-11,15:41:34,-0400,19668491,governorkayivey,Governor Kay Ivey,,"My education initiative has produced the most investments in Alabama’s K-12 system in our state’s history, but there is more work to be done, and we aren’t relenting any time soon. @PARCAlabama #alpolitics 5/5",en,"[{'screen_name': 'parcalabama', 'name': 'parca', 'id': '935344358'}]",[],[],6,0,5,['alpolitics'],[],https://twitter.com/GovernorKayIvey/status/1502384255061700608,False,,0,,,,,,,,[],,,,
1502384189299122181,1502383990359085059,2022-03-11 15:41:18 Eastern Standard Time,2022-03-11,15:41:18,-0400,19668491,governorkayivey,Governor Kay Ivey,,"I launched my #StrongStartStrongFinish education initiative almost five years ago to integrate Alabama’s early childhood education, K-12 education and workforce development efforts. @PARCAlabama #alpolitics 4/5",en,"[{'screen_name': 'parcalabama', 'name': 'parca', 'id': '935344358'}]",[],[],3,0,5,"['strongstartstrongfinish', 'alpolitics']",[],https://twitter.com/GovernorKayIvey/status/1502384189299122181,False,,0,,,,,,,,[],,,,
1502384097213272066,1502383990359085059,2022-03-11 15:40:56 Eastern Standard Time,2022-03-11,15:40:56,-0400,19668491,governorkayivey,Governor Kay Ivey,,"Education is literally at the root of the future of our state, and it is imperative that we renew our focus on the basics – ensuring our students are proficient readers &amp; making sure we laser in our efforts on mathematics. @PARCAlabama #alpolitics 3/5",en,"[{'screen_name': 'parcalabama', 'name': 'parca', 'id': '935344358'}]",[],[],4,0,5,['alpolitics'],[],https://twitter.com/GovernorKayIvey/status/1502384097213272066,False,,0,,,,,,,,[],,,,
1502384035808825344,1502383990359085059,2022-03-11 15:40:41 Eastern Standard Time,2022-03-11,15:40:41,-0400,19668491,governorkayivey,Governor Kay Ivey,,The single most important issue that we have here in Alabama and across the nation is our students' education. Plain and simple. @PARCAlabama #alpolitics 2/5,en,"[{'screen_name': 'parcalabama', 'name': 'parca', 'id': '935344358'}]",[],[],1,0,6,['alpolitics'],[],https://twitter.com/GovernorKayIvey/status/1502384035808825344,False,,0,,,,,,,,[],,,,
1502383990359085059,1502383990359085059,2022-03-11 15:40:30 Eastern Standard Time,2022-03-11,15:40:30,-0400,19668491,governorkayivey,Governor Kay Ivey,,"It was a real honor to be the keynote speaker at @PARCAlabama’s Governor Albert P. Brewer Legacy Lunch. The theme, “Realizing Our Potential: A Plan for Reading and Math in Alabama” couldn’t be more fitting. #alpolitics 1/5  https://t.co/fMDduEPI00",en,"[{'screen_name': 'parcalabama', 'name': 'parca', 'id': '935344358'}]",[],['https://pbs.twimg.com/media/FNmKRhEXwAgHpAY.jpg'],18,6,33,['alpolitics'],[],https://twitter.com/GovernorKayIvey/status/1502383990359085059,False,,1,https://pbs.twimg.com/media/FNmKRhEXwAgHpAY.jpg,,,,,,,[],,,,
1502087758717800463,1502087758717800463,2022-03-10 20:03:23 Eastern Standard Time,2022-03-10,20:03:23,-0400,19668491,governorkayivey,Governor Kay Ivey,,"I spent some time in northeast AL w/ Rep. Ginny Shaver meeting with the Cherokee County Chamber earlier. From getting this county access to its first 4-lane HWY to an interstate to connecting more Alabamians to broadband, I’m committed to helping rural AL grow here &amp; everywhere.  https://t.co/E2ZakZWw3I",en,[],[],"['https://pbs.twimg.com/media/FNh82nBWUBgxpbD.jpg', 'https://pbs.twimg.com/media/FNh82nDWUBsWEzM.jpg', 'https://pbs.twimg.com/media/FNh82nCWUBgN3Xf.jpg', 'https://pbs.twimg.com/media/FNh82nDWUBEymMr.jpg']",32,1,49,[],[],https://twitter.com/GovernorKayIvey/status/1502087758717800463,False,,1,https://pbs.twimg.com/media/FNh82nBWUBgxpbD.jpg,,,,,,,[],,,,
1502049855241400323,1502049855241400323,2022-03-10 17:32:46 Eastern Standard Time,2022-03-10,17:32:46,-0400,19668491,governorkayivey,Governor Kay Ivey,,"I just signed House Bill 272, known as the constitutional carry bill, into law, defending law abiding Alabamians’ Second Amendment rights. #alpolitics   Read my full statement here:  https://t.co/vQeuDul4oT",en,[],['https://governor.alabama.gov/newsroom/2022/03/governor-ivey-defends-alabamians-second-amendment-rights-signs-constitutional-carry-bill-into-law/'],[],117,150,613,['alpolitics'],[],https://twitter.com/GovernorKayIvey/status/1502049855241400323,False,,0,,,,,,,,[],,,,
1501951558933626889,1501951558933626889,2022-03-10 11:02:11 Eastern Standard Time,2022-03-10,11:02:11,-0400,19668491,governorkayivey,Governor Kay Ivey,,"I’m thrilled to announce @BellaCanvasLA, a fast-growing apparel manufacturer, is investing $11.9 million to open an advanced fabric-cutting facility in Wetumpka, which will create over 550 jobs. #alpolitics @MadeinAL   https://t.co/k2JJglQaEh",en,"[{'screen_name': 'bellacanvasla', 'name': 'bella+canvas', 'id': '36822278'}, {'screen_name': 'madeinal', 'name': 'made in alabama', 'id': '933112802'}]",['https://governor.alabama.gov/newsroom/2022/03/governor-ivey-announces-bellacanvas-plans-high-tech-fabric-cutting-facility-in-alabama-creating-557-jobs-in-wetumpka/'],[],5,5,16,['alpolitics'],[],https://twitter.com/GovernorKayIvey/status/1501951558933626889,False,,0,,,,,,,,[],,,,
1501946034590650378,1501946034590650378,2022-03-10 10:40:14 Eastern Standard Time,2022-03-10,10:40:14,-0400,19668491,governorkayivey,Governor Kay Ivey,,"As one of the greatest women of our century, Margaret Murray Washington dedicated her life to making a way for others. This month, we honor her work, life and legacy.   #womenshistorymonth  https://t.co/4WmvJY3JaQ",en,[],[],"['https://pbs.twimg.com/media/FNf787kVUAAOI_e.jpg', 'https://pbs.twimg.com/media/FNf787lVQAI38Os.jpg', 'https://pbs.twimg.com/media/FNf787rVUAU7ztY.jpg']",3,2,6,['womenshistorymonth'],[],https://twitter.com/GovernorKayIvey/status/1501946034590650378,False,,1,https://pbs.twimg.com/media/FNf787kVUAAOI_e.jpg,,,,,,,[],,,,
