id,conversation_id,created_at,date,time,timezone,user_id,username,name,place,tweet,language,mentions,urls,photos,replies_count,retweets_count,likes_count,hashtags,cashtags,link,retweet,quote_url,video,thumbnail,near,geo,source,user_rt_id,user_rt,retweet_id,reply_to,retweet_date,translate,trans_src,trans_dest
1506276182903435267,1506276182903435267,2022-03-22 10:26:41 Eastern Daylight Time,2022-03-22,10:26:41,-0400,259341329,tatereeves,Tate Reeves,,"We may see severe weather in Mississippi today, including potential hail, flash flooding, and tornadoes.  Stay safe, have a plan for you and your family, and be sure to pay attention for updates from your respective National Weather Service office.  https://t.co/qHwzGJbjj0",en,[],[],"['https://pbs.twimg.com/media/FOdeNA4X0AElj4H.jpg', 'https://pbs.twimg.com/media/FOdeNA3XEAM-g8u.jpg']",3,11,22,[],[],https://twitter.com/tatereeves/status/1506276182903435267,False,,1,https://pbs.twimg.com/media/FOdeNA4X0AElj4H.jpg,,,,,,,[],,,,
1506009986677235712,1506009986677235712,2022-03-21 16:48:55 Eastern Daylight Time,2022-03-21,16:48:55,-0400,259341329,tatereeves,Tate Reeves,,Or we could:  ➡️ Increase domestic energy production ➡️ Stop out of control DC spending ➡️ Support American farmers/ranchers ➡️ Remember this at the ballot box in November  https://t.co/NJkxJQp7Wo,en,[],[],['https://pbs.twimg.com/media/FOZsGbxXMAAWyl_.jpg'],59,31,208,[],[],https://twitter.com/tatereeves/status/1506009986677235712,False,,1,https://pbs.twimg.com/media/FOZsGbxXMAAWyl_.jpg,,,,,,,[],,,,
1505647917096448004,1505647917096448004,2022-03-20 16:50:11 Eastern Daylight Time,2022-03-20,16:50:11,-0400,259341329,tatereeves,Tate Reeves,,The historic hiring spree continues in Mississippi!   https://t.co/KsRrVVKn1M  https://t.co/WONOp4P7MS,en,[],['https://thehill.com/homenews/state-watch/598264-ten-states-hit-record-low-unemployment-rates'],['https://pbs.twimg.com/media/FOUizL3X0AcivmJ.jpg'],73,19,110,[],[],https://twitter.com/tatereeves/status/1505647917096448004,False,,1,https://pbs.twimg.com/media/FOUizL3X0AcivmJ.jpg,,,,,,,[],,,,
1505003036707590151,1505003036707590151,2022-03-18 22:07:40 Eastern Daylight Time,2022-03-18,22:07:40,-0400,259341329,tatereeves,Tate Reeves,,"Y’all got lucky, @KristiNoem! #HottyToddy",en,"[{'screen_name': 'kristinoem', 'name': 'kristi noem', 'id': '114388293'}]",[],[],10,7,31,['hottytoddy'],[],https://twitter.com/tatereeves/status/1505003036707590151,False,https://twitter.com/kristinoem/status/1504921244491141121,0,,,,,,,,[],,,,
1504871504068198400,1504871504068198400,2022-03-18 13:25:00 Eastern Daylight Time,2022-03-18,13:25:00,-0400,259341329,tatereeves,Tate Reeves,,"In the span of 14 months, we went from Operation Warp Speed to Operation Warped Greed – here’s to you Hunter.   https://t.co/Ixs9eSlCQr  https://t.co/2T290d89L6",en,[],['https://www.foxnews.com/media/hunter-biden-scandal-new-york-times'],['https://pbs.twimg.com/media/FOJgqDJXsAAce1r.jpg'],152,27,167,[],[],https://twitter.com/tatereeves/status/1504871504068198400,False,,1,https://pbs.twimg.com/media/FOJgqDJXsAAce1r.jpg,,,,,,,[],,,,
1504564721080483848,1504564721080483848,2022-03-17 17:05:57 Eastern Daylight Time,2022-03-17,17:05:57,-0400,259341329,tatereeves,Tate Reeves,,Anyone know where Ms. Smith grew up or where she got her undergrad???,en,[],[],[],42,9,142,[],[],https://twitter.com/tatereeves/status/1504564721080483848,False,https://twitter.com/baseballhall/status/1504193316723822599,0,,,,,,,,[],,,,
1504465493628960769,1504465493628960769,2022-03-17 10:31:39 Eastern Daylight Time,2022-03-17,10:31:39,-0400,259341329,tatereeves,Tate Reeves,,Wishing y’all a lucky and happy St. Patrick’s Day!  https://t.co/NKNpOi8jOC,en,[],[],['https://pbs.twimg.com/media/FODvZFBXMAArJFJ.jpg'],5,6,40,[],[],https://twitter.com/tatereeves/status/1504465493628960769,False,,1,https://pbs.twimg.com/media/FODvZFBXMAArJFJ.jpg,,,,,,,[],,,,
1504200678947934213,1504200678947934213,2022-03-16 16:59:23 Eastern Daylight Time,2022-03-16,16:59:23,-0400,259341329,tatereeves,Tate Reeves,,Mississippi will continue to pass common sense legislation that the vast majority of Americans know is the right thing to do.  We appreciate your support @Heritage_Action @JessAnderson2  https://t.co/b8OsEux3Go,en,"[{'screen_name': 'heritage_action', 'name': 'heritage action', 'id': '130600206'}, {'screen_name': 'jessanderson2', 'name': 'jessica anderson', 'id': '123655810'}]",[],['https://pbs.twimg.com/media/FN_-iYDXIAIbDmM.jpg'],96,29,136,[],[],https://twitter.com/tatereeves/status/1504200678947934213,False,,1,https://pbs.twimg.com/media/FN_-iYDXIAIbDmM.jpg,,,,,,,[],,,,
1504122028260999168,1504122028260999168,2022-03-16 11:46:51 Eastern Daylight Time,2022-03-16,11:46:51,-0400,259341329,tatereeves,Tate Reeves,,Big move in the push to eliminate the income tax!  We now have a bill that eliminates the income tax without raising any other taxes.   This would be a huge boon to our economy. Grateful for all those willing to be bold who are working throughout this process to get a great plan!,en,[],[],[],143,72,814,[],[],https://twitter.com/tatereeves/status/1504122028260999168,False,,0,,,,,,,,[],,,,
1503825064944451589,1503825064944451589,2022-03-15 16:06:49 Eastern Daylight Time,2022-03-15,16:06:49,-0400,259341329,tatereeves,Tate Reeves,,"I’ve proclaimed April as Genocide Awareness and Prevention Month.   The systematic destruction of lives has spanned areas and cultures from Armenia to Darfur, the Holodomor to the Holocaust.   Genocide has no place in society, and we must do everything we can to prevent it.  https://t.co/gPia8yYDeD",en,[],[],['https://pbs.twimg.com/media/FN6o7BqWYAABIuU.jpg'],68,19,106,[],[],https://twitter.com/tatereeves/status/1503825064944451589,False,,1,https://pbs.twimg.com/media/FN6o7BqWYAABIuU.jpg,,,,,,,[],,,,
1503431215369658370,1503431215369658370,2022-03-14 14:01:48 Eastern Daylight Time,2022-03-14,14:01:48,-0400,259341329,tatereeves,Tate Reeves,,"In too many schools around the US, CRT is running amok. It threatens the integrity of education &amp; aims only to humiliate and indoctrinate.   That’s why I signed legislation that will help keep CRT where it belongs – out of MS classrooms.   Watch full video  https://t.co/jq5TuIvR2S  https://t.co/hSdVCx8ySM",en,[],['https://bit.ly/3Jd2Ax6'],[],488,98,543,[],[],https://twitter.com/tatereeves/status/1503431215369658370,False,,1,https://pbs.twimg.com/ext_tw_video_thumb/1503431059316293636/pu/img/TfWFumWilAbXsNAi.jpg,,,,,,,[],,,,
1502677143951663112,1502677143951663112,2022-03-12 11:05:24 Eastern Standard Time,2022-03-12,11:05:24,-0400,259341329,tatereeves,Tate Reeves,,"The Girl Scouts do more than sell delicious cookies.   They encourage entrepreneurship, foster critical thinking, and promote problem solving skills.  I was happy to have my littlest Scout, Maddie, help me proclaim Girl Scout Week in Mississippi! @girlscouts  https://t.co/BXMgXiijsa",en,"[{'screen_name': 'girlscouts', 'name': 'girl scouts', 'id': '103018203'}]",[],"['https://pbs.twimg.com/media/FNqU5TqXMAYsbp1.jpg', 'https://pbs.twimg.com/media/FNqU5TrXIAQQIBv.jpg']",23,11,72,[],[],https://twitter.com/tatereeves/status/1502677143951663112,False,,1,https://pbs.twimg.com/media/FNqU5TqXMAYsbp1.jpg,,,,,,,[],,,,
1502430112851152898,1502430112851152898,2022-03-11 18:43:47 Eastern Standard Time,2022-03-11,18:43:47,-0400,259341329,tatereeves,Tate Reeves,,Grateful for your support of our decision not to expand Medicaid under Obamacare.,en,[],[],[],178,16,116,[],[],https://twitter.com/tatereeves/status/1502430112851152898,False,https://twitter.com/stuartpstevens/status/1502385046384263168,0,,,,,,,,[],,,,
1502066126599118853,1502066126599118853,2022-03-10 18:37:26 Eastern Standard Time,2022-03-10,18:37:26,-0400,259341329,tatereeves,Tate Reeves,,"Endless spending has lowered the value of our dollars and made it that much harder for Americans to get the needed essentials.  Our families work hard to balance our checkbooks, yet the federal government recklessly uses a credit card with our names on it.  https://t.co/LAqMUQiA7y",en,[],['https://nypost.com/2022/03/10/inflation-costs-average-us-household-296-more-per-month/'],[],385,23,95,[],[],https://twitter.com/tatereeves/status/1502066126599118853,False,,0,,,,,,,,[],,,,
1502043033143062529,1502043033143062529,2022-03-10 17:05:40 Eastern Standard Time,2022-03-10,17:05:40,-0400,259341329,tatereeves,Tate Reeves,,"Tomorrow at 11am, I’ll be holding a ceremonial signing of legislation that enhances state death benefits for Mississippi’s law enforcement officers &amp; firefighters.   Tune in LIVE on my Facebook page!  https://t.co/HIY8UxtewQ",en,[],['https://facebook.com/tatereeves'],[],11,9,31,[],[],https://twitter.com/tatereeves/status/1502043033143062529,False,,0,,,,,,,,[],,,,
1501614048072323074,1501614048072323074,2022-03-09 12:41:02 Eastern Standard Time,2022-03-09,12:41:02,-0400,259341329,tatereeves,Tate Reeves,,"Mississippi drivers are paying more at the pump than ever before. Failed energy policies have made it harder to get to work, the grocery store, and school.  I would say Biden’s asleep at the wheel, but I’m pretty sure he nodded off before he made it to the driver’s seat.  https://t.co/Kwd3wj2ZAW",en,[],[],['https://pbs.twimg.com/media/FNbOBI3X0AEfpqw.jpg'],229,77,436,[],[],https://twitter.com/tatereeves/status/1501614048072323074,False,,1,https://pbs.twimg.com/media/FNbOBI3X0AEfpqw.jpg,,,,,,,[],,,,
1501366375864053762,1501366375864053762,2022-03-08 20:16:52 Eastern Standard Time,2022-03-08,20:16:52,-0400,259341329,tatereeves,Tate Reeves,,"Elee, thank you for being an example of strength and grace.   I am glad to have you by my side and I am incredibly proud that we are raising our 3 girls to be strong, independent women as well.  On this International Women’s Day, I’m celebrating @firstladyofms and our girls!  https://t.co/cJ7CwbMs66",en,"[{'screen_name': 'firstladyofms', 'name': 'elee reeves', 'id': '1223364109556731904'}]",[],['https://pbs.twimg.com/media/FNXswWzX0AgycR1.jpg'],17,8,74,[],[],https://twitter.com/tatereeves/status/1501366375864053762,False,,1,https://pbs.twimg.com/media/FNXswWzX0AgycR1.jpg,,,,,,,[],,,,
1501345316825612289,1501345316825612289,2022-03-08 18:53:11 Eastern Standard Time,2022-03-08,18:53:11,-0400,259341329,tatereeves,Tate Reeves,,"In Madison Co., Mississippians are earning and learning more than the rest of the country.  Household incomes above the national median ✅ Graduation rates above the national average ✅  Thanks, @mcblf for the opportunity to discuss all the great things happening in Madison Co.!  https://t.co/6XKPIYiiUr",en,"[{'screen_name': 'mcblf', 'name': 'madison county business league & foundation', 'id': '1052940192712196098'}]",[],"['https://pbs.twimg.com/media/FNXZmzQVEAYD6Mm.jpg', 'https://pbs.twimg.com/media/FNXZmyyXEAItoDm.jpg', 'https://pbs.twimg.com/media/FNXZmyxXMAA9cHI.jpg']",42,7,60,[],[],https://twitter.com/tatereeves/status/1501345316825612289,False,,1,https://pbs.twimg.com/media/FNXZmzQVEAYD6Mm.jpg,,,,,,,[],,,,
1501274478206095360,1501274478206095360,2022-03-08 14:11:42 Eastern Standard Time,2022-03-08,14:11:42,-0400,259341329,tatereeves,Tate Reeves,,"Congratulations on a well-earned move @TCBPubHealth! I hope you can get some rest from the constant crises, but also feel pretty confident you’ll find your way to the front-lines of helping others in your next role. Grateful for your friendship and counsel during hard times.",en,"[{'screen_name': 'tcbpubhealth', 'name': 'thomas dobbs', 'id': '3012714777'}]",[],[],41,15,84,[],[],https://twitter.com/tatereeves/status/1501274478206095360,False,https://twitter.com/msdh/status/1501266708505501700,0,,,,,,,,[],,,,
1500975491137875975,1500975488004726785,2022-03-07 18:23:38 Eastern Standard Time,2022-03-07,18:23:38,-0400,259341329,tatereeves,Tate Reeves,,"If you have the opportunity, I encourage you to take a moment to pause and reflect at this new memorial and recall the blessings of life and liberty that our family, friends, and neighbors who served in the Armed Services helped to establish and defend. (2/2)",en,[],[],[],5,1,10,[],[],https://twitter.com/tatereeves/status/1500975491137875975,False,,0,,,,,,,,[],,,,
