id,conversation_id,created_at,date,time,timezone,user_id,username,name,place,tweet,language,mentions,urls,photos,replies_count,retweets_count,likes_count,hashtags,cashtags,link,retweet,quote_url,video,thumbnail,near,geo,source,user_rt_id,user_rt,retweet_id,reply_to,retweet_date,translate,trans_src,trans_dest
1506300873512730624,1506300873512730624,2022-03-22 12:04:48 Eastern Daylight Time,2022-03-22,12:04:48,-0400,818524048888131584,ltgovmcnally,Randy McNally,,"Honored to take part in Ag Day here at the Tennessee Capitol. One of the two words emblazoned on the Tennessee state seal is Agriculture. It is a critical part of our history, heritage and economy. Grateful for all those working to preserve this way of life in Tennessee.  https://t.co/yJWg2QZGrh",en,[],[],"['https://pbs.twimg.com/media/FOd0o-GX0AUGtFm.jpg', 'https://pbs.twimg.com/media/FOd0o-FXoAw6qZ9.jpg', 'https://pbs.twimg.com/media/FOd0o-KXoAACPEh.jpg', 'https://pbs.twimg.com/media/FOd0o-HWUAUG_l0.jpg']",1,6,10,[],[],https://twitter.com/ltgovmcnally/status/1506300873512730624,False,,1,https://pbs.twimg.com/media/FOd0o-GX0AUGtFm.jpg,,,,,,,[],,,,
1506088400901787664,1506088400901787664,2022-03-21 22:00:31 Eastern Daylight Time,2022-03-21,22:00:31,-0400,818524048888131584,ltgovmcnally,Randy McNally,,Always a great day in Nashville when the @4H-ers are at the Capitol. Appreciate everything @Tennessee4H does to instill strong values in our youth and to help preserve our state’s agricultural legacy.  https://t.co/9w2PxNATXh,en,"[{'screen_name': '4h', 'name': '4-h', 'id': '14107459'}, {'screen_name': 'tennessee4h', 'name': 'tennessee 4-h', 'id': '306328530'}]",[],['https://pbs.twimg.com/media/FOazarpXEAMpxUH.jpg'],0,1,7,[],[],https://twitter.com/ltgovmcnally/status/1506088400901787664,False,,1,https://pbs.twimg.com/media/FOazarpXEAMpxUH.jpg,,,,,,,[],,,,
1506086094886117381,1506086094886117381,2022-03-21 21:51:21 Eastern Daylight Time,2022-03-21,21:51:21,-0400,818524048888131584,ltgovmcnally,Randy McNally,,Had a great day with @ACChamberTN’s Youth Leadership Anderson County today at the Capitol. Outstanding emerging leaders learning about state government. Very inspiring!  https://t.co/XmubnDNVXM,en,"[{'screen_name': 'acchambertn', 'name': 'anderson co. chamber', 'id': '210847445'}]",[],['https://pbs.twimg.com/media/FOaxUdrWYAYeuSe.jpg'],0,3,7,[],[],https://twitter.com/ltgovmcnally/status/1506086094886117381,False,,1,https://pbs.twimg.com/media/FOaxUdrWYAYeuSe.jpg,,,,,,,[],,,,
1504559756786245638,1504559756786245638,2022-03-17 16:46:14 Eastern Daylight Time,2022-03-17,16:46:14,-0400,818524048888131584,ltgovmcnally,Randy McNally,,Had a great time throwing out the first pitch at Columbia’s Midstate Classic between the @Vol_Softball and @MemphisSoftball at the Ridley Sports Complex. Excellent tradition and a great game.  https://t.co/Oz83npNyxR,en,"[{'screen_name': 'vol_softball', 'name': 'tennessee softball', 'id': '86358997'}, {'screen_name': 'memphissoftball', 'name': 'memphis softball', 'id': '115483814'}]",[],"['https://pbs.twimg.com/media/FOFFH6fXEAIcAaQ.jpg', 'https://pbs.twimg.com/media/FOFFH6eWQAImBiF.jpg', 'https://pbs.twimg.com/media/FOFFH6mXEAc_SIe.jpg', 'https://pbs.twimg.com/media/FOFFH6kX0AYgYsR.jpg']",1,1,4,[],[],https://twitter.com/ltgovmcnally/status/1504559756786245638,False,,1,https://pbs.twimg.com/media/FOFFH6fXEAIcAaQ.jpg,,,,,,,[],,,,
1504420346132406273,1504420346132406273,2022-03-17 07:32:15 Eastern Daylight Time,2022-03-17,07:32:15,-0400,818524048888131584,ltgovmcnally,Randy McNally,,"May the road rise up to meet you. May the wind be always at your back.  May the sun shine warm upon your face;  the rains fall soft upon your fields  and until we meet again, may God hold you in the palm of His hand.  Happy St. Patrick’s Day, Tennessee!  https://t.co/qmyhXe1T1e",en,[],[],['https://pbs.twimg.com/media/FODGT_YX0AMyJ-0.jpg'],3,2,36,[],[],https://twitter.com/ltgovmcnally/status/1504420346132406273,False,,1,https://pbs.twimg.com/media/FODGT_YX0AMyJ-0.jpg,,,,,,,[],,,,
1504295452744851457,1504295452744851457,2022-03-16 23:15:59 Eastern Daylight Time,2022-03-16,23:15:59,-0400,818524048888131584,ltgovmcnally,Randy McNally,,"Grateful both @TNHouseReps and @tnsenate, Democrats and Republicans, spoke with one voice in condemnation of Putin’s murderous criminal regime and in support of Ukraine. Proud to sign Senate Joint Resolution 1147 on behalf of the entire @tnsenate.  https://t.co/cs3UBJFV6m  https://t.co/1owPCLtdL1",en,"[{'screen_name': 'tnhousereps', 'name': 'tennessee house of representatives', 'id': '943538064500187137'}, {'screen_name': 'tnsenate', 'name': 'tennessee senate', 'id': '22836475'}, {'screen_name': 'tnsenate', 'name': 'tennessee senate', 'id': '22836475'}]",['https://wapp.capitol.tn.gov/apps/BillInfo/Default.aspx?BillNumber=SJR1147'],['https://pbs.twimg.com/media/FOBUvMzXsAgMqzc.jpg'],13,14,64,[],[],https://twitter.com/ltgovmcnally/status/1504295452744851457,False,,1,https://pbs.twimg.com/media/FOBUvMzXsAgMqzc.jpg,,,,,,,[],,,,
1503878043189886976,1503878043189886976,2022-03-15 19:37:20 Eastern Daylight Time,2022-03-15,19:37:20,-0400,818524048888131584,ltgovmcnally,Randy McNally,,Grateful for the opportunity to connect with the emerging leaders of Young Professionals of Loudon County at the capitol today. Excellent to see young professionals so engaged and interested in learning about state government.  https://t.co/GTVA7xp9oP,en,[],[],"['https://pbs.twimg.com/media/FN7ZG_jXsAE9Tqb.jpg', 'https://pbs.twimg.com/media/FN7ZG_kWUA88axM.jpg']",1,0,8,[],[],https://twitter.com/ltgovmcnally/status/1503878043189886976,False,,1,https://pbs.twimg.com/media/FN7ZG_jXsAE9Tqb.jpg,,,,,,,[],,,,
1503870853880197122,1503870853880197122,2022-03-15 19:08:46 Eastern Daylight Time,2022-03-15,19:08:46,-0400,818524048888131584,ltgovmcnally,Randy McNally,,Encouraged after hearing from the young advocates of @ASAPofAnderson. An outstanding organization working to prevent and reduce substance abuse in Anderson County. Grateful for their work.  https://t.co/RtUNUOraxe,en,"[{'screen_name': 'asapofanderson', 'name': 'asap of anderson', 'id': '198551341'}]",[],['https://pbs.twimg.com/media/FN7Skh0WYAAUBlT.jpg'],0,2,6,[],[],https://twitter.com/ltgovmcnally/status/1503870853880197122,False,,1,https://pbs.twimg.com/media/FN7Skh0WYAAUBlT.jpg,,,,,,,[],,,,
1503869035104116739,1503869035104116739,2022-03-15 19:01:33 Eastern Daylight Time,2022-03-15,19:01:33,-0400,818524048888131584,ltgovmcnally,Randy McNally,,Excellent meeting with @VW’s Team Atlas executive team today. Thankful for the jobs and economic growth Volkswagen provides for our state.  https://t.co/tbt0P9YWJ0,en,"[{'screen_name': 'vw', 'name': 'volkswagen', 'id': '28165910'}]",[],['https://pbs.twimg.com/media/FN7Q6tNWYAUgJ7H.jpg'],4,1,14,[],[],https://twitter.com/ltgovmcnally/status/1503869035104116739,False,,1,https://pbs.twimg.com/media/FN7Q6tNWYAUgJ7H.jpg,,,,,,,[],,,,
