id,conversation_id,created_at,date,time,timezone,user_id,username,name,place,tweet,language,mentions,urls,photos,replies_count,retweets_count,likes_count,hashtags,cashtags,link,retweet,quote_url,video,thumbnail,near,geo,source,user_rt_id,user_rt,retweet_id,reply_to,retweet_date,translate,trans_src,trans_dest
1343998292414312451,1343998292414312451,2020-12-29 14:12:17 Eastern Standard Time,2020-12-29,14:12:17,-0400,125458893,jasonmiyaresva,Jason Miyares,,I'm pleased to welcome Klarke Kilgore as our team’s campaign manager. He brings a wealth of experience fighting for conservative causes in Virginia and across America.  https://t.co/FHq7vjZRZo,en,[],['https://therepublicanstandard.com/miyares-hires-trump-wh-official-klarke-kilgore-to-head-ag-campaign/'],[],0,9,33,[],[],https://twitter.com/JasonMiyaresVA/status/1343998292414312451,False,,0,,,,,,,,[],,,,
1343732126802468866,1343732126802468866,2020-12-28 20:34:39 Eastern Standard Time,2020-12-28,20:34:39,-0400,125458893,jasonmiyaresva,Jason Miyares,,Today’s @washingtonpost op Ed by a Dem candidate for Lt Gov. is confirmation of how far Left is today’s Democratic Party.  VA’s @RightToWork used to have bipartisan support; no more. I’ll always champion @RightToWork as Attorney General; we need a check and balance in Richmond,en,"[{'screen_name': 'washingtonpost', 'name': 'the washington post', 'id': '2467791'}, {'screen_name': 'righttowork', 'name': 'national right to work foundation', 'id': '16440298'}, {'screen_name': 'righttowork', 'name': 'national right to work foundation', 'id': '16440298'}]",[],[],4,10,39,[],[],https://twitter.com/JasonMiyaresVA/status/1343732126802468866,False,,0,,,,,,,,[],,,,
1342477772564914177,1342477772564914177,2020-12-25 09:30:17 Eastern Standard Time,2020-12-25,09:30:17,-0400,125458893,jasonmiyaresva,Jason Miyares,,"May the Babe in Bethlehem give your entire family Hope through the whole year.   Let us all remember this moment in human history when ""Love came down down, the Earth stood still"" and a Baby's cry sounded like a symphony in Heaven.   Merry Christmas from the Miyares Family.",en,[],[],[],0,2,6,[],[],https://twitter.com/JasonMiyaresVA/status/1342477772564914177,False,,0,,,,,,,,[],,,,
1341437441165684737,1341437441165684737,2020-12-22 12:36:23 Eastern Standard Time,2020-12-22,12:36:23,-0400,125458893,jasonmiyaresva,Jason Miyares,,I’m honored to have @DelRBell and these fellow Republicans standing with our campaign to restore conservative leadership back to Richmond for a safe and secure Commonwealth!  https://t.co/Mdz8unYqcP,en,"[{'screen_name': 'delrbell', 'name': 'rob bell', 'id': '273475760'}]",[],['https://pbs.twimg.com/media/Ep2-JrLXYAAFLLq.jpg'],0,3,8,[],[],https://twitter.com/JasonMiyaresVA/status/1341437441165684737,False,,1,https://pbs.twimg.com/media/Ep2-JrLXYAAFLLq.jpg,,,,,,,[],,,,
1339965340403585026,1339965340403585026,2020-12-18 11:06:47 Eastern Standard Time,2020-12-18,11:06:47,-0400,125458893,jasonmiyaresva,Jason Miyares,,Gov. Northam’s court-packing attempt is nothing but a naked power grab for Democrats! I joined @WMALDC’s @VinceCoglianese to discuss it this morning.  CHECK IT OUT:  https://t.co/7NdYbSMrwQ,en,"[{'screen_name': 'wmaldc', 'name': 'wmal dc', 'id': '16509580'}, {'screen_name': 'vincecoglianese', 'name': 'vince coglianese', 'id': '69022849'}]",['https://omny.fm/shows/mornings-on-the-mall/wmal-interview-virginia-del-jason-miyares-12-18-20'],[],3,11,12,[],[],https://twitter.com/JasonMiyaresVA/status/1339965340403585026,False,,0,,,,,,,,[],,,,
1339590893381144582,1339590893381144582,2020-12-17 10:18:52 Eastern Standard Time,2020-12-17,10:18:52,-0400,125458893,jasonmiyaresva,Jason Miyares,,Governor Northam’s attempt to pack our Courts before his term expires is a brazen liberal power grab that threatens to fundamentally change Virginia's judicial system.       My full statement:  https://t.co/4jaPXdPg8p,en,[],[],['https://pbs.twimg.com/media/EpcuTKaUwAMXzr1.jpg'],14,29,83,[],[],https://twitter.com/JasonMiyaresVA/status/1339590893381144582,False,,1,https://pbs.twimg.com/media/EpcuTKaUwAMXzr1.jpg,,,,,,,[],,,,
1338517185426231298,1338517185426231298,2020-12-14 11:12:20 Eastern Standard Time,2020-12-14,11:12:20,-0400,125458893,jasonmiyaresva,Jason Miyares,,So the Seattle Mayor announces she isn’t running for re-election after seeing murder rates skyrocket while pushing an 18 percent cut in police budget.   Good news for the people of Seattle and shows once again the failure of the Far Left in public safety.  https://t.co/sVKdEkXFVm,en,[],[],['https://pbs.twimg.com/media/EpNeSEgXcAMyDfM.jpg'],0,6,13,[],[],https://twitter.com/JasonMiyaresVA/status/1338517185426231298,False,,1,https://pbs.twimg.com/media/EpNeSEgXcAMyDfM.jpg,,,,,,,[],,,,
1337151682367680519,1337151682367680519,2020-12-10 16:46:18 Eastern Standard Time,2020-12-10,16:46:18,-0400,125458893,jasonmiyaresva,Jason Miyares,,"Because the one word always forgotten when discussing ""criminal justice reform"" is VICTIMS.   Convicted killer’s parole “like being punched in the stomach” for victim’s family  https://t.co/YhSNDcpnZd",en,[],['https://www.wfxrtv.com/news/local-news/lynchburg-central-virginia-news/convicted-killers-parole-like-being-punched-in-the-stomach-for-victims-family/'],[],0,1,1,[],[],https://twitter.com/JasonMiyaresVA/status/1337151682367680519,False,,0,,,,,,,,[],,,,
1337006645717692416,1337006645717692416,2020-12-10 07:09:59 Eastern Standard Time,2020-12-10,07:09:59,-0400,125458893,jasonmiyaresva,Jason Miyares,,The progressive record on public safety summed up in one headline: “Minneapolis City Council votes to cut millions from police budget amid record crime rates” - The Washington Post  https://t.co/H6yASh36BZ,en,[],['https://www.washingtonpost.com/national/minneapolis-city-council-votes-to-cut-millions-from-police-budget-amid-record-crime-rates/2020/12/10/af3f14ee-3a8c-11eb-bc68-96af0daae728_story.html'],[],0,1,3,[],[],https://twitter.com/JasonMiyaresVA/status/1337006645717692416,False,,0,,,,,,,,[],,,,
1336396129769025538,1336396129769025538,2020-12-08 14:44:01 Eastern Standard Time,2020-12-08,14:44:01,-0400,125458893,jasonmiyaresva,Jason Miyares,,"So the VA Parole Board just let out Gregory Joyner who brutally raped, strangled &amp; murdered 15-year-old Sarah Jamison.  Despite the Parole Board noting his ""history of violence"" he is out free in his 40s.  Sarah however will never return.  We need a new Attorney General.",en,[],[],[],61,277,973,[],[],https://twitter.com/JasonMiyaresVA/status/1336396129769025538,False,,0,,,,,,,,[],,,,
1335810908447256577,1335810908447256577,2020-12-06 23:58:33 Eastern Standard Time,2020-12-06,23:58:33,-0400,125458893,jasonmiyaresva,Jason Miyares,,@SylviaBryantVa great seeing you today in Norfolk for the 90th Mass Meeting!  We desperately need common sense leadership in Richmond!,en,[],[],[],0,0,0,[],[],https://twitter.com/JasonMiyaresVA/status/1335810908447256577,False,https://twitter.com/vahousegop/status/1335809321255510016,0,,,,,,,,[],,,,
1335324462288343044,1335324462288343044,2020-12-05 15:45:35 Eastern Standard Time,2020-12-05,15:45:35,-0400,125458893,jasonmiyaresva,Jason Miyares,,"My campaign is focused on bringing conservative leadership back to Richmond for a safe and secure Commonwealth.   Virginians of every background, not just Republicans, understand we need a check and balance in the Attorney General's office.",en,[],[],[],0,0,11,[],[],https://twitter.com/JasonMiyaresVA/status/1335324462288343044,False,,0,,,,,,,,[],,,,
1335324357674082310,1335324357674082310,2020-12-05 15:45:10 Eastern Standard Time,2020-12-05,15:45:10,-0400,125458893,jasonmiyaresva,Jason Miyares,,"“I look forward to running in a party-run nomination for Attorney General next year. With this vote, the Republican Party of Virginia launches a 2021 cycle where Republicans are fired up to fight back against progressive one-party rule in Richmond. (part 1)",en,[],[],[],0,0,9,[],[],https://twitter.com/JasonMiyaresVA/status/1335324357674082310,False,,0,,,,,,,,[],,,,
1334983892244312066,1334983892244312066,2020-12-04 17:12:17 Eastern Standard Time,2020-12-04,17:12:17,-0400,125458893,jasonmiyaresva,Jason Miyares,,Honored to support policies that grow jobs and small businesses in Virginia,en,[],[],[],0,1,8,[],[],https://twitter.com/JasonMiyaresVA/status/1334983892244312066,False,https://twitter.com/vahousegop/status/1334937473043099648,0,,,,,,,,[],,,,
1334957057447964672,1334957057447964672,2020-12-04 15:25:39 Eastern Standard Time,2020-12-04,15:25:39,-0400,125458893,jasonmiyaresva,Jason Miyares,,Thanks for your encouragement Gregg!,en,[],[],[],0,0,4,[],[],https://twitter.com/JasonMiyaresVA/status/1334957057447964672,False,https://twitter.com/RGreggKeller/status/1334891777954893825,0,,,,,,,,[],,,,
1334243280016596993,1334243280016596993,2020-12-02 16:09:21 Eastern Standard Time,2020-12-02,16:09:21,-0400,125458893,jasonmiyaresva,Jason Miyares,, https://t.co/uy9fqBdua9,und,[],['https://richmond.com/news/state-and-regional/govt-and-politics/del-jason-miyares-r-virginia-beach-announces-run-for-attorney-general/article_09f17ff7-b884-5cd6-b840-34a66f923a76.html#tracking-source=home-top-story-1'],[],0,0,7,[],[],https://twitter.com/JasonMiyaresVA/status/1334243280016596993,False,,0,,,,,,,,[],,,,
1334207730509340672,1334207730509340672,2020-12-02 13:48:05 Eastern Standard Time,2020-12-02,13:48:05,-0400,125458893,jasonmiyaresva,Jason Miyares,, https://t.co/QCrZjrOa13,und,[],['https://www.wavy.com/news/politics/virginia-politics/del-jason-miyares-running-for-va-attorney-general-in-2021/'],[],0,5,16,[],[],https://twitter.com/JasonMiyaresVA/status/1334207730509340672,False,,0,,,,,,,,[],,,,
1334207393631268864,1334207393631268864,2020-12-02 13:46:45 Eastern Standard Time,2020-12-02,13:46:45,-0400,125458893,jasonmiyaresva,Jason Miyares,,Thanks for the support.  It has been humbling so far to see so many friends and family join the fight for a safe and secure Virginia.,en,[],[],[],0,0,6,[],[],https://twitter.com/JasonMiyaresVA/status/1334207393631268864,False,https://twitter.com/IanLichacz/status/1334167241651261440,0,,,,,,,,[],,,,
1334207052378484736,1334207052378484736,2020-12-02 13:45:24 Eastern Standard Time,2020-12-02,13:45:24,-0400,125458893,jasonmiyaresva,Jason Miyares,,Thanks for your support DJ!  Proud to have you by my side as we fight to build a safe and secure Commonwealth.,en,[],[],[],0,1,3,[],[],https://twitter.com/JasonMiyaresVA/status/1334207052378484736,False,https://twitter.com/DJJordanVA/status/1334175842457575428,0,,,,,,,,[],,,,
1334206317108621312,1334206317108621312,2020-12-02 13:42:29 Eastern Standard Time,2020-12-02,13:42:29,-0400,125458893,jasonmiyaresva,Jason Miyares,,I appreciate the vote of confidence!,en,[],[],[],1,0,7,[],[],https://twitter.com/JasonMiyaresVA/status/1334206317108621312,False,https://twitter.com/MrTJTurner/status/1334205084578754560,0,,,,,,,,[],,,,
