id,conversation_id,created_at,date,time,timezone,user_id,username,name,place,tweet,language,mentions,urls,photos,replies_count,retweets_count,likes_count,hashtags,cashtags,link,retweet,quote_url,video,thumbnail,near,geo,source,user_rt_id,user_rt,retweet_id,reply_to,retweet_date,translate,trans_src,trans_dest
1503324544756600837,1503324544756600837,2022-03-14 06:57:56 Eastern Daylight Time,2022-03-14,06:57:56,-0400,30768622,shennabellows,Shenna Bellows,,"Thinking about the evil whereby this puppet is willing to replace her kidnapped opponent, the legitimate mayor, in the pursuit of power.",en,[],[],[],1,1,7,[],[],https://twitter.com/shennabellows/status/1503324544756600837,False,https://twitter.com/tripgabriel/status/1503062049303060480,0,,,,,,,,[],,,,
1502253220718075907,1502253220718075907,2022-03-11 07:00:52 Eastern Standard Time,2022-03-11,07:00:52,-0400,30768622,shennabellows,Shenna Bellows,,Proud to serve with these extraordinary women who are leading the way on positive voting rights reforms.  @DrWeber4CA @SecretaryWay  https://t.co/7NiGycNQk6,en,"[{'screen_name': 'drweber4ca', 'name': 'shirley weber, phd', 'id': '2303992020'}, {'screen_name': 'secretaryway', 'name': 'new jersey secretary of state tahesha way', 'id': '968516379166085120'}]",['https://www.nbcnews.com/news/nbcblk/3-black-women-secretaries-state-are-protecting-voting-rights-rcna18754'],[],0,1,19,[],[],https://twitter.com/shennabellows/status/1502253220718075907,False,,0,,,,,,,,[],,,,
1499577906963664898,1499572522144124965,2022-03-03 21:50:08 Eastern Standard Time,2022-03-03,21:50:08,-0400,30768622,shennabellows,Shenna Bellows,,@WoodardColin @TomBellPortland @dillesquire True.,en,[],[],[],0,0,0,[],[],https://twitter.com/shennabellows/status/1499577906963664898,False,,0,,,,,,,,"[{'screen_name': 'WoodardColin', 'name': 'Colin Woodard', 'id': '1392151658'}, {'screen_name': 'TomBellPortland', 'name': 'Tom Bell', 'id': '379431785'}, {'screen_name': 'dillesquire', 'name': 'CYNTHIA A. DILL, ESQ.', 'id': '100036590'}]",,,,
1499575163557400578,1499572522144124965,2022-03-03 21:39:14 Eastern Standard Time,2022-03-03,21:39:14,-0400,30768622,shennabellows,Shenna Bellows,,@TomBellPortland @dillesquire It’s a chilling reminder of the power of propaganda in the absence of a free press.  I’m so sorry.,en,[],[],[],1,0,1,[],[],https://twitter.com/shennabellows/status/1499575163557400578,False,,0,,,,,,,,"[{'screen_name': 'TomBellPortland', 'name': 'Tom Bell', 'id': '379431785'}, {'screen_name': 'dillesquire', 'name': 'CYNTHIA A. DILL, ESQ.', 'id': '100036590'}]",,,,
1499208551255969799,1499208551255969799,2022-03-02 21:22:27 Eastern Standard Time,2022-03-02,21:22:27,-0400,30768622,shennabellows,Shenna Bellows,,This Ukrainian Member of Parliament is so brave and so real.  Thinking of the hundreds of acts of heroism were getting to see real time on social media but also the tremendous pain and suffering.  We #StandWithUkraine,en,[],[],[],0,0,4,['standwithukraine'],[],https://twitter.com/shennabellows/status/1499208551255969799,False,https://twitter.com/kiraincongress/status/1499112225633615872,0,,,,,,,,[],,,,
1498995006975135745,1498995006975135745,2022-03-02 07:13:54 Eastern Standard Time,2022-03-02,07:13:54,-0400,30768622,shennabellows,Shenna Bellows,,We need federal voting rights standards now.  We need to pass the Freedom to Vote Act.,en,[],[],[],1,4,7,[],[],https://twitter.com/shennabellows/status/1498995006975135745,False,https://twitter.com/soledadobrien/status/1498992070370992137,0,,,,,,,,[],,,,
1498860359331024898,1498860359331024898,2022-03-01 22:18:51 Eastern Standard Time,2022-03-01,22:18:51,-0400,30768622,shennabellows,Shenna Bellows,,"This is so important. Thank you, @POTUS for standing up for our young people.",en,"[{'screen_name': 'potus', 'name': 'president biden', 'id': '1349149096909668363'}]",[],[],0,22,248,[],[],https://twitter.com/shennabellows/status/1498860359331024898,False,https://twitter.com/cmclymer/status/1498855741389746176,0,,,,,,,,[],,,,
1498854805879537671,1498854805879537671,2022-03-01 21:56:47 Eastern Standard Time,2022-03-01,21:56:47,-0400,30768622,shennabellows,Shenna Bellows,,"We need to come together around our democracy - around voting rights, which are fundamental to everything else we care about.",en,[],[],[],1,21,171,[],[],https://twitter.com/shennabellows/status/1498854805879537671,False,,0,,,,,,,,[],,,,
1498854608797683715,1498854608797683715,2022-03-01 21:56:00 Eastern Standard Time,2022-03-01,21:56:00,-0400,30768622,shennabellows,Shenna Bellows,,“The most fundamental right in America is the right to vote.”  Pass the Freedom to Vote Act.  Pass the John Lewis Act. Yes!,en,[],[],[],6,12,78,[],[],https://twitter.com/shennabellows/status/1498854608797683715,False,,0,,,,,,,,[],,,,
1498847273127714820,1498847273127714820,2022-03-01 21:26:51 Eastern Standard Time,2022-03-01,21:26:51,-0400,30768622,shennabellows,Shenna Bellows,,"In speaking to the battle between autocracies and democracies, President Biden reminds us of a crucial struggle of our time. Our democracy is worth fighting for. It matters.",en,[],[],[],0,2,15,[],[],https://twitter.com/shennabellows/status/1498847273127714820,False,,0,,,,,,,,[],,,,
1497411383310393348,1497411383310393348,2022-02-25 22:21:08 Eastern Standard Time,2022-02-25,22:21:08,-0400,30768622,shennabellows,Shenna Bellows,,Using illegal ammunition to bomb a Ukrainian hospital - shocking.,en,[],[],[],0,0,0,[],[],https://twitter.com/shennabellows/status/1497411383310393348,False,https://twitter.com/juliaioffe/status/1497342920063606787,0,,,,,,,,[],,,,
1496812711405133833,1496812711405133833,2022-02-24 06:42:14 Eastern Standard Time,2022-02-24,06:42:14,-0400,30768622,shennabellows,Shenna Bellows,,"To be clear, election systems across the country withstood outside attacks in 2016 and a widespread disinformation campaign in 2020. But Congress can &amp; should do more now to fund states to strengthen election security and the ability to combat disinformation and malinformation.",en,[],[],[],6,5,33,[],[],https://twitter.com/shennabellows/status/1496812711405133833,False,https://twitter.com/Sifill_LDF/status/1496707553128026115,0,,,,,,,,[],,,,
1496633668953067520,1496633668953067520,2022-02-23 18:50:47 Eastern Standard Time,2022-02-23,18:50:47,-0400,30768622,shennabellows,Shenna Bellows,,Looking forward to the conversation of how we strengthen our democracy at #SolutionsSummit22,en,[],[],[],0,0,2,['solutionssummit22'],[],https://twitter.com/shennabellows/status/1496633668953067520,False,https://twitter.com/RepresentWomen/status/1496612346491461639,0,,,,,,,,[],,,,
1496172937711439876,1496172937711439876,2022-02-22 12:20:00 Eastern Standard Time,2022-02-22,12:20:00,-0400,30768622,shennabellows,Shenna Bellows,,So important. Our history is a painful one of discrimination in access to voting.  Helps understand where we are now and what we need to do to defend our democracy.,en,[],[],[],1,0,6,[],[],https://twitter.com/shennabellows/status/1496172937711439876,False,https://twitter.com/JocelynBenson/status/1495927174624329731,0,,,,,,,,[],,,,
1496092999633231872,1496092999633231872,2022-02-22 07:02:21 Eastern Standard Time,2022-02-22,07:02:21,-0400,30768622,shennabellows,Shenna Bellows,,Love that the @PressHerald made this connection for readers this morning.,en,"[{'screen_name': 'pressherald', 'name': 'portland press herald', 'id': '8859092'}]",[],[],0,1,4,[],[],https://twitter.com/shennabellows/status/1496092999633231872,False,https://twitter.com/PressHerald/status/1496087762524639235,0,,,,,,,,[],,,,
1494508071749570578,1494508071749570578,2022-02-17 22:04:25 Eastern Standard Time,2022-02-17,22:04:25,-0400,30768622,shennabellows,Shenna Bellows,,"This court decision further eviscerates the Voting Rights Act by ruling that those that are negatively impacted can’t bring lawsuits themselves, overturning decades of precedent. One more reason we need federal voting rights standards and passage of the #JohnLewisVotingRightsAct",en,[],[],[],2,5,17,['johnlewisvotingrightsact'],[],https://twitter.com/shennabellows/status/1494508071749570578,False,https://twitter.com/rickhasen/status/1494492685398421511,0,,,,,,,,[],,,,
1494142388486422528,1494122111534833667,2022-02-16 21:51:19 Eastern Standard Time,2022-02-16,21:51:19,-0400,30768622,shennabellows,Shenna Bellows,,"@DirigoBlue @MainesOs Yes, staffing permitting, our elections team does same day certification for candidates willing to wait.  Phil very responsibly verified that info with us ahead of his story too.",en,[],[],[],1,0,10,[],[],https://twitter.com/shennabellows/status/1494142388486422528,False,,0,,,,,,,,"[{'screen_name': 'DirigoBlue', 'name': 'Gerald Weinand 🇺🇸 🇺🇦', 'id': '58780949'}, {'screen_name': 'MainesOs', 'name': 'os maines clasher', 'id': '1465114806273421319'}]",,,,
1494138410927374336,1494105720010452994,2022-02-16 21:35:31 Eastern Standard Time,2022-02-16,21:35:31,-0400,30768622,shennabellows,Shenna Bellows,,"@scrimmins53 @efarwellc @PHirschkorn @PaulLePage2022 @GovJanetMills We have an amazing and dedicated elections staff.  Staffing permitting, we try to certify same day for any candidate willing to wait.",en,[],[],[],0,0,4,[],[],https://twitter.com/shennabellows/status/1494138410927374336,False,,0,,,,,,,,"[{'screen_name': 'scrimmins53', 'name': 'Susie Crimmins', 'id': '746440531857801216'}, {'screen_name': 'efarwellc', 'name': 'Emily Cook', 'id': '87372212'}, {'screen_name': 'PHirschkorn', 'name': 'Phil Hirschkorn', 'id': '2469775033'}, {'screen_name': 'PaulLePage2022', 'name': 'Paul LePage', 'id': '75563774'}, {'screen_name': 'GovJanetMills', 'name': 'Governor Janet Mills', 'id': '1083795319027089408'}]",,,,
1494113628626337792,1494113628626337792,2022-02-16 19:57:03 Eastern Standard Time,2022-02-16,19:57:03,-0400,30768622,shennabellows,Shenna Bellows,,Disinformation does indeed contribute greatly to the threats against election workers and threatens our democracy itself.,en,[],[],[],2,5,16,[],[],https://twitter.com/shennabellows/status/1494113628626337792,False,https://twitter.com/politico/status/1493925684686823428,0,,,,,,,,[],,,,
1492296617352966151,1492296617352966151,2022-02-11 19:36:53 Eastern Standard Time,2022-02-11,19:36:53,-0400,30768622,shennabellows,Shenna Bellows,,This is absolutely anti-democracy.  We need federal reforms now. #FreedomToVoteAct,en,[],[],[],5,3,18,['freedomtovoteact'],[],https://twitter.com/shennabellows/status/1492296617352966151,False,https://twitter.com/zachdespart/status/1491873894445338628,0,,,,,,,,[],,,,
