id,conversation_id,created_at,date,time,timezone,user_id,username,name,place,tweet,language,mentions,urls,photos,replies_count,retweets_count,likes_count,hashtags,cashtags,link,retweet,quote_url,video,thumbnail,near,geo,source,user_rt_id,user_rt,retweet_id,reply_to,retweet_date,translate,trans_src,trans_dest
1504187605302202369,1504187605302202369,2022-03-16 16:07:26 Eastern Daylight Time,2022-03-16,16:07:26,-0400,2435811084,jayashcroftmo,Jay Ashcroft,,My heart goes out to the brave officers we lay to rest this week. Their bravery and willingness to uphold the law will not be forgotten. May God look over them and their families.,en,[],[],[],0,0,2,[],[],https://twitter.com/JayAshcroftMO/status/1504187605302202369,False,,0,,,,,,,,[],,,,
1503842984294432768,1503842984294432768,2022-03-15 17:18:02 Eastern Daylight Time,2022-03-15,17:18:02,-0400,2435811084,jayashcroftmo,Jay Ashcroft,,"Republican, Democrat, or Independent, we are all feeling the effects of Biden’s bad energy policies at the gas pump. We need to rebuild American energy, so Americans don’t have to decide between food on the table or gas in the tank.",en,[],[],[],55,6,26,[],[],https://twitter.com/JayAshcroftMO/status/1503842984294432768,False,,0,,,,,,,,[],,,,
1502329815403278341,1502329815403278341,2022-03-11 12:05:14 Eastern Standard Time,2022-03-11,12:05:14,-0400,2435811084,jayashcroftmo,Jay Ashcroft,,Joe Biden’s DOJ is attempting to take away your guns and abolish laws that protect gun owners across Missouri. I will stand in his way and protect our constitutional right to bear arms. Join me in telling Joe Biden that Missourians support our Second Amendment. #2A #Protect2A,en,[],[],[],7,1,2,"['2a', 'protect2a']",[],https://twitter.com/JayAshcroftMO/status/1502329815403278341,False,,0,,,,,,,,[],,,,
1502031950827200512,1502031950827200512,2022-03-10 16:21:38 Eastern Standard Time,2022-03-10,16:21:38,-0400,2435811084,jayashcroftmo,Jay Ashcroft,,"I have said it before, and I’ll say it again: Secure Elections = a Secure Republic. We need to implement measures that secure our elections and produce results that best represent the will of the people. #VoterID",en,[],[],[],5,0,3,['voterid'],[],https://twitter.com/JayAshcroftMO/status/1502031950827200512,False,,0,,,,,,,,[],,,,
1501279715885203459,1501279715885203459,2022-03-08 14:32:31 Eastern Standard Time,2022-03-08,14:32:31,-0400,2435811084,jayashcroftmo,Jay Ashcroft,,Women’s sports are under attack from the Radical Left who say it is alright for men to compete against women under the guise of trans rights. This creates an unfair advantage and completely demolishes women’s right to fair sport. #fairplay,en,[],[],[],4,2,16,['fairplay'],[],https://twitter.com/JayAshcroftMO/status/1501279715885203459,False,,0,,,,,,,,[],,,,
1500135258003550213,1500135258003550213,2022-03-05 10:44:51 Eastern Standard Time,2022-03-05,10:44:51,-0400,2435811084,jayashcroftmo,Jay Ashcroft,,Biden’s DHS has done nothing to support our border patrol agents and has made it easier than ever for illegal immigrants to cross into this country. Joe Biden &amp; Kamala Harris need to clean up the mess they made at the southern border. The border must be secured IMMEDIATELY.,en,[],[],[],5,1,7,[],[],https://twitter.com/JayAshcroftMO/status/1500135258003550213,False,,0,,,,,,,,[],,,,
1499794859330203648,1499794859330203648,2022-03-04 12:12:13 Eastern Standard Time,2022-03-04,12:12:13,-0400,2435811084,jayashcroftmo,Jay Ashcroft,,"Planned Parenthood must be defunded because your money should not pay for abortions. Planned Parenthood has been allowed to operate in Missouri for FAR TOO LONG. Your taxes should go towards things that benefit Missouri, NOT ABORTIONS. #DefundPlannedParenthood",en,[],[],[],2,2,10,['defundplannedparenthood'],[],https://twitter.com/JayAshcroftMO/status/1499794859330203648,False,,0,,,,,,,,[],,,,
1499211328673640448,1499211328673640448,2022-03-02 21:33:29 Eastern Standard Time,2022-03-02,21:33:29,-0400,2435811084,jayashcroftmo,Jay Ashcroft,,"After one year under Joe Biden, America has seen unprecedented failures. A crumbling border, higher prices on virtually everything, and taking measures to weaken our elections. Biden cannot talk his way out of this one: HE HAS FAILED AMERICA.",en,[],[],[],25,4,35,[],[],https://twitter.com/JayAshcroftMO/status/1499211328673640448,False,,0,,,,,,,,[],,,,
1498443563289354242,1498443563289354242,2022-02-28 18:42:39 Eastern Standard Time,2022-02-28,18:42:39,-0400,2435811084,jayashcroftmo,Jay Ashcroft,,I hear you loud and clear: Missourians want photo Voter ID requirements. Support the fight today! Stand up for election integrity and join the thousands of Missourians who have joined my fight. Make a difference here: ⬇️⬇️  https://t.co/riDuXoUA6M,en,[],['https://secure.winred.com/ashcroft-for-missouri/feb-eom-voter-id'],[],1,2,8,[],[],https://twitter.com/JayAshcroftMO/status/1498443563289354242,False,,0,,,,,,,,[],,,,
1497327393203109888,1497327393203109888,2022-02-25 16:47:24 Eastern Standard Time,2022-02-25,16:47:24,-0400,2435811084,jayashcroftmo,Jay Ashcroft,,Joe Biden is suing Missouri for simply allowing citizens to sue government officials who unlawfully infringe on our Second Amendment rights. We actually welcome a lawsuit like this because we know that protecting our rights is critical… even if that means taking on Biden.,en,[],[],[],92,12,72,[],[],https://twitter.com/JayAshcroftMO/status/1497327393203109888,False,,0,,,,,,,,[],,,,
1495799936977620994,1495799936977620994,2022-02-21 11:37:50 Eastern Standard Time,2022-02-21,11:37:50,-0400,2435811084,jayashcroftmo,Jay Ashcroft,,"From Washington to Lincoln to President Trump, the Office of the President has been a beacon of hope for the world to follow. I hope you’ll join me in celebrating Presidents’ Day and the accomplishments of our great leaders.  https://t.co/js2jescyZx",en,[],[],['https://pbs.twimg.com/media/FMImGTeVIAE5RTd.png'],7,1,9,[],[],https://twitter.com/JayAshcroftMO/status/1495799936977620994,False,,1,https://pbs.twimg.com/media/FMImGTeVIAE5RTd.png,,,,,,,[],,,,
1495069301576908800,1495069301576908800,2022-02-19 11:14:33 Eastern Standard Time,2022-02-19,11:14:33,-0400,2435811084,jayashcroftmo,Jay Ashcroft,,"I am proud to #BackTheBlue because the men and women on our front lines work to make Missouri a safer place to live. I will continue to work with law enforcement to make sure law and order is upheld, so Missourians feel safe.",en,[],[],[],5,4,14,['backtheblue'],[],https://twitter.com/JayAshcroftMO/status/1495069301576908800,False,,0,,,,,,,,[],,,,
1494793136811380741,1494793136811380741,2022-02-18 16:57:10 Eastern Standard Time,2022-02-18,16:57:10,-0400,2435811084,jayashcroftmo,Jay Ashcroft,,I fully support #SchoolChoice because it is the ultimate solution to giving control back to parents over their children’s education. Your money + your children = YOUR CHOICE.,en,[],[],[],109,16,57,['schoolchoice'],[],https://twitter.com/JayAshcroftMO/status/1494793136811380741,False,,0,,,,,,,,[],,,,
1494093948796616705,1494093948796616705,2022-02-16 18:38:50 Eastern Standard Time,2022-02-16,18:38:50,-0400,2435811084,jayashcroftmo,Jay Ashcroft,,"One thing is clear, Missourians want photo ID requirements at the ballot box. I support Voter ID requirements for elections because it makes a stronger election that will best represent Missouri interests, not DC’s.",en,[],[],[],94,36,225,[],[],https://twitter.com/JayAshcroftMO/status/1494093948796616705,False,,0,,,,,,,,[],,,,
1493095247328468994,1493095247328468994,2022-02-14 00:30:21 Eastern Standard Time,2022-02-14,00:30:21,-0400,2435811084,jayashcroftmo,Jay Ashcroft,,It was great to discuss election security and serve ice cream at @MissouriGOP Lincoln Day.  Thanks to @mccloskeyusa and @auctnr1 for helping out!  https://t.co/RIx4TaxB4u,en,"[{'screen_name': 'missourigop', 'name': 'missouri gop', 'id': '30875418'}, {'screen_name': 'mccloskeyusa', 'name': 'mark mccloskey', 'id': '1285633950355017730'}, {'screen_name': 'auctnr1', 'name': 'billy long', 'id': '21572351'}]",[],"['https://pbs.twimg.com/media/FLiKEfjXEAIT9OG.jpg', 'https://pbs.twimg.com/media/FLiKEfjX0AMugZc.jpg', 'https://pbs.twimg.com/media/FLiKEfjWYAYCeyg.jpg']",0,3,9,[],[],https://twitter.com/JayAshcroftMO/status/1493095247328468994,False,,1,https://pbs.twimg.com/media/FLiKEfjXEAIT9OG.jpg,,,,,,,[],,,,
1492524573337677827,1492524573337677827,2022-02-12 10:42:42 Eastern Standard Time,2022-02-12,10:42:42,-0400,2435811084,jayashcroftmo,Jay Ashcroft,,"A new poll says 77% of Americans don’t think Biden’s economic policies help them. And a majority say that they will WORSEN inflation. #Bidenflation makes life harder for every American, plain and simple.",en,[],[],[],17,4,29,['bidenflation'],[],https://twitter.com/JayAshcroftMO/status/1492524573337677827,False,,0,,,,,,,,[],,,,
1492237225857359878,1492237225857359878,2022-02-11 15:40:53 Eastern Standard Time,2022-02-11,15:40:53,-0400,2435811084,jayashcroftmo,Jay Ashcroft,,"Parents deserve the right to know what their children are being taught in the classroom &amp; to have control over it. #SchoolChoice is the ultimate answer to stop teachers from radicalizing our children. Teachers need to stick to math and science, not pushing their political views.",en,[],[],[],9,3,8,['schoolchoice'],[],https://twitter.com/JayAshcroftMO/status/1492237225857359878,False,,0,,,,,,,,[],,,,
1491552751456817157,1491552751456817157,2022-02-09 18:21:02 Eastern Standard Time,2022-02-09,18:21:02,-0400,2435811084,jayashcroftmo,Jay Ashcroft,,"On Tuesday, I joined Missouri prosecutors to discuss making Missouri a safer place to live. We had a great discussion, and I see a safe and bright future for our great state. #BacktheBlue #ToughonCrime   https://t.co/zK8hfam0Eu",en,[],['https://www.foxnews.com/us/rogue-prosecutors-driving-u-s-violent-crime-surge-expert-says'],[],1,1,2,"['backtheblue', 'toughoncrime']",[],https://twitter.com/JayAshcroftMO/status/1491552751456817157,False,,0,,,,,,,,[],,,,
1490808805189324800,1490808805189324800,2022-02-07 17:04:51 Eastern Standard Time,2022-02-07,17:04:51,-0400,2435811084,jayashcroftmo,Jay Ashcroft,,"As the State Senate is set to vote on our new congressional map, many Republicans have already surrendered to Radical Democrats. I will not surrender the map and fight for one that represents Missouri’s best interests, not Nancy Pelosi’s. #MOLEG",en,[],[],[],57,24,105,['moleg'],[],https://twitter.com/JayAshcroftMO/status/1490808805189324800,False,,0,,,,,,,,[],,,,
1489685096512700418,1489685096512700418,2022-02-04 14:39:38 Eastern Standard Time,2022-02-04,14:39:38,-0400,2435811084,jayashcroftmo,Jay Ashcroft,,"China’s egregious crimes against humanity need to be condemned, not rewarded with the Olympics. Biden’s “diplomatic boycott” does nothing to stand up to China. We need a total boycott so China understands that we don’t stand for their crimes. #Beijing2022  #Olympics",en,[],[],[],2,0,4,"['beijing2022', 'olympics']",[],https://twitter.com/JayAshcroftMO/status/1489685096512700418,False,,0,,,,,,,,[],,,,
