id,conversation_id,created_at,date,time,timezone,user_id,username,name,place,tweet,language,mentions,urls,photos,replies_count,retweets_count,likes_count,hashtags,cashtags,link,retweet,quote_url,video,thumbnail,near,geo,source,user_rt_id,user_rt,retweet_id,reply_to,retweet_date,translate,trans_src,trans_dest
1495525287756369921,1495525287756369921,2022-02-20 17:26:28 Eastern Standard Time,2022-02-20,17:26:28,-0400,1343969773726494721,govgianforte,Governor Greg Gianforte,,"Through agricultural education, @NationalFFA grows young Montanans into the next generation of leaders. To Montana FFA members past and present, happy #FFAWeek!  https://t.co/6xkAioIQ4v",en,"[{'screen_name': 'nationalffa', 'name': 'national ffa', 'id': '14261617'}]",[],['https://pbs.twimg.com/media/FMEsUftVgAAg8XT.jpg'],3,3,30,['ffaweek'],[],https://twitter.com/GovGianforte/status/1495525287756369921,False,,1,https://pbs.twimg.com/media/FMEsUftVgAAg8XT.jpg,,,,,,,[],,,,
1495440268924841986,1495440268924841986,2022-02-20 11:48:38 Eastern Standard Time,2022-02-20,11:48:38,-0400,1343969773726494721,govgianforte,Governor Greg Gianforte,,"Montana's unemployment rate is the lowest in our state's history, and the 5th lowest in the nation. Montana is open for business.",en,[],[],[],82,59,515,[],[],https://twitter.com/GovGianforte/status/1495440268924841986,False,,0,,,,,,,,[],,,,
1494751485275475973,1494751485275475973,2022-02-18 14:11:39 Eastern Standard Time,2022-02-18,14:11:39,-0400,1343969773726494721,govgianforte,Governor Greg Gianforte,,"Whether it’s truckers or health care workers, driving individuals out of an already strained workforce through mandates makes no sense.  https://t.co/W8RhGKR1Hd",en,[],['https://helenair.com/news/state-and-regional/govt-and-politics/gianforte-canadian-officials-press-trudeau-biden-to-reinstate-trucker-vaccine-exemption/article_a8ed4004-0d1a-5477-a696-599708bbb74f.html#tncms-source=login'],[],58,21,124,[],[],https://twitter.com/GovGianforte/status/1494751485275475973,False,,0,,,,,,,,[],,,,
1494498083467513859,1494498083467513859,2022-02-17 21:24:44 Eastern Standard Time,2022-02-17,21:24:44,-0400,1343969773726494721,govgianforte,Governor Greg Gianforte,,"Meeting with these young Montana entrepreneurs at Park High School was the highlight of my day.  To support the Park Woof Pack, I encourage Montanans to contact the Park High School office and put in an order for some homemade dog treats.  https://t.co/JxUbVqXorr",en,[],[],[],5,6,21,[],[],https://twitter.com/GovGianforte/status/1494498083467513859,False,,1,https://pbs.twimg.com/ext_tw_video_thumb/1494497653714870272/pu/img/aQwMaqz6VuweMyWa.jpg,,,,,,,[],,,,
1494474958185005057,1494474958185005057,2022-02-17 19:52:50 Eastern Standard Time,2022-02-17,19:52:50,-0400,1343969773726494721,govgianforte,Governor Greg Gianforte,,"Today I spoke with Canadian Transport Minister Omar Alghabra, at his request. Montana appreciates our partnership with Canada and her provinces. Our supply chains must flow fully for our consumers, and to do that the Canadian government should eliminate its trucker mandates.  https://t.co/ZvOjAxhF2v",en,[],[],['https://pbs.twimg.com/media/FL1wwyaVgAILYLc.jpg'],41,28,128,[],[],https://twitter.com/GovGianforte/status/1494474958185005057,False,,1,https://pbs.twimg.com/media/FL1wwyaVgAILYLc.jpg,,,,,,,[],,,,
1494448512490254338,1494448512490254338,2022-02-17 18:07:45 Eastern Standard Time,2022-02-17,18:07:45,-0400,1343969773726494721,govgianforte,Governor Greg Gianforte,,"Every Montana student deserves the opportunity to learn, thrive, and reach his or her full potential.   Through Park High School’s life skills class, these bright young Montanans started Park Woof Pack, a dog biscuit sales and manufacturing business. #CTEMonth  https://t.co/hzIIcqC8uR",en,[],[],"['https://pbs.twimg.com/media/FL1Y_dVWUAI77rp.jpg', 'https://pbs.twimg.com/media/FL1Y_dTXwAATeAc.jpg']",8,2,28,['ctemonth'],[],https://twitter.com/GovGianforte/status/1494448512490254338,False,,1,https://pbs.twimg.com/media/FL1Y_dVWUAI77rp.jpg,,,,,,,[],,,,
1494388501294436364,1494388501294436364,2022-02-17 14:09:17 Eastern Standard Time,2022-02-17,14:09:17,-0400,1343969773726494721,govgianforte,Governor Greg Gianforte,,"By making smart, targeted investments in rapid training programs, we can equip hardworking Montanans with the skills they need to thrive in today’s workforce and help Montana employers meet their workforce needs.  https://t.co/NvLtebLUCD",en,[],['https://www.mtpr.org/montana-news/2022-02-16/6-million-grant-will-support-rapid-training-programs-for-montana-workers'],[],5,1,17,[],[],https://twitter.com/GovGianforte/status/1494388501294436364,False,,0,,,,,,,,[],,,,
1494375807728324609,1494375807728324609,2022-02-17 13:18:51 Eastern Standard Time,2022-02-17,13:18:51,-0400,1343969773726494721,govgianforte,Governor Greg Gianforte,,Looking forward to celebrating #CTEMonth with young Montanans in Park County today.,en,[],[],[],2,2,9,['ctemonth'],[],https://twitter.com/GovGianforte/status/1494375807728324609,False,https://twitter.com/MTDLI1/status/1494341554051424258,0,,,,,,,,[],,,,
1494358831215697924,1494358831215697924,2022-02-17 12:11:23 Eastern Standard Time,2022-02-17,12:11:23,-0400,1343969773726494721,govgianforte,Governor Greg Gianforte,,North American supply chains are broken. We must keep truckers on the road to keep goods moving and shelves stocked.  https://t.co/aN8JDc36GG,en,[],['https://www.dailywire.com/news/u-s-govs-canadian-premiers-call-on-biden-trudeau-to-drop-cross-border-vax-mandate-for-truckers'],[],16,13,56,[],[],https://twitter.com/GovGianforte/status/1494358831215697924,False,,0,,,,,,,,[],,,,
1494125075926114304,1494125075926114304,2022-02-16 20:42:32 Eastern Standard Time,2022-02-16,20:42:32,-0400,1343969773726494721,govgianforte,Governor Greg Gianforte,,Montana families are paying 9% more for necessities than they were a year ago. We can’t afford for the federal government to continue driving up inflation with trillions more in spending.  https://t.co/wqJg73zIb2,en,[],['https://www.foxbusiness.com/economy/inflations-grip-tightens-in-mountain-states-midwest-as-consumer-prices-surge'],[],50,24,105,[],[],https://twitter.com/GovGianforte/status/1494125075926114304,False,,0,,,,,,,,[],,,,
1494084246784200704,1494084246784200704,2022-02-16 18:00:17 Eastern Standard Time,2022-02-16,18:00:17,-0400,1343969773726494721,govgianforte,Governor Greg Gianforte,,"I met with the East Helena High welding class last fall, and left the visit incredibly impressed. This project is a great example of what our talented, hardworking students can achieve through Career and Technical Education. #CTEMonth  https://t.co/OrvcwF5clc",en,[],['https://helenair.com/news/local/education/east-helena-high-welding-students-building-pavilion-for-camp-rimini/article_f68fb87b-9fa2-5a9c-8c60-a65679772c3a.html#tracking-source=home-top-story'],[],6,2,25,['ctemonth'],[],https://twitter.com/GovGianforte/status/1494084246784200704,False,,0,,,,,,,,[],,,,
1494053382964846593,1494053382964846593,2022-02-16 15:57:39 Eastern Standard Time,2022-02-16,15:57:39,-0400,1343969773726494721,govgianforte,Governor Greg Gianforte,,"What we're seeing in Canada makes me grateful for our American rights, freedoms, and liberties – including the right to peaceably assemble, freedom of speech, and our guarantee of due process.  https://t.co/0lsGyiI0nr",en,[],[],[],171,401,1011,[],[],https://twitter.com/GovGianforte/status/1494053382964846593,False,,1,https://pbs.twimg.com/ext_tw_video_thumb/1494053286890061827/pu/img/N9F_MOEYaPOCMYLi.jpg,,,,,,,[],,,,
1494019991728844803,1494019991728844803,2022-02-16 13:44:58 Eastern Standard Time,2022-02-16,13:44:58,-0400,1343969773726494721,govgianforte,Governor Greg Gianforte,,"Agreed, @JKenney. Our countries depend on keeping truckers on the road, supply chains working, and trade between our nations flowing.",en,"[{'screen_name': 'jkenney', 'name': 'jason kenney 🇺🇦', 'id': '21525682'}]",[],[],14,12,85,[],[],https://twitter.com/GovGianforte/status/1494019991728844803,False,https://twitter.com/jkenney/status/1494002803555155971,0,,,,,,,,[],,,,
1493996369748447233,1493996369748447233,2022-02-16 12:11:06 Eastern Standard Time,2022-02-16,12:11:06,-0400,1343969773726494721,govgianforte,Governor Greg Gianforte,,"Truckers work hard every day to keep goods moving and our shelves stocked. We can’t afford to lose them, especially with our supply chains broken. It's time @JoeBiden and @JustinTrudeau act to end the mandates and get them back on the road.  https://t.co/V5ZQSBqY4e",en,"[{'screen_name': 'joebiden', 'name': 'joe biden', 'id': '939091'}, {'screen_name': 'justintrudeau', 'name': 'justin trudeau', 'id': '14260960'}]",[],"['https://pbs.twimg.com/media/FLu9o7aUUAAxmDT.png', 'https://pbs.twimg.com/media/FLu9qs6UYAA5KZE.png']",73,151,501,[],[],https://twitter.com/GovGianforte/status/1493996369748447233,False,,1,https://pbs.twimg.com/media/FLu9o7aUUAAxmDT.png,,,,,,,[],,,,
1493730367622180865,1493730367622180865,2022-02-15 18:34:06 Eastern Standard Time,2022-02-15,18:34:06,-0400,1343969773726494721,govgianforte,Governor Greg Gianforte,,"Montana’s public lands should be enjoyed year round, and @MontanaFWP’s Snowmobile Program helps make that possible. I was glad to cut the ribbon for the program's new groomer and hop on a sled in Wise River last week.  https://t.co/Y0Ej748MMz",en,"[{'screen_name': 'montanafwp', 'name': 'montana fwp', 'id': '15679505'}]",[],[],12,12,46,[],[],https://twitter.com/GovGianforte/status/1493730367622180865,False,,1,https://pbs.twimg.com/ext_tw_video_thumb/1493729753425014793/pu/img/q8wZ-ry0S4a3QoSU.jpg,,,,,,,[],,,,
1493689056277893122,1493689056277893122,2022-02-15 15:49:57 Eastern Standard Time,2022-02-15,15:49:57,-0400,1343969773726494721,govgianforte,Governor Greg Gianforte,,"As our economy grows, so are opportunities to work in a good-paying job right here in Montana. With this investment, we’ll equip hardworking Montanans with the skills they need to thrive in today’s workforce.  https://t.co/ZyTxUWMMwW",en,[],['https://news.mt.gov/Governors-Office/Gov_Gianforte_Announces_6_Million_Investment_in_Rapid_Workforce_Training'],[],9,2,13,[],[],https://twitter.com/GovGianforte/status/1493689056277893122,False,,0,,,,,,,,[],,,,
1493685762717470721,1493685762717470721,2022-02-15 15:36:51 Eastern Standard Time,2022-02-15,15:36:51,-0400,1343969773726494721,govgianforte,Governor Greg Gianforte,,Grateful to @SteveDaines for standing up for Montana and holding the Biden administration accountable on #KeystoneXL.,en,"[{'screen_name': 'stevedaines', 'name': 'steve daines', 'id': '11651202'}]",[],[],35,10,77,['keystonexl'],[],https://twitter.com/GovGianforte/status/1493685762717470721,False,https://twitter.com/SteveDaines/status/1493669703549661185,0,,,,,,,,[],,,,
1493661166312194049,1493661166312194049,2022-02-15 13:59:07 Eastern Standard Time,2022-02-15,13:59:07,-0400,1343969773726494721,govgianforte,Governor Greg Gianforte,,Montana students deserve the best education possible to prepare them for the jobs of tomorrow. That’s why I was proud to proclaim February Career and Technical Education Month in Montana.  https://t.co/Ri3dfzMQzP,en,[],[],[],3,3,27,[],[],https://twitter.com/GovGianforte/status/1493661166312194049,False,,1,https://pbs.twimg.com/ext_tw_video_thumb/1493660488898527232/pu/img/4xCYsEgyOjxxV6bm.jpg,,,,,,,[],,,,
1493349638765629440,1493349638765629440,2022-02-14 17:21:13 Eastern Standard Time,2022-02-14,17:21:13,-0400,1343969773726494721,govgianforte,Governor Greg Gianforte,,Wishing Whitefish’s own Maggie Voisin great success in tonight's finals. #MontanaProud  https://t.co/9g7ISkd1hJ,en,[],['https://406mtsports.com/olympics/whitefishs-maggie-voisin-advances-to-olympic-ski-slopestyle-final-missoulas-darian-stevens-17th/article_709b7915-0e1b-56b6-8251-d7e7fb85a255.html'],[],3,4,25,['montanaproud'],[],https://twitter.com/GovGianforte/status/1493349638765629440,False,,0,,,,,,,,[],,,,
1493295479873937408,1493295479873937408,2022-02-14 13:46:01 Eastern Standard Time,2022-02-14,13:46:01,-0400,1343969773726494721,govgianforte,Governor Greg Gianforte,,"Career and Technical Education prepares students for the jobs of tomorrow and provides employers with a highly-skilled, highly-qualified workforce. I encourage all Montana schools to create personalized work-based learning paths for our students. #CTEMonth  https://t.co/x0xcf9Q0fg",en,[],[],"['https://pbs.twimg.com/media/FLk_1_KUYActQzL.jpg', 'https://pbs.twimg.com/media/FLlARvsUUAIKodD.jpg']",10,6,26,['ctemonth'],[],https://twitter.com/GovGianforte/status/1493295479873937408,False,,1,https://pbs.twimg.com/media/FLk_1_KUYActQzL.jpg,,,,,,,[],,,,
1493256672839569409,1493256672839569409,2022-02-14 11:11:48 Eastern Standard Time,2022-02-14,11:11:48,-0400,1343969773726494721,govgianforte,Governor Greg Gianforte,,Happy Valentine's to my sweetheart Susan.  I can't imagine going through life without you!  https://t.co/QAIGDab1J5,en,[],[],['https://pbs.twimg.com/media/FLkc9nVVkAAAr2X.jpg'],5,4,123,[],[],https://twitter.com/GovGianforte/status/1493256672839569409,False,,1,https://pbs.twimg.com/media/FLkc9nVVkAAAr2X.jpg,,,,,,,[],,,,
1492630437289730056,1492630437289730056,2022-02-12 17:43:22 Eastern Standard Time,2022-02-12,17:43:22,-0400,1343969773726494721,govgianforte,Governor Greg Gianforte,,"The Biden administration's WOTUS proposal is vague, ambiguous, and bad for Montana. I'm calling on the administration to reconsider.  https://t.co/FcaivqtJIN",en,[],['https://news.mt.gov/Governors-Office/Gov_Gianforte_Blasts_Biden_Administrations_WOTUS_Proposal'],[],30,9,53,[],[],https://twitter.com/GovGianforte/status/1492630437289730056,False,,0,,,,,,,,[],,,,
1492268420292882436,1492268420292882436,2022-02-11 17:44:51 Eastern Standard Time,2022-02-11,17:44:51,-0400,1343969773726494721,govgianforte,Governor Greg Gianforte,,"Creating more than 75 good-paying Montana jobs, Golden Sunlight’s Tailings Reprocessing Project is an example of what’s possible when state agencies provide a stable, predictable regulatory process that companies can rely on.  https://t.co/yFDJD7UoJK",en,[],[],"['https://pbs.twimg.com/media/FLWaNc8XIAIXjg5.jpg', 'https://pbs.twimg.com/media/FLWaNdBXoAAoMYm.jpg']",14,8,41,[],[],https://twitter.com/GovGianforte/status/1492268420292882436,False,,1,https://pbs.twimg.com/media/FLWaNc8XIAIXjg5.jpg,,,,,,,[],,,,
1492223562530234369,1492223562530234369,2022-02-11 14:46:36 Eastern Standard Time,2022-02-11,14:46:36,-0400,1343969773726494721,govgianforte,Governor Greg Gianforte,,February is #BlackHistoryMonth in Montana. Learn about trailblazing Black Montanans that have helped shape our state's history at  https://t.co/7lp4a3ARB3.,en,[],['https://mhs.mt.gov/Shpo/AfricanAmericans/'],[],18,3,24,['blackhistorymonth'],[],https://twitter.com/GovGianforte/status/1492223562530234369,False,,0,,,,,,,,[],,,,
1491916001188876288,1491915997103603713,2022-02-10 18:24:27 Eastern Standard Time,2022-02-10,18:24:27,-0400,1343969773726494721,govgianforte,Governor Greg Gianforte,,Thank you for your tireless work and dedication to serving all Montanans. I look forward to continuing to work with you to advance the health of our state. 4/4,en,[],[],[],4,2,10,[],[],https://twitter.com/GovGianforte/status/1491916001188876288,False,,0,,,,,,,,[],,,,
1491916000056397829,1491915997103603713,2022-02-10 18:24:27 Eastern Standard Time,2022-02-10,18:24:27,-0400,1343969773726494721,govgianforte,Governor Greg Gianforte,,"Another option is to talk with your colleagues or personal health care provider about getting vaccinated.  I hope you'll consider all options, because we can't afford to lose you, your experience, and your compassionate, dedicated care due to @JoeBiden's vaccine mandate. 3/",en,"[{'screen_name': 'joebiden', 'name': 'joe biden', 'id': '939091'}]",[],[],5,3,12,[],[],https://twitter.com/GovGianforte/status/1491916000056397829,False,,0,,,,,,,,[],,,,
1491915998915534849,1491915997103603713,2022-02-10 18:24:27 Eastern Standard Time,2022-02-10,18:24:27,-0400,1343969773726494721,govgianforte,Governor Greg Gianforte,,"I instructed @DPHHSMT to develop a template religious exemption form for health care workers. You may find it at  https://t.co/sanl6Xo3TB.  As a health care worker, your employer is required to offer religious and medical exemption processes. 2/",en,"[{'screen_name': 'dphhsmt', 'name': 'dphhs', 'id': '3996166572'}]",['https://dphhs.mt.gov/assets/publichealth/CDEpi/DiseasesAtoZ/2019-nCoV/CMSVaccineMandateReligiousExemptionApplicationForm.pdf'],[],3,4,18,[],[],https://twitter.com/GovGianforte/status/1491915998915534849,False,,0,,,,,,,,[],,,,
1491915997103603713,1491915997103603713,2022-02-10 18:24:26 Eastern Standard Time,2022-02-10,18:24:26,-0400,1343969773726494721,govgianforte,Governor Greg Gianforte,,🧵I sent a letter today to all Montana health care professionals.  Monday is the deadline to act before @JoeBiden's vaccine mandate for health care workers is enforceable. Unvaccinated health care workers should act if you haven't already.  One option: request an exemption. 1/  https://t.co/I8aSseTN6q,en,"[{'screen_name': 'joebiden', 'name': 'joe biden', 'id': '939091'}]",[],"['https://pbs.twimg.com/media/FLRY2gPVkAQQnL_.png', 'https://pbs.twimg.com/media/FLRY4FGVcAEhSdf.png']",47,7,46,[],[],https://twitter.com/GovGianforte/status/1491915997103603713,False,,1,https://pbs.twimg.com/media/FLRY2gPVkAQQnL_.png,,,,,,,[],,,,
1491897720327471105,1491897720327471105,2022-02-10 17:11:49 Eastern Standard Time,2022-02-10,17:11:49,-0400,1343969773726494721,govgianforte,Governor Greg Gianforte,,"Montana has some of the finest pulse crops in the United States, ranking first in the nation for the production of dry peas, chickpeas, and lentils. Happy #WorldPulseDay to our Montana pulse crop farmers, like Stricks Ag in Chester.  https://t.co/sbFYKw5hNA",en,[],[],['https://pbs.twimg.com/media/FLRInzYVgAsipWg.jpg'],4,5,32,['worldpulseday'],[],https://twitter.com/GovGianforte/status/1491897720327471105,False,,1,https://pbs.twimg.com/media/FLRInzYVgAsipWg.jpg,,,,,,,[],,,,
1491878816167313425,1491878816167313425,2022-02-10 15:56:42 Eastern Standard Time,2022-02-10,15:56:42,-0400,1343969773726494721,govgianforte,Governor Greg Gianforte,,"Thank you, @MTHwyPatrol, for keeping our communities safe and drugs off our streets.",en,"[{'screen_name': 'mthwypatrol', 'name': 'montana highway patrol', 'id': '3181051201'}]",[],[],2,1,30,[],[],https://twitter.com/GovGianforte/status/1491878816167313425,False,https://twitter.com/MTHwyPatrol/status/1491876090440138752,0,,,,,,,,[],,,,
1491856006518755332,1491856006518755332,2022-02-10 14:26:03 Eastern Standard Time,2022-02-10,14:26:03,-0400,1343969773726494721,govgianforte,Governor Greg Gianforte,,"To address Montana's longstanding health care worker shortage and build a stronger, more robust workforce, we’re inviting qualified health care professionals to move to Montana and serve in our communities.  https://t.co/rQcJZuvZsY",en,[],['https://billingsgazette.com/news/state-and-regional/state-launches-website-to-recruit-health-care-workers/article_7aa9108c-1b96-5845-bfd3-852df5123fb5.html'],[],28,8,23,[],[],https://twitter.com/GovGianforte/status/1491856006518755332,False,,0,,,,,,,,[],,,,
1491818806284460047,1491818806284460047,2022-02-10 11:58:14 Eastern Standard Time,2022-02-10,11:58:14,-0400,1343969773726494721,govgianforte,Governor Greg Gianforte,,Wishing Butte native and @MontanaGrizFB alum Colt Anderson great success in the Super Bowl this weekend. #MontanaProud  https://t.co/hkP6ZqEqeP,en,"[{'screen_name': 'montanagrizfb', 'name': 'montana griz football', 'id': '259942122'}]",['https://nbcmontana.com/news/local/spotlight-montana'],[],4,2,11,['montanaproud'],[],https://twitter.com/GovGianforte/status/1491818806284460047,False,,0,,,,,,,,[],,,,
1491784599009050632,1491784599009050632,2022-02-10 09:42:19 Eastern Standard Time,2022-02-10,09:42:19,-0400,1343969773726494721,govgianforte,Governor Greg Gianforte,,"With inflation climbing to 9% in the Rocky Mountain West, hardworking Montanans continue to pay more at the pump and the grocery store.   To get inflation under control, @JoeBiden and Congress should show some fiscal discipline, like we do in Montana.  https://t.co/wm43NVt313",en,"[{'screen_name': 'joebiden', 'name': 'joe biden', 'id': '939091'}]",['https://www.cnbc.com/2022/02/10/january-2022-cpi-inflation-rises-7point5percent-over-the-past-year-even-more-than-expected.html?utm_term=Autofeed&utm_medium=Social&utm_content=Main&utm_source=Twitter#Echobox=1644500047'],[],56,9,51,[],[],https://twitter.com/GovGianforte/status/1491784599009050632,False,,0,,,,,,,,[],,,,
1491585207937343488,1491585207937343488,2022-02-09 20:30:00 Eastern Standard Time,2022-02-09,20:30:00,-0400,1343969773726494721,govgianforte,Governor Greg Gianforte,,May God bless the future USS Montana and all who sail aboard her.  https://t.co/w6NOta5i24,en,[],['https://helenair.com/news/state-and-regional/uss-montana-submarine-completes-first-wave-of-sea-trials/article_4942d58a-0534-5e5a-a101-f6751013fdde.html'],[],9,15,82,[],[],https://twitter.com/GovGianforte/status/1491585207937343488,False,,0,,,,,,,,[],,,,
1491556206061649921,1491556206061649921,2022-02-09 18:34:45 Eastern Standard Time,2022-02-09,18:34:45,-0400,1343969773726494721,govgianforte,Governor Greg Gianforte,,"It's always a pleasure to be in the company of our first responders. Thanks for having me out to Chico today, @mtproff, and thank you to all Montana professional firefighters for their heroic, noble work.",en,"[{'screen_name': 'mtproff', 'name': 'montana professional firefighters', 'id': '950490294'}]",[],[],8,5,21,[],[],https://twitter.com/GovGianforte/status/1491556206061649921,False,https://twitter.com/mtproff/status/1491518500317188096,0,,,,,,,,[],,,,
1491488896311463936,1491488896311463936,2022-02-09 14:07:18 Eastern Standard Time,2022-02-09,14:07:18,-0400,1343969773726494721,govgianforte,Governor Greg Gianforte,,"CSPAC went beyond its legal authority today with a decision that puts an extreme political agenda ahead of our students, undermining their equality of opportunity.   I call on the Montana Board of Public Education to right this wrong and put Montana students first.  https://t.co/5yCGQ7C5mc",en,[],[],['https://pbs.twimg.com/media/FLLTdsaUYAAi3qS.jpg'],46,17,60,[],[],https://twitter.com/GovGianforte/status/1491488896311463936,False,,1,https://pbs.twimg.com/media/FLLTdsaUYAAi3qS.jpg,,,,,,,[],,,,
1491434830504296448,1491434828595867659,2022-02-09 10:32:27 Eastern Standard Time,2022-02-09,10:32:27,-0400,1343969773726494721,govgianforte,Governor Greg Gianforte,,"Instead of promoting equity, the concept that ‘we all end up at the same place’ or with equal results, we should promote equality in education, the idea that every student should enjoy equal opportunity to learn, thrive, and reach his or her full potential.",en,[],[],[],16,6,56,[],[],https://twitter.com/GovGianforte/status/1491434830504296448,False,,0,,,,,,,,[],,,,
1491434828595867659,1491434828595867659,2022-02-09 10:32:27 Eastern Standard Time,2022-02-09,10:32:27,-0400,1343969773726494721,govgianforte,Governor Greg Gianforte,,"Citing equity, California developed a plan to end accelerated math.  Citing equity, Oregon repealed graduation testing requirements.  Montana schools shouldn’t fall into the traps of promoting a political agenda, in the name of equity, that jeopardizes students' opportunities.  https://t.co/Uqnuwdbb1u",en,[],[],"['https://pbs.twimg.com/media/FLKjaI1UUAUYcBf.png', 'https://pbs.twimg.com/media/FLKjaJSUUAAWTs2.png']",29,19,101,[],[],https://twitter.com/GovGianforte/status/1491434828595867659,False,,1,https://pbs.twimg.com/media/FLKjaI1UUAUYcBf.png,,,,,,,[],,,,
1491202310504353792,1491202310504353792,2022-02-08 19:08:30 Eastern Standard Time,2022-02-08,19:08:30,-0400,1343969773726494721,govgianforte,Governor Greg Gianforte,,"Glad to welcome Rear Admiral Melvin Bouboulis, Commander of the Thirteenth @USCG District, to the State Capitol today. Semper Paratus!  https://t.co/Vt7i7ZmkzB",en,"[{'screen_name': 'uscg', 'name': 'u.s. coast guard', 'id': '15113565'}]",[],['https://pbs.twimg.com/media/FLHP9lcUcAEjcjN.jpg'],9,3,21,[],[],https://twitter.com/GovGianforte/status/1491202310504353792,False,,1,https://pbs.twimg.com/media/FLHP9lcUcAEjcjN.jpg,,,,,,,[],,,,
1491169993983410177,1491169993983410177,2022-02-08 17:00:05 Eastern Standard Time,2022-02-08,17:00:05,-0400,1343969773726494721,govgianforte,Governor Greg Gianforte,,"A model for value-added agriculture, Montana Craft Malt brings grain to glass right here in the Treasure State. We’ll continue to promote and invest in value-added ag operations across Montana.  https://t.co/1oIuumXpn5",en,[],[],[],2,3,12,[],[],https://twitter.com/GovGianforte/status/1491169993983410177,False,,1,https://pbs.twimg.com/ext_tw_video_thumb/1491169894355783680/pu/img/W5tsZhyFSBo69tt9.jpg,,,,,,,[],,,,
1491150263243079683,1491150263243079683,2022-02-08 15:41:41 Eastern Standard Time,2022-02-08,15:41:41,-0400,1343969773726494721,govgianforte,Governor Greg Gianforte,,"I had a great morning in Wise River cutting the ribbon for @MontanaFWP’s new groomer — and even got to hit the trail for a spin.   Montana has world-class winter recreation opportunities, and FWP’s Snowmobile Program increases access to these opportunities for all Montanans.  https://t.co/Uuyi3vVn4j",en,"[{'screen_name': 'montanafwp', 'name': 'montana fwp', 'id': '15679505'}]",[],"['https://pbs.twimg.com/media/FLGhQRwVkAQ7iqS.jpg', 'https://pbs.twimg.com/media/FLGhQRwVIAIum9f.jpg']",9,4,28,[],[],https://twitter.com/GovGianforte/status/1491150263243079683,False,,1,https://pbs.twimg.com/media/FLGhQRwVkAQ7iqS.jpg,,,,,,,[],,,,
