id,conversation_id,created_at,date,time,timezone,user_id,username,name,place,tweet,language,mentions,urls,photos,replies_count,retweets_count,likes_count,hashtags,cashtags,link,retweet,quote_url,video,thumbnail,near,geo,source,user_rt_id,user_rt,retweet_id,reply_to,retweet_date,translate,trans_src,trans_dest
1506300274519859203,1506300274519859203,2022-03-22 12:02:25 Eastern Daylight Time,2022-03-22,12:02:25,-0400,1343969773726494721,govgianforte,Governor Greg Gianforte,,"Agriculture's not just an industry, it helps define our way of life here in Montana. #AgDay22  https://t.co/o1PQGzgHhR",en,[],[],"['https://pbs.twimg.com/media/FOdzKvGVsAUbWPY.jpg', 'https://pbs.twimg.com/media/FOdzKvCVUAEpI5h.jpg', 'https://pbs.twimg.com/media/FOdzKvIVcAYrY0O.jpg', 'https://pbs.twimg.com/media/FOdzThUUYAIhtss.jpg']",2,2,10,['agday22'],[],https://twitter.com/GovGianforte/status/1506300274519859203,False,,1,https://pbs.twimg.com/media/FOdzKvGVsAUbWPY.jpg,,,,,,,[],,,,
1506058315067006976,1506058315067006976,2022-03-21 20:00:58 Eastern Daylight Time,2022-03-21,20:00:58,-0400,1343969773726494721,govgianforte,Governor Greg Gianforte,,"Producing the best beef in the world, Montana ranchers are strong stewards of our lands. Great to meet with some of them today during Montana Ag Week.  https://t.co/RkpVLcnMWC",en,[],[],"['https://pbs.twimg.com/media/FOaYC8yWQAgrF9v.jpg', 'https://pbs.twimg.com/media/FOaYC8yXIAAzIym.jpg']",13,7,59,[],[],https://twitter.com/GovGianforte/status/1506058315067006976,False,,1,https://pbs.twimg.com/media/FOaYC8yWQAgrF9v.jpg,,,,,,,[],,,,
1505953086728130561,1505953086728130561,2022-03-21 13:02:49 Eastern Daylight Time,2022-03-21,13:02:49,-0400,1343969773726494721,govgianforte,Governor Greg Gianforte,,"We’re ramping up American-made energy in Montana. This quarter, Montana saw a record-setting oil and gas lease sale on state trust lands.  https://t.co/o1wk9qgfU3",en,[],[],['https://pbs.twimg.com/media/FOY4NMdVUAIaIO0.jpg'],46,29,145,[],[],https://twitter.com/GovGianforte/status/1505953086728130561,False,,1,https://pbs.twimg.com/media/FOY4NMdVUAIaIO0.jpg,,,,,,,[],,,,
1505922941174751232,1505922941174751232,2022-03-21 11:03:02 Eastern Daylight Time,2022-03-21,11:03:02,-0400,1343969773726494721,govgianforte,Governor Greg Gianforte,,"GREAT NEWS – we’ve finalized a Cooperative Interstate Shipment agreement with @USDA, making Montana only the tenth state in the nation where meat processors can ship products throughout the United States.",en,"[{'screen_name': 'usda', 'name': 'dept. of agriculture', 'id': '61853389'}]",[],[],32,29,145,[],[],https://twitter.com/GovGianforte/status/1505922941174751232,False,,0,,,,,,,,[],,,,
1505640061689204738,1505640061689204738,2022-03-20 16:18:58 Eastern Daylight Time,2022-03-20,16:18:58,-0400,1343969773726494721,govgianforte,Governor Greg Gianforte,,"Montana farmers and ranchers help feed our state, nation, and world. Happy #MontanaMeatDay. 🥩  https://t.co/OSZdV9cfG8",en,[],[],['https://pbs.twimg.com/media/FOUbImWVIAAxlbH.jpg'],14,23,148,['montanameatday'],[],https://twitter.com/GovGianforte/status/1505640061689204738,False,,1,https://pbs.twimg.com/media/FOUbImWVIAAxlbH.jpg,,,,,,,[],,,,
1504959849259417600,1504959849259417600,2022-03-18 19:16:03 Eastern Daylight Time,2022-03-18,19:16:03,-0400,1343969773726494721,govgianforte,Governor Greg Gianforte,,"An American hero, SSG Travis W. Atkins made the ultimate sacrifice in defense of our freedoms.  Today, I was honored to mark the grand opening of the VA clinic bearing his name that will serve our veterans for years to come.  https://t.co/CAaKS5kJHb",en,[],[],['https://pbs.twimg.com/media/FOKwk5LVIAUYX9F.jpg'],16,1,39,[],[],https://twitter.com/GovGianforte/status/1504959849259417600,False,,1,https://pbs.twimg.com/media/FOKwk5LVIAUYX9F.jpg,,,,,,,[],,,,
1504873103041589251,1504873103041589251,2022-03-18 13:31:21 Eastern Daylight Time,2022-03-18,13:31:21,-0400,1343969773726494721,govgianforte,Governor Greg Gianforte,,"While Minnesota small businesses face massive tax hikes, Montana offers a stable, predictable, and friendly climate for entrepreneurs.   Minnesota businesses should look toward Montana for a better place to do business and create jobs.  https://t.co/a6XWCQPDsp",en,[],[],"['https://pbs.twimg.com/media/FOJiCKtVEAcepXJ.png', 'https://pbs.twimg.com/media/FOJiDx8UYAU4FlP.png']",52,9,54,[],[],https://twitter.com/GovGianforte/status/1504873103041589251,False,,1,https://pbs.twimg.com/media/FOJiCKtVEAcepXJ.png,,,,,,,[],,,,
1504821757521190916,1504821757521190916,2022-03-18 10:07:19 Eastern Daylight Time,2022-03-18,10:07:19,-0400,1343969773726494721,govgianforte,Governor Greg Gianforte,,The word is out. Second annual #MontanaMeatDay happening this Sunday.  https://t.co/QNy9fvCGdy,en,[],[],[],7,2,26,['montanameatday'],[],https://twitter.com/GovGianforte/status/1504821757521190916,False,,1,https://pbs.twimg.com/ext_tw_video_thumb/1504820192102150146/pu/img/KFUQXx3V8GK3XykI.jpg,,,,,,,[],,,,
1504609240165494784,1504609240165494784,2022-03-17 20:02:51 Eastern Daylight Time,2022-03-17,20:02:51,-0400,1343969773726494721,govgianforte,Governor Greg Gianforte,,Wishing @MSUBobcatsMBB and @MSUBobcatsWBB great success in tomorrow’s games. Montana is cheering you on! #GoCatsGo,en,"[{'screen_name': 'msubobcatsmbb', 'name': 'montana state men’s basketball', 'id': '1631895253'}, {'screen_name': 'msubobcatswbb', 'name': 'montana state wbb', 'id': '68454783'}]",[],[],10,5,27,['gocatsgo'],[],https://twitter.com/GovGianforte/status/1504609240165494784,False,,0,,,,,,,,[],,,,
1504590274722476035,1504590274722476035,2022-03-17 18:47:30 Eastern Daylight Time,2022-03-17,18:47:30,-0400,1343969773726494721,govgianforte,Governor Greg Gianforte,,"Great to welcome Leadership Helena to the Capitol today to discuss our work to make Montana an even better place to live, work, and raise a family.  https://t.co/heJeADEwqT",en,[],[],['https://pbs.twimg.com/media/FOFg4KZWYAIpeQv.jpg'],5,0,14,[],[],https://twitter.com/GovGianforte/status/1504590274722476035,False,,1,https://pbs.twimg.com/media/FOFg4KZWYAIpeQv.jpg,,,,,,,[],,,,
1504565954579087375,1504565954579087375,2022-03-17 17:10:51 Eastern Daylight Time,2022-03-17,17:10:51,-0400,1343969773726494721,govgianforte,Governor Greg Gianforte,,The U.S. relies too much on other nations for our energy.   Our country imported 24% more crude oil and petroleum products from Russia in 2021 than it did in 2020.   It's past time to make America energy independent and secure.,en,[],[],[],40,7,69,[],[],https://twitter.com/GovGianforte/status/1504565954579087375,False,,0,,,,,,,,[],,,,
1504524926912393231,1504524926912393231,2022-03-17 14:27:49 Eastern Daylight Time,2022-03-17,14:27:49,-0400,1343969773726494721,govgianforte,Governor Greg Gianforte,,"In the shadows of the statue of the immortal Irishman Thomas Francis Meagher, I was proud to raise the Irish Flag and proclaim today Irish Heritage Day in Montana.  https://t.co/cZ0r5bGvSh",en,[],[],[],10,4,34,[],[],https://twitter.com/GovGianforte/status/1504524926912393231,False,,1,https://pbs.twimg.com/ext_tw_video_thumb/1504523829095264271/pu/img/HlKCk6N3GpM1LE1l.jpg,,,,,,,[],,,,
1504514065065865216,1504514065065865216,2022-03-17 13:44:40 Eastern Daylight Time,2022-03-17,13:44:40,-0400,1343969773726494721,govgianforte,Governor Greg Gianforte,,Productive meeting yesterday with Chairman Davis and Blackfeet Tribal leaders to discuss ways we can further partner to bring greater opportunity to Indian Country.  https://t.co/ucajdFiyGj,en,[],[],"['https://pbs.twimg.com/media/FOEbfFwVUAAJ0_P.jpg', 'https://pbs.twimg.com/media/FOEbfFzUcAEIZ5D.jpg', 'https://pbs.twimg.com/media/FOEbfFyVcBkR5J6.jpg', 'https://pbs.twimg.com/media/FOEbfFxUcAAGRHB.jpg']",13,4,18,[],[],https://twitter.com/GovGianforte/status/1504514065065865216,False,,1,https://pbs.twimg.com/media/FOEbfFwVUAAJ0_P.jpg,,,,,,,[],,,,
1504482791144124419,1504482791144124419,2022-03-17 11:40:24 Eastern Daylight Time,2022-03-17,11:40:24,-0400,1343969773726494721,govgianforte,Governor Greg Gianforte,,"Happy St. Patrick’s Day, Montana!  https://t.co/bfJDFBChcj",en,[],[],"['https://pbs.twimg.com/media/FOD_HS-VEAYI5au.jpg', 'https://pbs.twimg.com/media/FOD_HTNUYAU-g2z.jpg', 'https://pbs.twimg.com/media/FOD_HUiVQAs2rBx.jpg', 'https://pbs.twimg.com/media/FOD_HUqVgAIr1Me.jpg']",6,9,53,[],[],https://twitter.com/GovGianforte/status/1504482791144124419,False,,1,https://pbs.twimg.com/media/FOD_HS-VEAYI5au.jpg,,,,,,,[],,,,
1504230243304837122,1504230243304837122,2022-03-16 18:56:51 Eastern Daylight Time,2022-03-16,18:56:51,-0400,1343969773726494721,govgianforte,Governor Greg Gianforte,,A great win for a great cause. #MontanaProud,en,[],[],[],2,0,25,['montanaproud'],[],https://twitter.com/GovGianforte/status/1504230243304837122,False,https://twitter.com/LaurelNBCMT/status/1503910366727729159,0,,,,,,,,[],,,,
1504188807700107266,1504188807700107266,2022-03-16 16:12:12 Eastern Daylight Time,2022-03-16,16:12:12,-0400,1343969773726494721,govgianforte,Governor Greg Gianforte,,"Since last year, Americans are paying 50% more for gas and 44% more for home heating oil.   The Biden administration should immediately unleash domestic energy production -- rescind the termination of Keystone XL and allow new oil and gas leasing on federal land.",en,[],[],[],98,14,116,[],[],https://twitter.com/GovGianforte/status/1504188807700107266,False,,0,,,,,,,,[],,,,
1504145466321080322,1504145466321080322,2022-03-16 13:19:59 Eastern Daylight Time,2022-03-16,13:19:59,-0400,1343969773726494721,govgianforte,Governor Greg Gianforte,,"Montana’s tribal colleges not only serve as an entry point to higher education for American Indian youth, but also as hubs of economic development for Montana’s eight tribal nations.   This week, we highlight the tremendous role they play in our higher education system.",en,[],[],[],11,5,25,[],[],https://twitter.com/GovGianforte/status/1504145466321080322,False,,0,,,,,,,,[],,,,
1504110238244474887,1504110238244474887,2022-03-16 11:00:00 Eastern Daylight Time,2022-03-16,11:00:00,-0400,1343969773726494721,govgianforte,Governor Greg Gianforte,,It is imperative that our country becomes energy secure and independent.   Our nation’s adversaries are the only beneficiaries when we aren’t.,en,[],[],[],33,14,92,[],[],https://twitter.com/GovGianforte/status/1504110238244474887,False,,0,,,,,,,,[],,,,
1503884603563536384,1503884603563536384,2022-03-15 20:03:24 Eastern Daylight Time,2022-03-15,20:03:24,-0400,1343969773726494721,govgianforte,Governor Greg Gianforte,,"St. Patrick's Day is best enjoyed in Butte, America.  https://t.co/BlaVEhvnhQ",en,[],['https://mtstandard.com/news/local/were-ready-to-roll-buttes-gearing-up-for-st-patrick-s-day/article_356fafa4-5a09-5d54-b7ae-127eec77f3e3.html#tracking-source=home-top-story'],[],14,3,37,[],[],https://twitter.com/GovGianforte/status/1503884603563536384,False,,0,,,,,,,,[],,,,
1503816173749620739,1503816173749620739,2022-03-15 15:31:30 Eastern Daylight Time,2022-03-15,15:31:30,-0400,1343969773726494721,govgianforte,Governor Greg Gianforte,,"The American people simply cannot afford to rely on Russia, Iran, Venezuela, or any adversary for our energy needs.   The Biden administration should act today to reverse its anti-energy policies and make America energy independent and secure.",en,[],[],[],75,40,158,[],[],https://twitter.com/GovGianforte/status/1503816173749620739,False,,0,,,,,,,,[],,,,
1503789358091943944,1503789358091943944,2022-03-15 13:44:56 Eastern Daylight Time,2022-03-15,13:44:56,-0400,1343969773726494721,govgianforte,Governor Greg Gianforte,,"In 2019, America was a net exporter of energy for the first time since 1952. Today, with domestic energy production undermined, we're relying on our adversaries.   Today I asked @JoeBiden to act immediately to make America energy independent and secure.  https://t.co/pXNaXPlQjq",en,"[{'screen_name': 'joebiden', 'name': 'joe biden', 'id': '939091'}]",[],"['https://pbs.twimg.com/media/FN6IR7UVcAA2G_d.png', 'https://pbs.twimg.com/media/FN6ITJqUYAI6HSm.png']",36,12,68,[],[],https://twitter.com/GovGianforte/status/1503789358091943944,False,,1,https://pbs.twimg.com/media/FN6IR7UVcAA2G_d.png,,,,,,,[],,,,
1503755714640105481,1503755714640105481,2022-03-15 11:31:15 Eastern Daylight Time,2022-03-15,11:31:15,-0400,1343969773726494721,govgianforte,Governor Greg Gianforte,,"Montana has the 5th lowest unemployment rate in the country, and more Montanans are working now than ever before. Montana is open for business.",en,[],[],[],57,15,126,[],[],https://twitter.com/GovGianforte/status/1503755714640105481,False,,0,,,,,,,,[],,,,
1503523644521140224,1503523644521140224,2022-03-14 20:09:05 Eastern Daylight Time,2022-03-14,20:09:05,-0400,1343969773726494721,govgianforte,Governor Greg Gianforte,,"This week, we recognize the dedication and commitment of those who have chosen to serve Montana and our country through AmeriCorps. Happy #AmeriCorpsWeek!",en,[],[],[],3,4,21,['americorpsweek'],[],https://twitter.com/GovGianforte/status/1503523644521140224,False,,0,,,,,,,,[],,,,
1503490920896884737,1503490920896884737,2022-03-14 17:59:03 Eastern Daylight Time,2022-03-14,17:59:03,-0400,1343969773726494721,govgianforte,Governor Greg Gianforte,,"A proud day for Montana and our entire nation. Our namesake ship, the USS Montana, was delivered to the @USNavy this weekend. 🇺🇸  Watch the full video by Huntington Ingalls Industries:  https://t.co/oY1X2ol6RD  https://t.co/nwXS6JQUFd",en,"[{'screen_name': 'usnavy', 'name': 'u.s. navy', 'id': '54885400'}]",['https://www.youtube.com/watch?v=zK64mViAWiE'],[],4,9,45,[],[],https://twitter.com/GovGianforte/status/1503490920896884737,False,,1,https://pbs.twimg.com/ext_tw_video_thumb/1503490291956797440/pu/img/uM09CUZ7w1E4u1cc.jpg,,,,,,,[],,,,
1503436502520393728,1503436502520393728,2022-03-14 14:22:49 Eastern Daylight Time,2022-03-14,14:22:49,-0400,1343969773726494721,govgianforte,Governor Greg Gianforte,,"🚨 Great news -- Montana’s unemployment rate hit an all-time low of 2.7% in January.   We’ll continue to invest in developing our workforce and making Montana an even better place to live, work, and raise a family.",en,[],[],[],49,9,100,[],[],https://twitter.com/GovGianforte/status/1503436502520393728,False,,0,,,,,,,,[],,,,
1503421339037691908,1503421339037691908,2022-03-14 13:22:34 Eastern Daylight Time,2022-03-14,13:22:34,-0400,1343969773726494721,govgianforte,Governor Greg Gianforte,,Cyndi and Lesley are fantastic advocates for Montana ag. I’m proud to partner with them both to help Montana producers capture more of the tremendous value they create.  https://t.co/b6Mp1ZhZNH,en,[],['https://www.agupdate.com/theprairiestar/news/state-and-regional/pair-of-montana-ag-organizations-sit-women-in-leadership-roles-for-the-first-time/article_5a835f92-9f5c-11ec-960b-bbb5b3ef230e.html#tracking-source=home-top-story'],[],4,2,15,[],[],https://twitter.com/GovGianforte/status/1503421339037691908,False,,0,,,,,,,,[],,,,
1503157592842932231,1503157592842932231,2022-03-13 19:54:32 Eastern Daylight Time,2022-03-13,19:54:32,-0400,1343969773726494721,govgianforte,Governor Greg Gianforte,,What a weekend for the Cats! #MontanaProud,en,[],[],[],11,2,26,['montanaproud'],[],https://twitter.com/GovGianforte/status/1503157592842932231,False,https://twitter.com/MSUBobcats/status/1502868772004118528,0,,,,,,,,[],,,,
1502662717097713668,1502662717097713668,2022-03-12 10:08:04 Eastern Standard Time,2022-03-12,10:08:04,-0400,1343969773726494721,govgianforte,Governor Greg Gianforte,,"Congratulations, @MSUBobcatsWBB! #GoCatsGo",en,"[{'screen_name': 'msubobcatswbb', 'name': 'montana state wbb', 'id': '68454783'}]",[],[],2,3,17,['gocatsgo'],[],https://twitter.com/GovGianforte/status/1502662717097713668,False,https://twitter.com/MSUBobcatsWBB/status/1502402069910630402,0,,,,,,,,[],,,,
1502410301739741185,1502410301739741185,2022-03-11 17:25:04 Eastern Standard Time,2022-03-11,17:25:04,-0400,1343969773726494721,govgianforte,Governor Greg Gianforte,,"When disaster strikes and our communities are in need, the @MontanaRedCross is there. This month, we celebrate their lifesaving mission. #RedCrossMonth",en,"[{'screen_name': 'montanaredcross', 'name': 'montana red cross', 'id': '26860237'}]",[],[],6,3,22,['redcrossmonth'],[],https://twitter.com/GovGianforte/status/1502410301739741185,False,,0,,,,,,,,[],,,,
1502121820845064196,1502121820845064196,2022-03-10 22:18:44 Eastern Standard Time,2022-03-10,22:18:44,-0400,1343969773726494721,govgianforte,Governor Greg Gianforte,,Any teacher that wants to start their career in Montana should be able to. Our TEACH Act makes that easier.  https://t.co/PwV0eOp1Ln,en,[],['https://www.mtpr.org/montana-news/2022-03-10/new-incentive-program-aims-to-raise-salaries-for-early-career-teachers-in-montana'],[],19,6,35,[],[],https://twitter.com/GovGianforte/status/1502121820845064196,False,,0,,,,,,,,[],,,,
1502048873325465601,1502048873325465601,2022-03-10 17:28:52 Eastern Standard Time,2022-03-10,17:28:52,-0400,1343969773726494721,govgianforte,Governor Greg Gianforte,,"By investing in value-added ag, we can help Montana producers keep pace with a transforming ag industry and capture more of the tremendous value they create.   I look forward to seeing what these businesses are able to accomplish with this investment.  https://t.co/Qkt7yDHYQO",en,[],[],['https://pbs.twimg.com/media/FNhZOpCVQAAU0Vp.jpg'],2,4,25,[],[],https://twitter.com/GovGianforte/status/1502048873325465601,False,,1,https://pbs.twimg.com/media/FNhZOpCVQAAU0Vp.jpg,,,,,,,[],,,,
1502002885453770755,1502002885453770755,2022-03-10 14:26:08 Eastern Standard Time,2022-03-10,14:26:08,-0400,1343969773726494721,govgianforte,Governor Greg Gianforte,,"As federal policies continue to drive inflation higher, our charge in Montana remains clear: lower taxes and cut red tape so hardworking Montanans can keep more of what they earn.  https://t.co/SDbZXoq7aw",en,[],['https://www.foxbusiness.com/economy/consumer-price-inflation-keep-climbing'],[],28,7,43,[],[],https://twitter.com/GovGianforte/status/1502002885453770755,False,,0,,,,,,,,[],,,,
1501990984946618378,1501990984946618378,2022-03-10 13:38:51 Eastern Standard Time,2022-03-10,13:38:51,-0400,1343969773726494721,govgianforte,Governor Greg Gianforte,,"Today and every day, we’re grateful for Montana’s first responders who step up at a moment’s notice to protect our communities.  https://t.co/vufGeplC0c",en,[],[],[],6,7,39,[],[],https://twitter.com/GovGianforte/status/1501990984946618378,False,,1,https://pbs.twimg.com/ext_tw_video_thumb/1501990444179197958/pu/img/yPUGVnRLHXdQJ21R.jpg,,,,,,,[],,,,
1501956264342941698,1501956264342941698,2022-03-10 11:20:53 Eastern Standard Time,2022-03-10,11:20:53,-0400,1343969773726494721,govgianforte,Governor Greg Gianforte,,We’re accepting nominations for a vacancy in the Twentieth Judicial District judgeship. (Lake County and Sanders County)  Apply at  https://t.co/lSM8n4p162.,en,[],['http://nominatejudges.mt.gov/vacancies'],[],5,6,16,[],[],https://twitter.com/GovGianforte/status/1501956264342941698,False,,0,,,,,,,,[],,,,
1501738223604617218,1501738223604617218,2022-03-09 20:54:28 Eastern Standard Time,2022-03-09,20:54:28,-0400,1343969773726494721,govgianforte,Governor Greg Gianforte,,A highlight from last week: this group of young Montanans and their service to our health care heroes. #MontanaProud  https://t.co/u5goHvIyG5,en,[],[],[],5,4,21,['montanaproud'],[],https://twitter.com/GovGianforte/status/1501738223604617218,False,,1,https://pbs.twimg.com/ext_tw_video_thumb/1501737858498850822/pu/img/majpWrLQnIsgU1qr.jpg,,,,,,,[],,,,
1501724286943440896,1501724286943440896,2022-03-09 19:59:05 Eastern Standard Time,2022-03-09,19:59:05,-0400,1343969773726494721,govgianforte,Governor Greg Gianforte,,"Congratulations, Staff Sgt. Yocom. Thank you for your service to our state and nation.",en,[],[],[],2,1,33,[],[],https://twitter.com/GovGianforte/status/1501724286943440896,False,https://twitter.com/GuardMontana/status/1500965088903061507,0,,,,,,,,[],,,,
1501689372130770944,1501689372130770944,2022-03-09 17:40:21 Eastern Standard Time,2022-03-09,17:40:21,-0400,1343969773726494721,govgianforte,Governor Greg Gianforte,,"My take on the Biden administration’s ""30 by 30"" initiative -- long on philosophy, short on detail. Montana will not participate.  https://t.co/3KTZHOkPI0",en,[],['https://news.mt.gov/Governors-Office/Gov_Gianforte_Montana_Will_Not_Participate_in_Bidens_30_By_30_Initiative'],[],57,14,80,[],[],https://twitter.com/GovGianforte/status/1501689372130770944,False,,0,,,,,,,,[],,,,
1501650461039808514,1501650461039808514,2022-03-09 15:05:43 Eastern Standard Time,2022-03-09,15:05:43,-0400,1343969773726494721,govgianforte,Governor Greg Gianforte,,"I campaigned on the promise of doing better by our starting teachers, and we’re delivering.  https://t.co/BEWvmWqs1e",en,[],['https://helenair.com/news/state-and-regional/govt-and-politics/new-law-to-boost-teacher-pay-could-increase-salaries-for-451-educators-next-school-year/article_83861cbe-dfc2-5d61-94fd-2d4e219bc454.html#tncms-source=login'],[],9,8,21,[],[],https://twitter.com/GovGianforte/status/1501650461039808514,False,,0,,,,,,,,[],,,,
1501594254920990725,1501594254920990725,2022-03-09 11:22:23 Eastern Standard Time,2022-03-09,11:22:23,-0400,1343969773726494721,govgianforte,Governor Greg Gianforte,,.@JoeBiden could and should do two things RIGHT NOW to bring down gas prices and make America energy independent.   1. Reinstate the Keystone XL Pipeline which he canceled on his first day.   2. End his ban and allow new oil and gas leasing on federal land.,en,"[{'screen_name': 'joebiden', 'name': 'joe biden', 'id': '939091'}]",[],[],141,34,190,[],[],https://twitter.com/GovGianforte/status/1501594254920990725,False,,0,,,,,,,,[],,,,
1501342601483407362,1501342601483407362,2022-03-08 18:42:24 Eastern Standard Time,2022-03-08,18:42:24,-0400,1343969773726494721,govgianforte,Governor Greg Gianforte,,"Great to be at Helena College today to mark the launch of Montana’s newest CTE program in the finishing trades.   Together, we’re building a stronger workforce and creating greater opportunities for hardworking Montanans.  https://t.co/j3tPvTdWmc",en,[],[],['https://pbs.twimg.com/media/FNXW9TmUUAIOlnl.jpg'],11,2,14,[],[],https://twitter.com/GovGianforte/status/1501342601483407362,False,,1,https://pbs.twimg.com/media/FNXW9TmUUAIOlnl.jpg,,,,,,,[],,,,
1501277237131112448,1501277237131112448,2022-03-08 14:22:40 Eastern Standard Time,2022-03-08,14:22:40,-0400,1343969773726494721,govgianforte,Governor Greg Gianforte,,"I’m thankful today for the strong women in my family and the opportunity to serve Montana alongside our state's second elected female lieutenant governor, Kristen Juras. #InternationalWomensDay",en,[],[],[],6,4,19,['internationalwomensday'],[],https://twitter.com/GovGianforte/status/1501277237131112448,False,https://twitter.com/GovGianforte/status/1498795216894971905,0,,,,,,,,[],,,,
1501235089002287105,1501235089002287105,2022-03-08 11:35:11 Eastern Standard Time,2022-03-08,11:35:11,-0400,1343969773726494721,govgianforte,Governor Greg Gianforte,,Hardworking Montanans stand ready to make America energy secure and independent.   Our adversaries are the only beneficiaries when we aren't expanding production and supply here at home.,en,[],[],[],66,16,85,[],[],https://twitter.com/GovGianforte/status/1501235089002287105,False,,0,,,,,,,,[],,,,
1500990965577920531,1500990965577920531,2022-03-07 19:25:07 Eastern Standard Time,2022-03-07,19:25:07,-0400,1343969773726494721,govgianforte,Governor Greg Gianforte,,"Glad to visit the Helena Indian Alliance Clinic today to learn about its work to provide affordable, high-quality health care and mental health services to our Native and non-native neighbors.  https://t.co/Q6cLolvKUO",en,[],[],"['https://pbs.twimg.com/media/FNSXUvaWQAUhb4G.jpg', 'https://pbs.twimg.com/media/FNSXUvaWUAEvuNC.jpg']",9,3,31,[],[],https://twitter.com/GovGianforte/status/1500990965577920531,False,,1,https://pbs.twimg.com/media/FNSXUvaWQAUhb4G.jpg,,,,,,,[],,,,
1500944479603232777,1500944479603232777,2022-03-07 16:20:24 Eastern Standard Time,2022-03-07,16:20:24,-0400,1343969773726494721,govgianforte,Governor Greg Gianforte,,"Susan and I are saddened to learn of the passing of Representative Frank Fleming. To honor his life and service to our state, I have ordered flags at the State Capitol to fly at half-staff from sunrise to sunset tomorrow. We are praying for his family and loved ones.",en,[],[],[],4,6,33,[],[],https://twitter.com/GovGianforte/status/1500944479603232777,False,,0,,,,,,,,[],,,,
1500893765157851137,1500893765157851137,2022-03-07 12:58:53 Eastern Standard Time,2022-03-07,12:58:53,-0400,1343969773726494721,govgianforte,Governor Greg Gianforte,,"Drug addiction and the crimes associated with it are devastating Montana communities. Working together, we can help folks struggling with addiction get clean and healthy and build safer, stronger communities.  https://t.co/l6ArEnmMNe",en,[],[],[],9,8,22,[],[],https://twitter.com/GovGianforte/status/1500893765157851137,False,,1,https://pbs.twimg.com/ext_tw_video_thumb/1500893639941128193/pu/img/1dsVc7Qhe9UWi1e8.jpg,,,,,,,[],,,,
1500510923022213125,1500510923022213125,2022-03-06 11:37:36 Eastern Standard Time,2022-03-06,11:37:36,-0400,1343969773726494721,govgianforte,Governor Greg Gianforte,,"No one better embodies our Montana values and commitment to service than our veterans. Thank you for your service, Dave.   https://t.co/Kz91AAiE7j",en,[],['https://www.laureloutlook.com/content/laurel-vet-continues-family-legacy-military-service-helping-community'],[],19,5,32,[],[],https://twitter.com/GovGianforte/status/1500510923022213125,False,,0,,,,,,,,[],,,,
