id,conversation_id,created_at,date,time,timezone,user_id,username,name,place,tweet,language,mentions,urls,photos,replies_count,retweets_count,likes_count,hashtags,cashtags,link,retweet,quote_url,video,thumbnail,near,geo,source,user_rt_id,user_rt,retweet_id,reply_to,retweet_date,translate,trans_src,trans_dest
1491109700964065280,1491109700964065280,2022-02-08 13:00:30 Eastern Standard Time,2022-02-08,13:00:30,-0400,1343969773726494721,govgianforte,Governor Greg Gianforte,,"Human trafficking has no place in Montana. Working with @MTAGKnudsen, and through our partnership with Town Pump and the LifeGuard Group, we’re working to raise awareness and bring an end to these despicable crimes.  https://t.co/0ZUCxeFjy2",en,"[{'screen_name': 'mtagknudsen', 'name': 'austin knudsen', 'id': '1058597778'}]",['https://apnews.com/article/montana-billings-human-trafficking-criminal-investigations-40f90247fb5a643ca2205978b05dedf1'],[],23,9,50,[],[],https://twitter.com/GovGianforte/status/1491109700964065280,False,,0,,,,,,,,[],,,,
1490847265455747073,1490847265455747073,2022-02-07 19:37:41 Eastern Standard Time,2022-02-07,19:37:41,-0400,1343969773726494721,govgianforte,Governor Greg Gianforte,,Happy to welcome Girl Scouts to the Capitol today and order some boxes of Thin Mints for Susan and me.  https://t.co/zXDY39prNc,en,[],[],['https://pbs.twimg.com/media/FLCNgoEVIAAh_Ib.jpg'],22,9,81,[],[],https://twitter.com/GovGianforte/status/1490847265455747073,False,,1,https://pbs.twimg.com/media/FLCNgoEVIAAh_Ib.jpg,,,,,,,[],,,,
1490823983016468481,1490823983016468481,2022-02-07 18:05:10 Eastern Standard Time,2022-02-07,18:05:10,-0400,1343969773726494721,govgianforte,Governor Greg Gianforte,,"We're inviting qualified health care professionals to move to Montana, serve in our communities, help reduce the burden on existing workers, and ensure Montanans have access to high-quality care.   Learn more about the program at  https://t.co/45Xd50xm4x.",en,[],['http://careinmontana.com'],[],30,7,47,[],[],https://twitter.com/GovGianforte/status/1490823983016468481,False,,0,,,,,,,,[],,,,
1490781251992580098,1490781251992580098,2022-02-07 15:15:22 Eastern Standard Time,2022-02-07,15:15:22,-0400,1343969773726494721,govgianforte,Governor Greg Gianforte,,"By expanding broadband access, Montanans will have greater access to opportunities for employment, health care, and education, and businesses in every corner of our state will be able to grow, prosper, and create more good-paying Montana jobs.  https://t.co/SEzMW1Fuv1",en,[],['https://news.mt.gov/Governors-Office/Montana_Moves_Closer_to_Closing_Digital_Divide'],[],39,11,20,[],[],https://twitter.com/GovGianforte/status/1490781251992580098,False,,0,,,,,,,,[],,,,
1490037597468512270,1490037597468512270,2022-02-05 14:00:21 Eastern Standard Time,2022-02-05,14:00:21,-0400,1343969773726494721,govgianforte,Governor Greg Gianforte,,"We came in with the Montana Comeback Plan, we’ve been executing it, and it’s working.   Our unemployment rate is the lowest it’s ever been, and more Montanans are working than ever before in our state’s history.  https://t.co/BaJmtrnPNQ",en,[],['https://www.kulr8.com/news/governor-gianforte-talks-unemployment-business-numbers-in-billings/article_bd7933b4-8554-11ec-8600-0788fc210065.html'],[],38,10,45,[],[],https://twitter.com/GovGianforte/status/1490037597468512270,False,,0,,,,,,,,[],,,,
1489727634888032256,1489727634888032256,2022-02-04 17:28:40 Eastern Standard Time,2022-02-04,17:28:40,-0400,1343969773726494721,govgianforte,Governor Greg Gianforte,,".@IR_PhilDrake invited himself over for dinner, and we had a great time. Come over any time, Phil!  https://t.co/qFeCKkL0gb",en,"[{'screen_name': 'ir_phildrake', 'name': 'phil drake', 'id': '2357287176'}]",['https://helenair.com/news/local/gianfortes-love-of-cooking-centers-on-wild-game/article_ac603781-5de3-5cc4-8fa6-3cd95242c45f.html#tracking-source=home-top-story'],[],25,6,36,[],[],https://twitter.com/GovGianforte/status/1489727634888032256,False,,0,,,,,,,,[],,,,
1489696714139357186,1489696714139357186,2022-02-04 15:25:48 Eastern Standard Time,2022-02-04,15:25:48,-0400,1343969773726494721,govgianforte,Governor Greg Gianforte,,Value-added ag helps producers capture more of the value they create and strengthens our ag industry.   We’ll continue promoting great value-added operations like Montana Craft Malt in Butte.  https://t.co/u8yLgU3UPb,en,[],['https://mtstandard.com/news/local/governor-highlights-value-added-ag-at-montana-craft-malt-tour/article_5bc094dd-ce3d-5125-9568-c00ce0baf353.html#tracking-source=home-top-story'],[],5,0,13,[],[],https://twitter.com/GovGianforte/status/1489696714139357186,False,,0,,,,,,,,[],,,,
1489440957955248132,1489440957955248132,2022-02-03 22:29:31 Eastern Standard Time,2022-02-03,22:29:31,-0400,1343969773726494721,govgianforte,Governor Greg Gianforte,,Wishing the four Montana athletes competing in the Winter Olympics great success. You make Montana and our country proud.,en,[],[],[],7,6,76,[],[],https://twitter.com/GovGianforte/status/1489440957955248132,False,,0,,,,,,,,[],,,,
1489416549203124224,1489416549203124224,2022-02-03 20:52:32 Eastern Standard Time,2022-02-03,20:52:32,-0400,1343969773726494721,govgianforte,Governor Greg Gianforte,,"Enjoyed talking about our Montana economic comeback with ag leaders, job creators, and @marctshort for the Coalition to Protect American Workers’ stop in Billings.  We'll keep cutting taxes and red tape so businesses can thrive and Montanans can prosper in good-paying jobs.  https://t.co/tk8AEDnK9E",en,"[{'screen_name': 'marctshort', 'name': 'marc short', 'id': '722796121353883649'}]",[],"['https://pbs.twimg.com/media/FKt4auPXsAMoMid.jpg', 'https://pbs.twimg.com/media/FKt4aujX0AM5Uus.jpg', 'https://pbs.twimg.com/media/FKt4awtXwAM7VHC.jpg', 'https://pbs.twimg.com/media/FKt4awyXoAgfnmM.jpg']",21,4,14,[],[],https://twitter.com/GovGianforte/status/1489416549203124224,False,,1,https://pbs.twimg.com/media/FKt4auPXsAMoMid.jpg,,,,,,,[],,,,
1489391747310526473,1489391747310526473,2022-02-03 19:13:58 Eastern Standard Time,2022-02-03,19:13:58,-0400,1343969773726494721,govgianforte,Governor Greg Gianforte,,"The ExxonMobil refinery in Billings helps fuel farmers, ranchers, and Montanans across our state. Great to stop in and visit with the hardworking folks there while in Billings today.  https://t.co/kdb67ZlrFK",en,[],[],['https://pbs.twimg.com/media/FKth4LjXMAIF7Mn.jpg'],15,5,35,[],[],https://twitter.com/GovGianforte/status/1489391747310526473,False,,1,https://pbs.twimg.com/media/FKth4LjXMAIF7Mn.jpg,,,,,,,[],,,,
1489357119975534596,1489357119975534596,2022-02-03 16:56:22 Eastern Standard Time,2022-02-03,16:56:22,-0400,1343969773726494721,govgianforte,Governor Greg Gianforte,,"Inflation is a tax on hardworking Montana families, including our farmers and ranchers.   It’s time for the federal government to turn off the spigot of out of control spending that’s driving up inflation.  https://t.co/ark82tznHZ",en,[],['https://www.kbzk.com/news/local-news/inflation-affecting-livestock-products-from-the-ranch-to-grocery-store-aisles'],[],75,12,80,[],[],https://twitter.com/GovGianforte/status/1489357119975534596,False,,0,,,,,,,,[],,,,
1489282633444040710,1489282633444040710,2022-02-03 12:00:24 Eastern Standard Time,2022-02-03,12:00:24,-0400,1343969773726494721,govgianforte,Governor Greg Gianforte,,"Great to tour Montana Craft Malt in Butte yesterday.   Using locally-sourced ingredients, Montana Craft Malt adds value to our commodities right here in Montana, while supporting families with good-paying jobs.  https://t.co/FdQ3qxnvCz",en,[],[],"['https://pbs.twimg.com/media/FKr-p3tXMAMp2VJ.jpg', 'https://pbs.twimg.com/media/FKr-p3xXoAQAVs7.jpg', 'https://pbs.twimg.com/media/FKr-p3tWUAAl4pl.jpg']",8,4,36,[],[],https://twitter.com/GovGianforte/status/1489282633444040710,False,,1,https://pbs.twimg.com/media/FKr-p3tXMAMp2VJ.jpg,,,,,,,[],,,,
1488997849924780049,1488997849924780049,2022-02-02 17:08:46 Eastern Standard Time,2022-02-02,17:08:46,-0400,1343969773726494721,govgianforte,Governor Greg Gianforte,,"Our grounds and maintenance crews keep the State Capitol in great shape for all Montanans to enjoy. Today, I was glad to stop by and thank them for the work they do.  https://t.co/y3Zpv1jHbQ",en,[],[],"['https://pbs.twimg.com/media/FKn7pQCXIAQ6D7D.jpg', 'https://pbs.twimg.com/media/FKn7pQDXEAkW0ov.jpg', 'https://pbs.twimg.com/media/FKn7pQBXoAEXthV.jpg']",11,6,42,[],[],https://twitter.com/GovGianforte/status/1488997849924780049,False,,1,https://pbs.twimg.com/media/FKn7pQCXIAQ6D7D.jpg,,,,,,,[],,,,
1488931825250668548,1488931825250668548,2022-02-02 12:46:24 Eastern Standard Time,2022-02-02,12:46:24,-0400,1343969773726494721,govgianforte,Governor Greg Gianforte,,Our veterans and their families have sacrificed so much in defense of our freedoms and our way of life.   I’m honored to recognize 31 outstanding Montana veterans who served their country and continued the commitment to service in our communities.    https://t.co/79r5H2VYaJ  https://t.co/Lf0YHpPENQ,en,[],['https://news.mt.gov/Governors-Office/Gov_Gianforte_Announces_Recipients_of_Veteran_Commendation'],"['https://pbs.twimg.com/media/FKm8g-jVUAARMc7.jpg', 'https://pbs.twimg.com/media/FKm8g-iVcAQgYNp.jpg']",18,7,25,[],[],https://twitter.com/GovGianforte/status/1488931825250668548,False,,1,https://pbs.twimg.com/media/FKm8g-jVUAARMc7.jpg,,,,,,,[],,,,
1488912795609358338,1488912795609358338,2022-02-02 11:30:47 Eastern Standard Time,2022-02-02,11:30:47,-0400,1343969773726494721,govgianforte,Governor Greg Gianforte,,"We were the first state to announce an end to federal supplemental unemployment benefits and launch a Return To Work bonus program.   As a result, thousands of Montanans moved off of unemployment and back into the workforce with good-paying jobs.",en,[],[],[],57,11,68,[],[],https://twitter.com/GovGianforte/status/1488912795609358338,False,https://twitter.com/MTDLI1/status/1488905060503404544,0,,,,,,,,[],,,,
1488665664164225026,1488665664164225026,2022-02-01 19:08:47 Eastern Standard Time,2022-02-01,19:08:47,-0400,1343969773726494721,govgianforte,Governor Greg Gianforte,,"The best part of Montana is Montanans. When we find people doing exceptional things for our state, we want to honor them.   That’s what our Spirit of Montana award is all about.  https://t.co/rbfW5OAZvv",en,[],[],[],8,3,40,[],[],https://twitter.com/GovGianforte/status/1488665664164225026,False,,1,https://pbs.twimg.com/ext_tw_video_thumb/1488665411851743232/pu/img/KZYhJSH_CZbYvpFu.jpg,,,,,,,[],,,,
1488636275447894017,1488636275447894017,2022-02-01 17:12:00 Eastern Standard Time,2022-02-01,17:12:00,-0400,1343969773726494721,govgianforte,Governor Greg Gianforte,,"Health care facilities in rural Montana are bracing for the impacts of @JoeBiden's vaccine mandate for health care workers.  To protect Montanans’ access to heath care, I call on the Biden administration to exercise discretion in enforcing its overbearing mandate.",en,"[{'screen_name': 'joebiden', 'name': 'joe biden', 'id': '939091'}]",[],[],78,16,105,[],[],https://twitter.com/GovGianforte/status/1488636275447894017,False,,0,,,,,,,,[],,,,
1488627707651006470,1488627707651006470,2022-02-01 16:37:57 Eastern Standard Time,2022-02-01,16:37:57,-0400,1343969773726494721,govgianforte,Governor Greg Gianforte,,"The goal of our Angel Initiative is two-fold: reduce the stigma associated with substance abuse treatment, and guide more individuals on the path to recovery.  I'm grateful for the partnership of @LCSOHelenaMT as we implement this program here in Helena and across the state.  https://t.co/wCIKVGk6si",en,"[{'screen_name': 'lcsohelenamt', 'name': ""lewis & clark county sheriff's office"", 'id': '4922726953'}]",[],"['https://pbs.twimg.com/media/FKirAGbWUAYciT7.jpg', 'https://pbs.twimg.com/media/FKirAGcXEAI1TFd.jpg']",2,4,18,[],[],https://twitter.com/GovGianforte/status/1488627707651006470,False,,1,https://pbs.twimg.com/media/FKirAGbWUAYciT7.jpg,,,,,,,[],,,,
1488273283875229696,1488273283875229696,2022-01-31 17:09:36 Eastern Standard Time,2022-01-31,17:09:36,-0400,1343969773726494721,govgianforte,Governor Greg Gianforte,,"An outlier in the world, the CDC recommends masking 2-year-old kids, and they're paying the price.   Enough is enough, @cdcdirector. Let parents decide what's best for their kids.",en,"[{'screen_name': 'cdcdirector', 'name': 'rochelle walensky, md, mph', 'id': '426909329'}]",[],[],59,21,143,[],[],https://twitter.com/GovGianforte/status/1488273283875229696,False,,0,,,,,,,,[],,,,
1488256553803153410,1488256553803153410,2022-01-31 16:03:07 Eastern Standard Time,2022-01-31,16:03:07,-0400,1343969773726494721,govgianforte,Governor Greg Gianforte,,"Vaccines remain the best protection against serious illness from COVID-19. I encourage Montanans who haven’t been vaccinated yet to consult with their health care provider about getting a safe, effective COVID-19 vaccine.",en,[],[],[],104,24,91,[],[],https://twitter.com/GovGianforte/status/1488256553803153410,False,,0,,,,,,,,[],,,,
