id,conversation_id,created_at,date,time,timezone,user_id,username,name,place,tweet,language,mentions,urls,photos,replies_count,retweets_count,likes_count,hashtags,cashtags,link,retweet,quote_url,video,thumbnail,near,geo,source,user_rt_id,user_rt,retweet_id,reply_to,retweet_date,translate,trans_src,trans_dest
1499895165393145860,1499895165393145860,2022-03-04 18:50:48 Eastern Standard Time,2022-03-04,18:50:48,-0400,1343969773726494721,govgianforte,Governor Greg Gianforte,,"Thanks to the hardworking team at @MontanaFWP, who are modernizing state government to better serve Montanans. The new MyFWP mobile app brings a new layer of convenience to our hunters and anglers.   https://t.co/p3RnDLHb1L",en,"[{'screen_name': 'montanafwp', 'name': 'montana fwp', 'id': '15679505'}]",['https://helenair.com/news/state-and-regional/govt-and-politics/fwp-launches-new-app-for-hunters-anglers/article_6cb151d4-a718-5a90-81e4-9a24b6a63cb8.html'],[],50,3,24,[],[],https://twitter.com/GovGianforte/status/1499895165393145860,False,,0,,,,,,,,[],,,,
1499848155596132355,1499848155596132355,2022-03-04 15:44:00 Eastern Standard Time,2022-03-04,15:44:00,-0400,1343969773726494721,govgianforte,Governor Greg Gianforte,,"Today, I ordered the flag of Ukraine to fly at the State Capitol. In Montana, we #StandWithUkraine.  https://t.co/wsVTNp9Spz",en,[],[],['https://pbs.twimg.com/media/FNCH8ihVcAAEe-0.jpg'],328,67,565,['standwithukraine'],[],https://twitter.com/GovGianforte/status/1499848155596132355,False,,1,https://pbs.twimg.com/media/FNCH8ihVcAAEe-0.jpg,,,,,,,[],,,,
1499843074867941377,1499843074867941377,2022-03-04 15:23:49 Eastern Standard Time,2022-03-04,15:23:49,-0400,1343969773726494721,govgianforte,Governor Greg Gianforte,,Great meeting with students at Whitehall High School this morning. They're doing great work through the school's CTE classes to develop some of the skills they’ll carry with them for the rest of their lives.  https://t.co/dh8vKgApyJ,en,[],[],"['https://pbs.twimg.com/media/FNCDUsLUYAEPCNp.jpg', 'https://pbs.twimg.com/media/FNCDUsLVcAE7Qoo.jpg', 'https://pbs.twimg.com/media/FNCDUsQUYAM_HRA.jpg']",3,4,29,[],[],https://twitter.com/GovGianforte/status/1499843074867941377,False,,1,https://pbs.twimg.com/media/FNCDUsLUYAEPCNp.jpg,,,,,,,[],,,,
1499812408570777608,1499812408570777608,2022-03-04 13:21:58 Eastern Standard Time,2022-03-04,13:21:58,-0400,1343969773726494721,govgianforte,Governor Greg Gianforte,,"By boosting public-private partnerships and getting non-violent offenders into treatment, we'll build safer, stronger communities. Thanks to Missoula leaders who brought their ideas to the table, including County Attorney Pabst and Sens @EllieHill, @Shannon4Montana &amp; Diane Sands.  https://t.co/Z6PiYbNYCW",en,"[{'screen_name': 'elliehill', 'name': 'senator ellie boldman', 'id': '17037258'}, {'screen_name': 'shannon4montana', 'name': ""shannon o'brien"", 'id': '1139665868009250816'}]",[],[],5,2,18,[],[],https://twitter.com/GovGianforte/status/1499812408570777608,False,,1,https://pbs.twimg.com/ext_tw_video_thumb/1499811935377711106/pu/img/3lfhSBWGEYbkH4bc.jpg,,,,,,,[],,,,
1499544688776278016,1499544688776278016,2022-03-03 19:38:08 Eastern Standard Time,2022-03-03,19:38:08,-0400,1343969773726494721,govgianforte,Governor Greg Gianforte,,"Aviation connects Montanans to the rest of the nation and the world and helps drives our flourishing and diverse economy. It was great visiting with aviation leaders to talk about our partnership in making Montana an even better place to live, work, and raise a family.  https://t.co/yW0uEHaT3N",en,[],[],['https://pbs.twimg.com/media/FM9z8dUUYAEUEgm.jpg'],15,5,15,[],[],https://twitter.com/GovGianforte/status/1499544688776278016,False,,1,https://pbs.twimg.com/media/FM9z8dUUYAEUEgm.jpg,,,,,,,[],,,,
1499523397520224256,1499523397520224256,2022-03-03 18:13:32 Eastern Standard Time,2022-03-03,18:13:32,-0400,1343969773726494721,govgianforte,Governor Greg Gianforte,,"Great to bring together law enforcement officers, local officials, and treatment advocates to address how we can make Missoula, and all Montana communities, safer and stronger.  https://t.co/bkEj1qrsyu",en,[],[],"['https://pbs.twimg.com/media/FM9gd1sVIAAdSOh.jpg', 'https://pbs.twimg.com/media/FM9gd2LUUA01Phk.jpg', 'https://pbs.twimg.com/media/FM9gd22UUBMcCwB.jpg']",8,5,33,[],[],https://twitter.com/GovGianforte/status/1499523397520224256,False,,1,https://pbs.twimg.com/media/FM9gd1sVIAAdSOh.jpg,,,,,,,[],,,,
1499429527147061279,1499429527147061279,2022-03-03 12:00:31 Eastern Standard Time,2022-03-03,12:00:31,-0400,1343969773726494721,govgianforte,Governor Greg Gianforte,,"Look forward to sitting down with local officials and law enforcement leaders today to discuss what’s working, what’s not, and how we can build a safer, stronger Missoula.   https://t.co/iSGffqOSX6",en,[],['https://nbcmontana.com/news/local/violent-crime-impacts-backlog-of-missoula-court-cases'],[],37,4,25,[],[],https://twitter.com/GovGianforte/status/1499429527147061279,False,,0,,,,,,,,[],,,,
1499421318378233867,1499421318378233867,2022-03-03 11:27:54 Eastern Standard Time,2022-03-03,11:27:54,-0400,1343969773726494721,govgianforte,Governor Greg Gianforte,,"Good morning, Missoula!  https://t.co/ukH7Ua2KDH",en,[],[],"['https://pbs.twimg.com/media/FM8DvI7VIBY172X.jpg', 'https://pbs.twimg.com/media/FM8DvI6UUAI0uAr.jpg']",17,5,35,[],[],https://twitter.com/GovGianforte/status/1499421318378233867,False,,1,https://pbs.twimg.com/media/FM8DvI7VIBY172X.jpg,,,,,,,[],,,,
1499205308115132417,1499205308115132417,2022-03-02 21:09:33 Eastern Standard Time,2022-03-02,21:09:33,-0400,1343969773726494721,govgianforte,Governor Greg Gianforte,,Our future is bright with these young Montanans.  https://t.co/bdsFu7lGYZ,en,[],['https://www.ktvq.com/news/local-news/elysian-students-in-billings-honored-by-gianforte-for-kindness-shown-to-health-care-workers'],[],29,5,16,[],[],https://twitter.com/GovGianforte/status/1499205308115132417,False,,0,,,,,,,,[],,,,
1499175240533954565,1499175240533954565,2022-03-02 19:10:05 Eastern Standard Time,2022-03-02,19:10:05,-0400,1343969773726494721,govgianforte,Governor Greg Gianforte,,"Great to join friends at MACo’s Midwinter Conference today to discuss how we can make Montana an even better place to live, work, and raise a family.  https://t.co/7e9W8AZyyj",en,[],[],['https://pbs.twimg.com/media/FM4j7iLXwAMSdb-.jpg'],35,5,31,[],[],https://twitter.com/GovGianforte/status/1499175240533954565,False,,1,https://pbs.twimg.com/media/FM4j7iLXwAMSdb-.jpg,,,,,,,[],,,,
1499142628872359937,1499142628872359937,2022-03-02 17:00:30 Eastern Standard Time,2022-03-02,17:00:30,-0400,1343969773726494721,govgianforte,Governor Greg Gianforte,,"Today I formally launched the process of divesting Russian assets held by the State of Montana, including $15 million already identified by the Montana Board of Investments. Montana stands with Ukraine.  https://t.co/ET5DhLGrp5",en,[],[],['https://pbs.twimg.com/media/FM4GRgOUcAI2UEC.jpg'],78,28,234,[],[],https://twitter.com/GovGianforte/status/1499142628872359937,False,,1,https://pbs.twimg.com/media/FM4GRgOUcAI2UEC.jpg,,,,,,,[],,,,
1499125938554130434,1499125938554130434,2022-03-02 15:54:10 Eastern Standard Time,2022-03-02,15:54:10,-0400,1343969773726494721,govgianforte,Governor Greg Gianforte,,"Supporting our health care heroes, these Billings middle schoolers sent gift bags and encouraging notes to 50 nurses in their community over the holidays last year.   Today, I was glad to honor them with a Spirit of Montana award. #MontanaProud  https://t.co/UKsWcvDnwV",en,[],[],['https://pbs.twimg.com/media/FM33FzzXMAYDoOn.jpg'],15,4,20,['montanaproud'],[],https://twitter.com/GovGianforte/status/1499125938554130434,False,,1,https://pbs.twimg.com/media/FM33FzzXMAYDoOn.jpg,,,,,,,[],,,,
1499075839442370563,1499075839442370563,2022-03-02 12:35:06 Eastern Standard Time,2022-03-02,12:35:06,-0400,1343969773726494721,govgianforte,Governor Greg Gianforte,,"Last night, @IAGovernor Kim Reynolds contrasted Republican governors' successes against dysfunction in DC. We’re leading the nation’s economic recovery, reaffirming the role of parents in education, and putting our faith in the American people - not government. Well done, Kim!",en,"[{'screen_name': 'iagovernor', 'name': 'gov. kim reynolds', 'id': '851808935397011456'}]",[],[],65,6,46,[],[],https://twitter.com/GovGianforte/status/1499075839442370563,False,https://twitter.com/IAGovernor/status/1498876968087040005,0,,,,,,,,[],,,,
1498833161718960129,1498833161718960129,2022-03-01 20:30:47 Eastern Standard Time,2022-03-01,20:30:47,-0400,1343969773726494721,govgianforte,Governor Greg Gianforte,,"For the last year, the American people have looked to President Biden for the unity and bipartisanship he campaigned on and promised. Unfortunately, the president has bypassed bipartisanship, and the challenges we face have only grown more serious.  https://t.co/Pn1D3CNreN",en,[],[],['https://pbs.twimg.com/media/FMzs0DJVIAkbwrV.jpg'],228,17,103,[],[],https://twitter.com/GovGianforte/status/1498833161718960129,False,,1,https://pbs.twimg.com/media/FMzs0DJVIAkbwrV.jpg,,,,,,,[],,,,
1498819230342410244,1498819230342410244,2022-03-01 19:35:25 Eastern Standard Time,2022-03-01,19:35:25,-0400,1343969773726494721,govgianforte,Governor Greg Gianforte,,"Montana hunters and anglers can now access licenses, permits, and E-Tags through @MontanaFWP's new mobile app. Download the MyFWP app today --  ➡ App Store:  https://t.co/k7PyM7qFo9 ➡ Google Play:  https://t.co/9iaxVoHF7J",en,"[{'screen_name': 'montanafwp', 'name': 'montana fwp', 'id': '15679505'}]","['https://apps.apple.com/us/app/montana-myfwp/id1595675364', 'https://play.google.com/store/apps/details?id=com.fwp.deloittedctcustomerapp&raii=com.fwp.deloittedctcustomerapp']",[],92,2,9,[],[],https://twitter.com/GovGianforte/status/1498819230342410244,False,https://twitter.com/MontanaFWP/status/1498428757576613888,0,,,,,,,,[],,,,
1498795216894971905,1498795216894971905,2022-03-01 18:00:00 Eastern Standard Time,2022-03-01,18:00:00,-0400,1343969773726494721,govgianforte,Governor Greg Gianforte,,"From Sarah Bickford, to Mary Ronan, to Jeannette Rankin, to Alma Snell, Montana women have shaped our state's rich history. This #WomensHistoryMonth, we celebrate them.  https://t.co/EkO96uG8n5",en,[],[],['https://pbs.twimg.com/media/FMzJZKaUcAAGmwL.jpg'],38,9,45,['womenshistorymonth'],[],https://twitter.com/GovGianforte/status/1498795216894971905,False,,1,https://pbs.twimg.com/media/FMzJZKaUcAAGmwL.jpg,,,,,,,[],,,,
1498722440377028608,1498722440377028608,2022-03-01 13:10:49 Eastern Standard Time,2022-03-01,13:10:49,-0400,1343969773726494721,govgianforte,Governor Greg Gianforte,,No better way to kick off #NationalPancakeDay than with a short stack of huckleberry pancakes from Steve’s Cafe.🥞  https://t.co/pnX1JOUhbK,en,[],[],[],58,6,51,['nationalpancakeday'],[],https://twitter.com/GovGianforte/status/1498722440377028608,False,,1,https://pbs.twimg.com/ext_tw_video_thumb/1498721670541971457/pu/img/9cOLOG3sZn-r8q8s.jpg,,,,,,,[],,,,
1498696362992406528,1498696362992406528,2022-03-01 11:27:12 Eastern Standard Time,2022-03-01,11:27:12,-0400,1343969773726494721,govgianforte,Governor Greg Gianforte,,"A national treasure and the world’s first national park, @YellowstoneNPS turns 150 years old today. Every American should experience the beauty and wonder of Yellowstone in their lifetime. #Yellowstone150  📷: @YellowstoneNPS  https://t.co/yyRIL52CkJ",en,"[{'screen_name': 'yellowstonenps', 'name': 'yellowstone national park', 'id': '44992488'}, {'screen_name': 'yellowstonenps', 'name': 'yellowstone national park', 'id': '44992488'}]",[],"['https://pbs.twimg.com/media/FMxvUqjUUAI761d.jpg', 'https://pbs.twimg.com/media/FMxvXKZVgAIdBIK.jpg', 'https://pbs.twimg.com/media/FMxvY6FUYAMEigQ.jpg', 'https://pbs.twimg.com/media/FMxwHZcVkAIpSlG.jpg']",130,15,93,['yellowstone150'],[],https://twitter.com/GovGianforte/status/1498696362992406528,False,,1,https://pbs.twimg.com/media/FMxvUqjUUAI761d.jpg,,,,,,,[],,,,
1498449554496184327,1498449554496184327,2022-02-28 19:06:28 Eastern Standard Time,2022-02-28,19:06:28,-0400,1343969773726494721,govgianforte,Governor Greg Gianforte,,"For generations, Montana has stirred the creativity of artists, young and old. Celebrating that tradition, we’re displaying the artwork of talented young Montanans in the State Capitol throughout the month of March. Come by and see them!  https://t.co/okZVgx6vuA",en,[],[],"['https://pbs.twimg.com/media/FMuP6TbX0AE0W8y.jpg', 'https://pbs.twimg.com/media/FMuP6TbXsAAOpZb.jpg', 'https://pbs.twimg.com/media/FMuP6TcWYAEAXUG.jpg', 'https://pbs.twimg.com/media/FMuP6UoX0AoZ3nV.jpg']",10,4,18,[],[],https://twitter.com/GovGianforte/status/1498449554496184327,False,,1,https://pbs.twimg.com/media/FMuP6TbX0AE0W8y.jpg,,,,,,,[],,,,
1498422121474576386,1498422121474576386,2022-02-28 17:17:27 Eastern Standard Time,2022-02-28,17:17:27,-0400,1343969773726494721,govgianforte,Governor Greg Gianforte,,"The State of Montana is reviewing assets and operations that may benefit Vladimir Putin, his cadre of profiting oligarchs, and his vicious war machine. Montana stands with Ukraine.",en,[],[],[],168,23,311,[],[],https://twitter.com/GovGianforte/status/1498422121474576386,False,,0,,,,,,,,[],,,,
1498414704531705859,1498414704531705859,2022-02-28 16:47:59 Eastern Standard Time,2022-02-28,16:47:59,-0400,1343969773726494721,govgianforte,Governor Greg Gianforte,,Modernizing the way state government does business allows us to better serve Montanans and remains a top priority as we lead the #MontanaComeback. I look forward to the convenience the new MyFWP app will bring Montana hunters and anglers.   https://t.co/aZx8Glpcpy  https://t.co/pJ0FyO6udb,en,[],['http://fwp.mt.gov/myfwpapp'],['https://pbs.twimg.com/media/FMtvvYgVcAErWUD.jpg'],8,5,27,['montanacomeback'],[],https://twitter.com/GovGianforte/status/1498414704531705859,False,,1,https://pbs.twimg.com/media/FMtvvYgVcAErWUD.jpg,,,,,,,[],,,,
1498385750693498886,1498385750693498886,2022-02-28 14:52:56 Eastern Standard Time,2022-02-28,14:52:56,-0400,1343969773726494721,govgianforte,Governor Greg Gianforte,,"While #CTEMonth is ending today, our work to prepare young Montanans for the jobs of tomorrow sure isn’t.   We’ll continue to encourage personalized work-based learning paths in our schools so every student can grow, thrive, and reach his or her full potential.  https://t.co/mx966TP4R5",en,[],[],['https://pbs.twimg.com/media/FMtV5FxXwAYaR8y.jpg'],7,4,21,['ctemonth'],[],https://twitter.com/GovGianforte/status/1498385750693498886,False,,1,https://pbs.twimg.com/media/FMtV5FxXwAYaR8y.jpg,,,,,,,[],,,,
1498334393898725376,1498334393898725376,2022-02-28 11:28:51 Eastern Standard Time,2022-02-28,11:28:51,-0400,1343969773726494721,govgianforte,Governor Greg Gianforte,,"Meet Vance and Nicholas. These young entrepreneurs run Park Woof Pack, a dog manufacturing and sales business, with their Park High classmates. #MontanaProud  https://t.co/mZEmLvE9Jk",en,[],[],[],18,8,36,['montanaproud'],[],https://twitter.com/GovGianforte/status/1498334393898725376,False,,1,https://pbs.twimg.com/ext_tw_video_thumb/1498334034518102017/pu/img/zTdk6FmvCJB5uX7c.jpg,,,,,,,[],,,,
1497707744802918401,1497707744802918401,2022-02-26 17:58:47 Eastern Standard Time,2022-02-26,17:58:47,-0400,1343969773726494721,govgianforte,Governor Greg Gianforte,,Putin underestimated the resolve of freedom-loving Ukrainians. Montana stands with the people of Ukraine as they demonstrate unparalleled bravery and courage in the face of an egregious act of war.,en,[],[],[],84,24,270,[],[],https://twitter.com/GovGianforte/status/1497707744802918401,False,,0,,,,,,,,[],,,,
1497322023483105282,1497322023483105282,2022-02-25 16:26:03 Eastern Standard Time,2022-02-25,16:26:03,-0400,1343969773726494721,govgianforte,Governor Greg Gianforte,,"When you couple the Montana work ethic with the tools folks need to thrive in the jobs of today and the future, the result is a highly qualified, highly skilled workforce that can only be found here in the Treasure State.  https://t.co/VFQNhjhRuV",en,[],['https://news.mt.gov/Governors-Office/Gov_Gianforte_Awards_605000_for_Workforce_Training_Apprenticeship_Programs'],[],19,8,34,[],[],https://twitter.com/GovGianforte/status/1497322023483105282,False,,0,,,,,,,,[],,,,
1497008912435793920,1497008912435793920,2022-02-24 19:41:52 Eastern Standard Time,2022-02-24,19:41:52,-0400,1343969773726494721,govgianforte,Governor Greg Gianforte,,"The Montana brand is too often lost as we export our high-quality ag products. I'm encouraged by @MontanaState's work to preserve the Montana brand, add value to our commodities, and help Montana producers capture more of the value they create.  https://t.co/iP2akqnOsp",en,"[{'screen_name': 'montanastate', 'name': 'montana state university', 'id': '224367026'}]",['https://nbcmontana.com/news/local/governor-gets-taste-of-montana-agriculture-research'],[],14,3,20,[],[],https://twitter.com/GovGianforte/status/1497008912435793920,False,,0,,,,,,,,[],,,,
1496954328984154119,1496954328984154119,2022-02-24 16:04:58 Eastern Standard Time,2022-02-24,16:04:58,-0400,1343969773726494721,govgianforte,Governor Greg Gianforte,,Cheers to adding value to Montana's world-class ag products.  https://t.co/BtFVGLn8K3,en,[],[],[],4,3,25,[],[],https://twitter.com/GovGianforte/status/1496954328984154119,False,,1,https://pbs.twimg.com/ext_tw_video_thumb/1496953403926138881/pu/img/E6BKCqGR4Z9h8bZr.jpg,,,,,,,[],,,,
1496919996143849473,1496919996143849473,2022-02-24 13:48:33 Eastern Standard Time,2022-02-24,13:48:33,-0400,1343969773726494721,govgianforte,Governor Greg Gianforte,,"Montana stands with the freedom-loving people of Ukraine. It is time to respond immediately with strict, comprehensive sanctions against Russia.  https://t.co/faIR4UEgbX",en,[],[],['https://pbs.twimg.com/media/FMYgtX2VEAAvOmf.jpg'],61,12,157,[],[],https://twitter.com/GovGianforte/status/1496919996143849473,False,,1,https://pbs.twimg.com/media/FMYgtX2VEAAvOmf.jpg,,,,,,,[],,,,
1496706578484924424,1496706578484924424,2022-02-23 23:40:30 Eastern Standard Time,2022-02-23,23:40:30,-0400,1343969773726494721,govgianforte,Governor Greg Gianforte,,"Tonight we pray for the safety of the sovereign, freedom-loving people of Ukraine. May God bless, watch over, and protect them.",en,[],[],[],25,30,303,[],[],https://twitter.com/GovGianforte/status/1496706578484924424,False,,0,,,,,,,,[],,,,
1496631841842860032,1496631841842860032,2022-02-23 18:43:31 Eastern Standard Time,2022-02-23,18:43:31,-0400,1343969773726494721,govgianforte,Governor Greg Gianforte,,"A heartbreaking reminder of the consequences of addiction. To any anyone struggling with addiction, know that you're not alone. Treatment and recovery are an option. There are folks who are ready to help you now.  https://t.co/AjcoREtINE",en,[],['https://helenair.com/news/local/lewis-and-clark-sheriff-four-dead-from-pills-laced-with-fentanyl/article_36ec8240-1554-5c3e-9e11-762b7202717f.html'],[],4,2,15,[],[],https://twitter.com/GovGianforte/status/1496631841842860032,False,,0,,,,,,,,[],,,,
1496611535237619716,1496611535237619716,2022-02-23 17:22:50 Eastern Standard Time,2022-02-23,17:22:50,-0400,1343969773726494721,govgianforte,Governor Greg Gianforte,,"The innovative, value-added ag research taking place at @MontanaState helps our producers keep pace with a transforming agricultural industry. I appreciated hearing from students today about their outstanding research.  https://t.co/rBeMLfUhib",en,"[{'screen_name': 'montanastate', 'name': 'montana state university', 'id': '224367026'}]",[],"['https://pbs.twimg.com/media/FMUIQGPXsAUzCF8.jpg', 'https://pbs.twimg.com/media/FMUIQGIXsBE0fJ4.jpg', 'https://pbs.twimg.com/media/FMUIQGpXMAAtZLv.jpg', 'https://pbs.twimg.com/media/FMUIQGoX0Ak73-f.jpg']",4,1,15,[],[],https://twitter.com/GovGianforte/status/1496611535237619716,False,,1,https://pbs.twimg.com/media/FMUIQGPXsAUzCF8.jpg,,,,,,,[],,,,
1496558846235615237,1496558846235615237,2022-02-23 13:53:28 Eastern Standard Time,2022-02-23,13:53:28,-0400,1343969773726494721,govgianforte,Governor Greg Gianforte,,Great to welcome Israel’s Consul General to the Pacific Northwest @ShlomiKofman to the State Capitol today. Montana stands with Israel. 🇺🇸🇮🇱  https://t.co/JTiqslc7Gd,en,"[{'screen_name': 'shlomikofman', 'name': 'shlomi kofman 🇮🇱', 'id': '1869493315'}]",[],['https://pbs.twimg.com/media/FMTYVOuX0AQoo8c.jpg'],13,4,44,[],[],https://twitter.com/GovGianforte/status/1496558846235615237,False,,1,https://pbs.twimg.com/media/FMTYVOuX0AQoo8c.jpg,,,,,,,[],,,,
1496545465219022848,1496545465219022848,2022-02-23 13:00:18 Eastern Standard Time,2022-02-23,13:00:18,-0400,1343969773726494721,govgianforte,Governor Greg Gianforte,,"Montana’s health care system depends on a highly-skilled workforce trained to deliver the highest quality of care to Montanans. Our investment in @CarrollCollege will help build a stronger, more robust health care workforce for the future.  https://t.co/YHP5PUqHbL",en,"[{'screen_name': 'carrollcollege', 'name': 'carroll college', 'id': '22585714'}]",['https://helenair.com/news/local/education/gianforte-presents-440k-for-scholarships-at-carroll-college/article_fea1b681-260f-56f8-8b98-2b652d720a0b.html#tncms-source=login'],[],40,5,27,[],[],https://twitter.com/GovGianforte/status/1496545465219022848,False,,0,,,,,,,,[],,,,
1496527825452642305,1496527825452642305,2022-02-23 11:50:12 Eastern Standard Time,2022-02-23,11:50:12,-0400,1343969773726494721,govgianforte,Governor Greg Gianforte,,"Embodying the spirit of Montana, the Sand Coulee Volunteer Fire Department stepped up to serve and protect their neighbors during the Gibson Flats Fire.   I appreciated joining them for a burger last night in Stockett and saying thanks for their heroic work.  https://t.co/z5utVxAkwi",en,[],[],"['https://pbs.twimg.com/media/FMS8HVMWYAkuS3u.jpg', 'https://pbs.twimg.com/media/FMS8HVfWUAUUHhp.jpg', 'https://pbs.twimg.com/media/FMS8HWuXEA8Fqrl.jpg', 'https://pbs.twimg.com/media/FMS8HWrXsAQWH0r.jpg']",13,6,32,[],[],https://twitter.com/GovGianforte/status/1496527825452642305,False,,1,https://pbs.twimg.com/media/FMS8HVMWYAkuS3u.jpg,,,,,,,[],,,,
1496234509330567168,1496234509330567168,2022-02-22 16:24:40 Eastern Standard Time,2022-02-22,16:24:40,-0400,1343969773726494721,govgianforte,Governor Greg Gianforte,,"Great work by @MTDNRCFIRE. Last year, DNRC more than doubled forested acres treated by the state to reduce wildfire risk and improve forest health.",en,"[{'screen_name': 'mtdnrcfire', 'name': 'mt dnrc fire', 'id': '329942101'}]",[],[],8,5,23,[],[],https://twitter.com/GovGianforte/status/1496234509330567168,False,https://twitter.com/MTDNRCFIRE/status/1496231550769573889,0,,,,,,,,[],,,,
1496219241762197507,1496219241762197507,2022-02-22 15:24:00 Eastern Standard Time,2022-02-22,15:24:00,-0400,1343969773726494721,govgianforte,Governor Greg Gianforte,,"To ensure Montana kids have access to the best education available, we’re investing in classroom innovation, individualized and work-based learning, and higher starting pay for educators.  Thank you to Montana educators and parents, especially during #PublicSchoolsWeek.  https://t.co/a2Q53PxKtV",en,[],[],"['https://pbs.twimg.com/media/FMOhAXZUUAAol8y.jpg', 'https://pbs.twimg.com/media/FMOhAXaVgAQx7Gw.jpg', 'https://pbs.twimg.com/media/FMOhAXaVcAgi-Uk.jpg']",19,6,40,['publicschoolsweek'],[],https://twitter.com/GovGianforte/status/1496219241762197507,False,,1,https://pbs.twimg.com/media/FMOhAXZUUAAol8y.jpg,,,,,,,[],,,,
1496210913287888909,1496210913287888909,2022-02-22 14:50:54 Eastern Standard Time,2022-02-22,14:50:54,-0400,1343969773726494721,govgianforte,Governor Greg Gianforte,,"At the Montana Board of Education meeting last fall, I urged colleges and universities to embrace workforce development programs like Accelerate Montana that empower students with in-demand skills.  Today, I’m thrilled to announce this partnership is expanding to @CarrollCollege.  https://t.co/RoQAY4vM8P",en,"[{'screen_name': 'carrollcollege', 'name': 'carroll college', 'id': '22585714'}]",[],[],9,5,25,[],[],https://twitter.com/GovGianforte/status/1496210913287888909,False,,1,https://pbs.twimg.com/ext_tw_video_thumb/1496210649549983744/pu/img/aBSFw8qnSvTwkQNa.jpg,,,,,,,[],,,,
1495907093953806337,1495907093953806337,2022-02-21 18:43:38 Eastern Standard Time,2022-02-21,18:43:38,-0400,1343969773726494721,govgianforte,Governor Greg Gianforte,,"Public-private programs like Accelerate Montana hold the key to developing a highly-skilled, highly-qualified workforce in Montana.   With our investment, 5,000 Montanans will be trained in critical industries like construction and health care.  https://t.co/FipSjNDSfO",en,[],['https://missoulian.com/news/local/6-million-workforce-training-grant-aims-to-develop-high-demand-skills-in-montana/article_0d93668f-e4ae-5320-a5e4-81ea759508a0.html'],[],15,4,21,[],[],https://twitter.com/GovGianforte/status/1495907093953806337,False,,0,,,,,,,,[],,,,
1495810714845560849,1495810714845560849,2022-02-21 12:20:39 Eastern Standard Time,2022-02-21,12:20:39,-0400,1343969773726494721,govgianforte,Governor Greg Gianforte,,"On the eve of George Washington’s birthday, we celebrate presidents throughout U.S. history who have made America the greatest country on Earth. #PresidentsDay  https://t.co/UDFkXCAl8J",en,[],[],['https://pbs.twimg.com/media/FMIuMbpVUAIWbPl.jpg'],17,7,49,['presidentsday'],[],https://twitter.com/GovGianforte/status/1495810714845560849,False,,1,https://pbs.twimg.com/media/FMIuMbpVUAIWbPl.jpg,,,,,,,[],,,,
