id,conversation_id,created_at,date,time,timezone,user_id,username,name,place,tweet,language,mentions,urls,photos,replies_count,retweets_count,likes_count,hashtags,cashtags,link,retweet,quote_url,video,thumbnail,near,geo,source,user_rt_id,user_rt,retweet_id,reply_to,retweet_date,translate,trans_src,trans_dest
1342485535944802305,1342485535944802305,2020-12-25 10:01:08 Eastern Standard Time,2020-12-25,10:01:08,-0400,1056790982,coattnygeneral,Colorado Attorney General,,Wishing you Happy Holidays from Colorado Attorney General Phil Weiser and the Colorado Department of Law. ❄️🎄  https://t.co/rhN5zqbkPM,en,[],[],['https://pbs.twimg.com/media/EqF3es1XAAADGoz.png'],0,0,8,[],[],https://twitter.com/COAttnyGeneral/status/1342485535944802305,False,,1,https://pbs.twimg.com/media/EqF3es1XAAADGoz.png,,,,,,,[],,,,
1340101300265082880,1340101300265082880,2020-12-18 20:07:02 Eastern Standard Time,2020-12-18,20:07:02,-0400,1056790982,coattnygeneral,Colorado Attorney General,,"AG @pweiser today announced he has been coordinating with ticket sellers to ensure Colorado consumers receive refunds for events that were canceled due to the COVID-19 pandemic. If you have been improperly denied a refund, report it to @StopFraudCo.     https://t.co/31EdGr4lq9  https://t.co/lhJ23XYkZH",en,"[{'screen_name': 'pweiser', 'name': 'phil weiser', 'id': '20489155'}, {'screen_name': 'stopfraudco', 'name': 'stop fraud colorado', 'id': '2828445091'}]",['https://bit.ly/3r9mRuM'],['https://pbs.twimg.com/media/Epj_B28W4AMHhpK.jpg'],0,2,8,[],[],https://twitter.com/COAttnyGeneral/status/1340101300265082880,False,,1,https://pbs.twimg.com/media/Epj_B28W4AMHhpK.jpg,,,,,,,[],,,,
1339692606738067456,1339692606738067456,2020-12-17 17:03:02 Eastern Standard Time,2020-12-17,17:03:02,-0400,1056790982,coattnygeneral,Colorado Attorney General,,TODAY: We led a coalition of 38 state attorneys general in a lawsuit against @Google for illegally maintaining its monopoly power over search engines:  https://t.co/qAuwerVdYV  #AGGoogleLawsuit  https://t.co/0B6S29y3Oy,en,"[{'screen_name': 'google', 'name': 'google', 'id': '20536157'}]",['https://bit.ly/2WpqXRj'],['https://pbs.twimg.com/media/EpeLUyZW8AIURX-.jpg'],1,3,2,['aggooglelawsuit'],[],https://twitter.com/COAttnyGeneral/status/1339692606738067456,False,,1,https://pbs.twimg.com/media/EpeLUyZW8AIURX-.jpg,,,,,,,[],,,,
1339413409222205440,1339291191729254400,2020-12-16 22:33:36 Eastern Standard Time,2020-12-16,22:33:36,-0400,1056790982,coattnygeneral,Colorado Attorney General,,@allisonsherry Hmm was that a technical on Great British Baking Show?,en,[],[],[],1,0,2,[],[],https://twitter.com/COAttnyGeneral/status/1339413409222205440,False,,0,,,,,,,,"[{'screen_name': 'allisonsherry', 'name': 'Allison Sherry', 'id': '176589375'}]",,,,
1338574533930995716,1338574533930995716,2020-12-14 15:00:13 Eastern Standard Time,2020-12-14,15:00:13,-0400,1056790982,coattnygeneral,Colorado Attorney General,,"Our office is committed to supporting digital equity &amp; online safety, necessities the COVID-19 pandemic has heightened in our state.   Join AG @pweiser from 12-1 p.m. Dec. 15 to learn more about how we &amp; Comcast will support online learning in Colorado.   https://t.co/pFwGRPiqEv",en,"[{'screen_name': 'pweiser', 'name': 'phil weiser', 'id': '20489155'}]",['https://internetessentialseducation-cr.splashthat.com/?linkId=106644599'],[],0,3,7,[],[],https://twitter.com/COAttnyGeneral/status/1338574533930995716,False,,0,,,,,,,,[],,,,
1337185361689276416,1337185361689276416,2020-12-10 19:00:08 Eastern Standard Time,2020-12-10,19:00:08,-0400,1056790982,coattnygeneral,Colorado Attorney General,,Happy Hanukkah to all who celebrate. May your holiday season be filled with love and light.   #HappyHanukkah #HanukkahSameach  https://t.co/4vbnqpanxZ,en,[],[],['https://pbs.twimg.com/media/Eo6i_6sWEAArXFn.png'],1,0,4,"['happyhanukkah', 'hanukkahsameach']",[],https://twitter.com/COAttnyGeneral/status/1337185361689276416,False,,1,https://pbs.twimg.com/media/Eo6i_6sWEAArXFn.png,,,,,,,[],,,,
1337167403340316673,1337167403340316673,2020-12-10 17:48:46 Eastern Standard Time,2020-12-10,17:48:46,-0400,1056790982,coattnygeneral,Colorado Attorney General,,"AG @pweiser today joined 22 states in opposing Texas’ undemocratic effort to invalidate 2020 election results in GA, MI, PA, and WI, stating the Texas lawsuit undermines states’ authority to conduct elections and overturns the will of the voters.    https://t.co/HgtOxyj5Nu  https://t.co/blzH8SFlKe",en,"[{'screen_name': 'pweiser', 'name': 'phil weiser', 'id': '20489155'}]",['https://coag.gov/press-releases/12-10-20/'],['https://pbs.twimg.com/media/Eo6PrBTVgAEq8SC.jpg'],22,26,198,[],[],https://twitter.com/COAttnyGeneral/status/1337167403340316673,False,,1,https://pbs.twimg.com/media/Eo6PrBTVgAEq8SC.jpg,,,,,,,[],,,,
1336761273531256832,1336761273531256832,2020-12-09 14:54:58 Eastern Standard Time,2020-12-09,14:54:58,-0400,1056790982,coattnygeneral,Colorado Attorney General,,"BREAKING: For over a decade, @Facebook has used its dominance and monopoly power to stifle competition and reduce consumer privacy.    That's why our office is playing a lead role in a multistate lawsuit seeking to end Facebook’s illegal monopoly.   https://t.co/D89tZQcrTD  https://t.co/w22WiQW4wZ",en,"[{'screen_name': 'facebook', 'name': 'facebook', 'id': '217804739'}]",['https://coag.gov/press-releases/12-9-20/'],['https://pbs.twimg.com/media/Eo0g7JwVQAEChbC.jpg'],4,6,14,[],[],https://twitter.com/COAttnyGeneral/status/1336761273531256832,False,,1,https://pbs.twimg.com/media/Eo0g7JwVQAEChbC.jpg,,,,,,,[],,,,
1336006695479230464,1336006695479230464,2020-12-07 12:56:32 Eastern Standard Time,2020-12-07,12:56:32,-0400,1056790982,coattnygeneral,Colorado Attorney General,,"AG @pweiser today announced a multistate settlement with Nationstar Mortgage. After the mortgage servicer violated consumer protection laws, negatively impacting many lives, this settlement provides nearly $1.5 million in restitution to Colorado borrowers.  https://t.co/gVL9yybPJz  https://t.co/AGwQInJ2Ns",en,"[{'screen_name': 'pweiser', 'name': 'phil weiser', 'id': '20489155'}]",['https://coag.gov/press-releases/12-7-20/'],['https://pbs.twimg.com/media/Eopy6cdU8AEe6w1.jpg'],1,1,5,[],[],https://twitter.com/COAttnyGeneral/status/1336006695479230464,False,,1,https://pbs.twimg.com/media/Eopy6cdU8AEe6w1.jpg,,,,,,,[],,,,
1334892104984612865,1334892104984612865,2020-12-04 11:07:33 Eastern Standard Time,2020-12-04,11:07:33,-0400,1056790982,coattnygeneral,Colorado Attorney General,,"Report shows fatal domestic violence incidents continued to increase in Colo. in 2019.  AG @pweiser says the data offers several vital lessons, including the toll these cases take on children. Recommendations include focusing resources on child survivors.  https://t.co/fSXMhRo5KC",en,"[{'screen_name': 'pweiser', 'name': 'phil weiser', 'id': '20489155'}]",['https://kdvr.com/news/local/new-report-reveals-domestic-violence-deaths-increasing-in-colorado/'],[],2,5,5,[],[],https://twitter.com/COAttnyGeneral/status/1334892104984612865,False,,0,,,,,,,,[],,,,
1333850300193521664,1333850295760084992,2020-12-01 14:07:47 Eastern Standard Time,2020-12-01,14:07:47,-0400,1056790982,coattnygeneral,Colorado Attorney General,,"You can read the report, which uncovers an additional 46 claims of abuse in Denver and Pueblo dioceses over last 70 years, here (WARNING: The report contains graphic and disturbing accounts of the sexual abuse of children):  https://t.co/QQQxQuMtaY  https://t.co/Auc8H7K7Ti",en,[],['https://coag.gov/app/uploads/2020/12/12.1.20-Final-Catholic-clergy-child-sexual-abuse-supplemental-report.pdf'],['https://pbs.twimg.com/media/EoLJvDgUYAAsz-l.jpg'],2,2,12,[],[],https://twitter.com/COAttnyGeneral/status/1333850300193521664,False,,1,https://pbs.twimg.com/media/EoLJvDgUYAAsz-l.jpg,,,,,,,[],,,,
1333850296766763009,1333850295760084992,2020-12-01 14:07:47 Eastern Standard Time,2020-12-01,14:07:47,-0400,1056790982,coattnygeneral,Colorado Attorney General,,change to how the Colorado dioceses protect children from sexual abuse...my sincerest hope is that this unique Colorado program has allowed survivors of sexual abuse by a priest to take one more step on the path to healing and recovery.”,en,[],[],[],2,1,12,[],[],https://twitter.com/COAttnyGeneral/status/1333850296766763009,False,,0,,,,,,,,[],,,,
1333850295760084992,1333850295760084992,2020-12-01 14:07:46 Eastern Standard Time,2020-12-01,14:07:46,-0400,1056790982,coattnygeneral,Colorado Attorney General,,"AG @pweiser on follow-up report on child sex abuse by Catholic clergy in Colorado released today:   “From the time we announced this program in February 2019, our goals were to support and comfort survivors of childhood sexual abuse by Catholic priests, and to bring meaningful...",en,"[{'screen_name': 'pweiser', 'name': 'phil weiser', 'id': '20489155'}]",[],[],6,7,43,[],[],https://twitter.com/COAttnyGeneral/status/1333850295760084992,False,,0,,,,,,,,[],,,,
1331962680450674688,1331962680450674688,2020-11-26 09:07:04 Eastern Standard Time,2020-11-26,09:07:04,-0400,1056790982,coattnygeneral,Colorado Attorney General,,"This holiday season, Attorney General @pweiser and the Colorado Department of Law are thankful to be serving the people of Colorado.   #Thanksgiving2020 #HappyThanksgiving  https://t.co/6RZDhPas54",en,"[{'screen_name': 'pweiser', 'name': 'phil weiser', 'id': '20489155'}]",[],['https://pbs.twimg.com/tweet_video_thumb/EnwU_oUW8AM8BIn.jpg'],3,2,18,"['thanksgiving2020', 'happythanksgiving']",[],https://twitter.com/COAttnyGeneral/status/1331962680450674688,False,,1,https://pbs.twimg.com/tweet_video_thumb/EnwU_oUW8AM8BIn.jpg,,,,,,,[],,,,
1331360958648885253,1331360958648885253,2020-11-24 17:16:02 Eastern Standard Time,2020-11-24,17:16:02,-0400,1056790982,coattnygeneral,Colorado Attorney General,,"Colo. will receive $200K in a multistate settlement with Home Depot, which also agreed to employ proper measures to protect its customers in the future after a data breach exposed the payment card information of consumers in Colo. &amp; nationwide. @pweiser  https://t.co/mZXLGvLCnK  https://t.co/88o6dALTuk",en,"[{'screen_name': 'pweiser', 'name': 'phil weiser', 'id': '20489155'}]",['https://coag.gov/press-releases/11-24-20/?utm_campaign=COAGSproutSocialCampaign&utm_content=1606256161&utm_medium=social&utm_source=twitter'],['https://pbs.twimg.com/media/EnnxvC9W4AEWcNd.jpg'],3,3,9,[],[],https://twitter.com/COAttnyGeneral/status/1331360958648885253,False,,1,https://pbs.twimg.com/media/EnnxvC9W4AEWcNd.jpg,,,,,,,[],,,,
1331001332292079619,1331001332292079619,2020-11-23 17:27:01 Eastern Standard Time,2020-11-23,17:27:01,-0400,1056790982,coattnygeneral,Colorado Attorney General,,"Did you know that the Ute people have been in Colorado for thousands of years? This Native American Heritage Month, learn about the original Coloradans from this @rmpbs project.  #NativeAmericanHeritageMonth     https://t.co/TTy7f6KSYT",en,"[{'screen_name': 'rmpbs', 'name': 'rocky mountain pbs', 'id': '9979202'}]",['https://youtu.be/lWLdijamdcQ'],[],0,8,26,['nativeamericanheritagemonth'],[],https://twitter.com/COAttnyGeneral/status/1331001332292079619,False,,0,,,,,,,,[],,,,
1330204964849913863,1329947854748536832,2020-11-21 12:42:32 Eastern Standard Time,2020-11-21,12:42:32,-0400,1056790982,coattnygeneral,Colorado Attorney General,,@JesseAPaul @allisonsherry The Shanghainese street noodles at Fortune Wok to Table are next level. And the chili relleno burrito at Taco de Mexico will give you a new lease on life,en,[],[],[],1,0,3,[],[],https://twitter.com/COAttnyGeneral/status/1330204964849913863,False,,0,,,,,,,,"[{'screen_name': 'JesseAPaul', 'name': 'Jesse Aaron Paul ☀', 'id': '499014804'}, {'screen_name': 'allisonsherry', 'name': 'Allison Sherry', 'id': '176589375'}]",,,,
1326588766824361992,1326588766824361992,2020-11-11 13:13:03 Eastern Standard Time,2020-11-11,13:13:03,-0400,1056790982,coattnygeneral,Colorado Attorney General,,"Today, we honor men and women at the Department of Law and throughout Colorado for their service to our nation.  #VeteransDay  https://t.co/B0n9whykc9",en,[],[],['https://pbs.twimg.com/media/Emj9c91XMAATrXF.png'],1,0,6,['veteransday'],[],https://twitter.com/COAttnyGeneral/status/1326588766824361992,False,,1,https://pbs.twimg.com/media/Emj9c91XMAATrXF.png,,,,,,,[],,,,
1326562624046329856,1326562624046329856,2020-11-11 11:29:10 Eastern Standard Time,2020-11-11,11:29:10,-0400,1056790982,coattnygeneral,Colorado Attorney General,,"Today, we honor men and women at the Department of Law and throughout Colorado for their service to our nation.  #VeteransDay  https://t.co/PaNZxUNQ0W",en,[],[],['https://pbs.twimg.com/media/EmjlrPzW8AARKcM.png'],0,1,4,['veteransday'],[],https://twitter.com/COAttnyGeneral/status/1326562624046329856,False,,1,https://pbs.twimg.com/media/EmjlrPzW8AARKcM.png,,,,,,,[],,,,
1325823344403509250,1325823344403509250,2020-11-09 10:31:32 Eastern Standard Time,2020-11-09,10:31:32,-0400,1056790982,coattnygeneral,Colorado Attorney General,,"We are committed to protecting health care for Coloradans, which is why we are fighting before #SCOTUS tomorrow to defend this law and the access to quality and affordable health care that the ACA has made possible.  #ProtectOurCare @pweiser  https://t.co/Rq2EMS9Glv",en,"[{'screen_name': 'pweiser', 'name': 'phil weiser', 'id': '20489155'}]",[],[],7,17,76,"['scotus', 'protectourcare']",[],https://twitter.com/COAttnyGeneral/status/1325823344403509250,False,,1,https://pbs.twimg.com/ext_tw_video_thumb/1325823216615628806/pu/img/ta4BmAhXbG_31m_3.jpg,,,,,,,[],,,,
