id,conversation_id,created_at,date,time,timezone,user_id,username,name,place,tweet,language,mentions,urls,photos,replies_count,retweets_count,likes_count,hashtags,cashtags,link,retweet,quote_url,video,thumbnail,near,geo,source,user_rt_id,user_rt,retweet_id,reply_to,retweet_date,translate,trans_src,trans_dest
1503393344256462852,1503393344256462852,2022-03-14 11:31:19 Eastern Daylight Time,2022-03-14,11:31:19,-0400,161138443,derekschmidtks,Derek Schmidt,,Thanks to Jennifer McDonald for the visit to her Jenny Dawn Cellars urban winery in Wichita. (The Kansas wines were delicious!) Great story of entrepreneurship turning an interest in wine into a successful small business.  https://t.co/it53SOjTxl,en,[],[],['https://pbs.twimg.com/media/FN0gOouWYAg41o_.jpg'],4,1,21,[],[],https://twitter.com/DerekSchmidtKS/status/1503393344256462852,False,,1,https://pbs.twimg.com/media/FN0gOouWYAg41o_.jpg,,,,,,,[],,,,
1503386800798187523,1503386699505803266,2022-03-14 11:05:19 Eastern Daylight Time,2022-03-14,11:05:19,-0400,161138443,derekschmidtks,Derek Schmidt,,"...how to approach a policy question. We have such a candidate in Derek Schmidt. Derek is a good friend with whom I served in the Kansas Senate, and I’m honored to support him in this race. Please join me in voting for Derek Schmidt for Governor.” Thanks Pat!",en,[],[],[],2,1,5,[],[],https://twitter.com/DerekSchmidtKS/status/1503386800798187523,False,,0,,,,,,,,[],,,,
1503386779176554498,1503386699505803266,2022-03-14 11:05:14 Eastern Daylight Time,2022-03-14,11:05:14,-0400,161138443,derekschmidtks,Derek Schmidt,,"We need a candidate that has the breadth and depth of experience to successfully administer the responsibilities of the Office of Governor of the Great State of Kansas. Perhaps most importantly, we need someone who trusts and listens to Kansans before he determines...",en,[],[],[],2,1,4,[],[],https://twitter.com/DerekSchmidtKS/status/1503386779176554498,False,,0,,,,,,,,[],,,,
1503386699505803266,1503386699505803266,2022-03-14 11:04:55 Eastern Daylight Time,2022-03-14,11:04:55,-0400,161138443,derekschmidtks,Derek Schmidt,,Former State Senator and former Kansas Corporation Commissioner Pat Apple has joined Team Schmidt:  “We need a Governor who understands and believes in personal responsibility and individual freedom and will protect our God-given rights.  https://t.co/DgL39Skwv8,en,[],[],['https://pbs.twimg.com/media/FN0aJHnWUAAJ-Ri.jpg'],4,1,8,[],[],https://twitter.com/DerekSchmidtKS/status/1503386699505803266,False,,1,https://pbs.twimg.com/media/FN0aJHnWUAAJ-Ri.jpg,,,,,,,[],,,,
1503352335065571336,1503352335065571336,2022-03-14 08:48:22 Eastern Daylight Time,2022-03-14,08:48:22,-0400,161138443,derekschmidtks,Derek Schmidt,,"Enjoyed visiting this past week with members of the Kansas Association of Insurance Agents (KAIA) who were visiting Topeka. Discussed tort reform, federal vaccine mandates, paying down KPERS debt, etc. Thanks for the invitation!  https://t.co/GDM7RurKBA",en,[],[],['https://pbs.twimg.com/media/FNz6-ULXEAIi3_Q.jpg'],2,0,11,[],[],https://twitter.com/DerekSchmidtKS/status/1503352335065571336,False,,1,https://pbs.twimg.com/media/FNz6-ULXEAIi3_Q.jpg,,,,,,,[],,,,
1503181816844492802,1503181795457744903,2022-03-13 21:30:47 Eastern Daylight Time,2022-03-13,21:30:47,-0400,161138443,derekschmidtks,Derek Schmidt,,"…[And] Schmidt wrote of a visit to the border in Texas with other state attorneys general. He said much of the violent crime in Kansas is connected to drug smuggling and human trafficking across the border.""   https://t.co/JiOwFotRJn",en,[],['https://www.salina.com/story/news/crime/2022/03/12/kansas-meth-prices-drop-amid-high-supply-drugs-mexico-kbi-drug-addiction-abuse/9432210002/?fbclid=IwAR2KhTH-IVkuDcFQsv0ybT3rvlEfCHh9EqBPboWJKsyuj9Z6MtztjNdTmG0'],[],3,2,10,[],[],https://twitter.com/DerekSchmidtKS/status/1503181816844492802,False,,0,,,,,,,,[],,,,
