id,conversation_id,created_at,date,time,timezone,user_id,username,name,place,tweet,language,mentions,urls,photos,replies_count,retweets_count,likes_count,hashtags,cashtags,link,retweet,quote_url,video,thumbnail,near,geo,source,user_rt_id,user_rt,retweet_id,reply_to,retweet_date,translate,trans_src,trans_dest
1210990374807842819,1210990374807842819,2019-12-28 13:26:19 Eastern Standard Time,2019-12-28,13:26:19,-0400,22159841,massago,Maura Healey,,Our regulations protect students and make sure that schools are honest. This settlement with @baystatecollege will provide hundreds of students who were misled with much needed relief.  https://t.co/cwzPCxQtuA,en,"[{'screen_name': 'baystatecollege', 'name': 'bay state college', 'id': '18194887'}]",['https://www.masslive.com/boston/2019/12/bay-state-college-settles-for-11-million-over-allegations-that-it-misled-students.html'],[],1,7,32,[],[],https://twitter.com/MassAGO/status/1210990374807842819,False,,0,,,,,,,,[],,,,
1210621473129295872,1210621473129295872,2019-12-27 13:00:26 Eastern Standard Time,2019-12-27,13:00:26,-0400,22159841,massago,Maura Healey,,"Here’s to businesses working to protect customers, employees, and their communities against gun violence. Thanks @gunsdownamerica.",en,"[{'screen_name': 'gunsdownamerica', 'name': 'guns down america', 'id': '768892734220349440'}]",[],[],9,7,19,[],[],https://twitter.com/MassAGO/status/1210621473129295872,False,https://twitter.com/GunsDownAmerica/status/1202270175124434944,0,,,,,,,,[],,,,
1210332389957783552,1210332389957783552,2019-12-26 17:51:43 Eastern Standard Time,2019-12-26,17:51:43,-0400,22159841,massago,Maura Healey,,"Boston lost a true leader. My deepest condolences to the loved ones of Councilor Chuck Turner. His pursuit of justice, equality, and opportunity for his community will continue to serve as an example to us all. Rest in Power.",en,[],[],[],7,6,64,[],[],https://twitter.com/MassAGO/status/1210332389957783552,False,,0,,,,,,,,[],,,,
1210298782899998720,1210298782899998720,2019-12-26 15:38:10 Eastern Standard Time,2019-12-26,15:38:10,-0400,22159841,massago,Maura Healey,,"This news is devastating. My thoughts are with those grieving the loss of this mother and her young children, and the first responders who rushed to the scene.   If you or someone you know is struggling, the @SamaritansHope statewide hotline is available 24/7 at 1-877-870-4673.",en,"[{'screen_name': 'samaritanshope', 'name': 'samaritans, inc.', 'id': '20397794'}]",[],[],3,14,52,[],[],https://twitter.com/MassAGO/status/1210298782899998720,False,https://twitter.com/WCVB/status/1210279150830923776,0,,,,,,,,[],,,,
1210281301434986496,1210281301434986496,2019-12-26 14:28:42 Eastern Standard Time,2019-12-26,14:28:42,-0400,22159841,massago,Maura Healey,,Best wishes to everyone celebrating the first day of #Kwanzaa. The next seven days are an opportunity to honor the culture and traditions of African Americans. I hope your celebration is one of love and #Umoja (unity).,en,[],[],[],0,7,41,"['kwanzaa', 'umoja']",[],https://twitter.com/MassAGO/status/1210281301434986496,False,,0,,,,,,,,[],,,,
1210221227870060544,1210221227870060544,2019-12-26 10:30:00 Eastern Standard Time,2019-12-26,10:30:00,-0400,22159841,massago,Maura Healey,,Do you know where your electricity comes from? Do want to promote clean energy? Learn more about ISO New England and sign the petition to help us move towards a clean energy future:  https://t.co/YLBjm1hEBk  https://t.co/CwkOYhKkgT,en,[],['http://bit.ly/isopetition'],[],1,7,12,[],[],https://twitter.com/MassAGO/status/1210221227870060544,False,,1,https://pbs.twimg.com/media/ELmQiB_XYAAPDh_.jpg,,,,,,,[],,,,
1210023590621376512,1210023590621376512,2019-12-25 21:24:39 Eastern Standard Time,2019-12-25,21:24:39,-0400,22159841,massago,Maura Healey,,Merry Christmas and Happy Holidays to you and your families. Even if you have nephews that scare you with stuffed frogs!  https://t.co/CalSqnMxOp,en,[],[],['https://pbs.twimg.com/media/EMreCPoUYAAC9-f.jpg'],3,6,133,[],[],https://twitter.com/MassAGO/status/1210023590621376512,False,,1,https://pbs.twimg.com/media/EMreCPoUYAAC9-f.jpg,,,,,,,[],,,,
1209495225254764544,1209495225254764544,2019-12-24 10:25:07 Eastern Standard Time,2019-12-24,10:25:07,-0400,22159841,massago,Maura Healey,,"This holiday season, I'm thinking about our immigrant communities. The families that have been separated, the children behind bars, the hardworking parents like @ooorrrenya's who the Trump Admin wants to rob of basic support. I see you and I am with you.  https://t.co/Le2yOvPZsM",en,"[{'screen_name': 'ooorrrenya', 'name': 'd.ureña', 'id': '22952774'}]",['https://www.bostonglobe.com/2019/12/06/opinion/i-am-public-servant-not-public-charge/'],[],22,21,115,[],[],https://twitter.com/MassAGO/status/1209495225254764544,False,,0,,,,,,,,[],,,,
1209273802829504518,1209272067499208706,2019-12-23 19:45:16 Eastern Standard Time,2019-12-23,19:45:16,-0400,22159841,massago,Maura Healey,,We will continue to go after e-cigarette retailers that ignore our laws and make it easy for minors to get a hold of their vaping products.    https://t.co/lG1Vfipbqb,en,[],['https://www.masslive.com/news/2019/12/ag-maura-healey-suing-8-online-e-cigarette-retailers-accused-of-selling-banned-products-to-massachusetts-consumers.html'],[],37,1,31,[],[],https://twitter.com/MassAGO/status/1209273802829504518,False,,0,,,,,,,,[],,,,
1209272067499208706,1209272067499208706,2019-12-23 19:38:22 Eastern Standard Time,2019-12-23,19:38:22,-0400,22159841,massago,Maura Healey,,"As Massachusetts leads the fight against the vaping public health crisis, eight online e-cigarette retailers have flagrantly violated our state's new flavor ban.   We cannot let these companies put our young people at risk. We're suing.  https://t.co/Wz2gDpWVzT",en,[],[],[],135,35,167,[],[],https://twitter.com/MassAGO/status/1209272067499208706,False,,1,https://pbs.twimg.com/ext_tw_video_thumb/1209272050067656704/pu/img/lwyrUCHizmCKSJ24.jpg,,,,,,,[],,,,
1209232024466317314,1209232024466317314,2019-12-23 16:59:15 Eastern Standard Time,2019-12-23,16:59:15,-0400,22159841,massago,Maura Healey,,"Tonight, as families kindle the lights for the second night, we celebrate the importance of family, and tradition, and the resilience of the human spirit.    Chag Sameach! #HappyHanukkah  https://t.co/P9CaVq0lIS",en,[],[],"['https://pbs.twimg.com/media/EMgOG-iWwAIR0d0.jpg', 'https://pbs.twimg.com/media/EMgOG-mXkAEq-7j.jpg']",3,4,30,['happyhanukkah'],[],https://twitter.com/MassAGO/status/1209232024466317314,False,,1,https://pbs.twimg.com/media/EMgOG-iWwAIR0d0.jpg,,,,,,,[],,,,
1208753808848896001,1208753808848896001,2019-12-22 09:19:00 Eastern Standard Time,2019-12-22,09:19:00,-0400,22159841,massago,Maura Healey,,"Petra is just the tip of the iceberg. In just this past year alone, our office has secured 6 convictions and recovered more than $12 million related to fraud in the home health industry.  https://t.co/UhB49BemSv",en,[],[],[],4,4,27,[],[],https://twitter.com/MassAGO/status/1208753808848896001,False,,1,https://pbs.twimg.com/amplify_video_thumb/1208089329890922496/img/rDmgoBtDpLB5ZFOd.jpg,,,,,,,[],,,,
1208408052157820929,1208408052157820929,2019-12-21 10:25:05 Eastern Standard Time,2019-12-21,10:25:05,-0400,22159841,massago,Maura Healey,,"Competitive electric suppliers have got to go. For too long, I've seen them target low-income people &amp; overcharge them by millions of dollars on their electric bills. I'm calling on DPU to investigate, and the legislature to ban these predatory companies.  https://t.co/nIsgjWI3Lr",en,[],['https://commonwealthmagazine.org/energy/healey-seeks-dpu-crackdown-on-electricity-sellers/'],[],10,14,71,[],[],https://twitter.com/MassAGO/status/1208408052157820929,False,,0,,,,,,,,[],,,,
1208104364532994049,1208104364532994049,2019-12-20 14:18:20 Eastern Standard Time,2019-12-20,14:18:20,-0400,22159841,massago,Maura Healey,,"The Trump Administration wants to legalize discrimination against LGBTQ parents looking to adopt. It breaks my heart. And together with other state attorneys general, we are fighting it.  https://t.co/FsRC8jSYVG  https://t.co/OkLB5Kth7F",en,[],['http://bit.ly/commentletterlgbtq'],['https://pbs.twimg.com/media/EMQMgtXXsAAXBFP.png'],2,14,50,[],[],https://twitter.com/MassAGO/status/1208104364532994049,False,,1,https://pbs.twimg.com/media/EMQMgtXXsAAXBFP.png,,,,,,,[],,,,
1208059517017186304,1208059517017186304,2019-12-20 11:20:08 Eastern Standard Time,2019-12-20,11:20:08,-0400,22159841,massago,Maura Healey,,"Yet again, the Trump Administration chose to represent polluters and not people.   They have illegally rolled back the Clean Water Rule, putting our public health, our environment, and our economy at risk. We are suing.  https://t.co/vLcCJVFFVX",en,[],[],[],16,65,186,[],[],https://twitter.com/MassAGO/status/1208059517017186304,False,,1,https://pbs.twimg.com/ext_tw_video_thumb/1208059413166198784/pu/img/3vGzeTgBUcvCEj6R.jpg,,,,,,,[],,,,
1207758386634330112,1207758386634330112,2019-12-19 15:23:33 Eastern Standard Time,2019-12-19,15:23:33,-0400,22159841,massago,Maura Healey,,"This morning, we arrested a couple that we believe exploited homeless people as part of a scheme to illegally bill MassHealth for over $540,000. This is disgraceful and wrong – and that’s why we took action to hold them accountable.  https://t.co/2A2XjvUpnR",en,[],['https://www.bostonglobe.com/2019/12/19/metro/chelmsford-couple-charged-with-medicaid-fraud-using-homeless-people-rip-off-scheme/'],[],4,10,45,[],[],https://twitter.com/MassAGO/status/1207758386634330112,False,,0,,,,,,,,[],,,,
1207736963266220033,1207736963266220033,2019-12-19 13:58:25 Eastern Standard Time,2019-12-19,13:58:25,-0400,22159841,massago,Maura Healey,,Thank you @SenMarkey! The TRACED Act will help us combat the seemingly endless onslaught of illegal robocalls.,en,"[{'screen_name': 'senmarkey', 'name': 'ed markey', 'id': '21406834'}]",[],[],2,8,90,[],[],https://twitter.com/MassAGO/status/1207736963266220033,False,https://twitter.com/SenMarkey/status/1207703472923119616,0,,,,,,,,[],,,,
1207723153046331395,1207723153046331395,2019-12-19 13:03:32 Eastern Standard Time,2019-12-19,13:03:32,-0400,22159841,massago,Maura Healey,,"Congratulations to Chief Jeff Farnsworth on your appointment as President of @MAPOLICECHIEFS, Chief Russell Stevens on your year of service, and @ChiefBrooksNPD on being awarded Chief of the Year. I am grateful to partner with the chiefs and I look forward to your leadership.  https://t.co/pIgPlRRNlL",en,"[{'screen_name': 'mapolicechiefs', 'name': 'massachusetts chiefs of police association', 'id': '2422581122'}, {'screen_name': 'chiefbrooksnpd', 'name': 'chief brooks', 'id': '1271241895'}]",[],"['https://pbs.twimg.com/media/EMKxyd5XYAEydrQ.jpg', 'https://pbs.twimg.com/media/EMKxyfgWkAEqYBt.jpg']",1,3,19,[],[],https://twitter.com/MassAGO/status/1207723153046331395,False,,1,https://pbs.twimg.com/media/EMKxyd5XYAEydrQ.jpg,,,,,,,[],,,,
1207455402817970178,1207455402817970178,2019-12-18 19:19:36 Eastern Standard Time,2019-12-18,19:19:36,-0400,22159841,massago,Maura Healey,,This fight isn’t over.   The Trump Administration is obsessed with taking away your health care. What they are doing is cruel—and illegal. We will do everything we can to stop them.,en,[],[],[],12,42,151,[],[],https://twitter.com/MassAGO/status/1207455402817970178,False,https://twitter.com/washingtonpost/status/1207427054582538241,0,,,,,,,,[],,,,
1207399429281648640,1207399429281648640,2019-12-18 15:37:10 Eastern Standard Time,2019-12-18,15:37:10,-0400,22159841,massago,Maura Healey,,The Sacklers pocketed billions of dollars from Purdue while thousands of people died from their addictive drugs. This is exactly why I refused their settlement – because it allows them to escape accountability.  https://t.co/C3tjikkhnq,en,[],[],[],2,9,49,[],[],https://twitter.com/MassAGO/status/1207399429281648640,False,,1,https://pbs.twimg.com/amplify_video_thumb/1207398625975906306/img/wcfDFr4qKP5QxHTc.jpg,,,,,,,[],,,,
